Protocol spec without prior Class and Subclass spec at line 23179

Bus 004 Device 001: ID 1d6b:0003 Linux Foundation 3.0 root hub
Device Descriptor:
  bLength                18
  bDescriptorType         1
  bcdUSB               3.10
  bDeviceClass            9 Hub
  bDeviceSubClass         0 Unused
  bDeviceProtocol         3 
  bMaxPacketSize0         9
  idVendor           0x1d6b Linux Foundation
  idProduct          0x0003 3.0 root hub
  bcdDevice            5.15
  iManufacturer           3 Linux 5.15.0-58-generic xhci-hcd
  iProduct                2 xHCI Host Controller
  iSerial                 1 --
  bNumConfigurations      1
  Configuration Descriptor:
    bLength                 9
    bDescriptorType         2
    wTotalLength           31
    bNumInterfaces          1
    bConfigurationValue     1
    iConfiguration          0 
    bmAttributes         0xe0
      Self Powered
      Remote Wakeup
    MaxPower                0mA
    Interface Descriptor:
      bLength                 9
      bDescriptorType         4
      bInterfaceNumber        0
      bAlternateSetting       0
      bNumEndpoints           1
      bInterfaceClass         9 Hub
      bInterfaceSubClass      0 Unused
      bInterfaceProtocol      0 Full speed (or root) hub
      iInterface              0 
      Endpoint Descriptor:
        bLength                 7
        bDescriptorType         5
        bEndpointAddress     0x81  EP 1 IN
        bmAttributes            3
          Transfer Type            Interrupt
          Synch Type               None
          Usage Type               Data
        wMaxPacketSize     0x0004  1x 4 bytes
        bInterval              12
        bMaxBurst               0
Hub Descriptor:
  bLength               0
  bDescriptorType      41
  nNbrPorts           142
  wHubCharacteristic 0xfd39
    Per-port power switching
    No overcurrent protection
  bPwrOn2PwrGood      127 * 2 milli seconds
  bHubContrCurrent      0 milli Ampere
  bHubDecLat          0.0 micro seconds
  wHubDelay             0 nano seconds
  DeviceRemovable    0x37 0xec 0x2c
 Hub Port Status:
   Port 1: 0000.02a0 lowspeed
   Port 2: 0000.02a0 lowspeed
   Port 3: 0000.02a0 lowspeed
   Port 4: 0000.02a0 lowspeed
   Port 5: 0000.02a0 lowspeed
   Port 6: 0000.02a0 lowspeed
   Port 7: 0000.02a0 lowspeed
   Port 8: 0000.02a0 lowspeed
   Port 9: 0000.02a0 lowspeed
   Port 10: 0000.02a0 lowspeed
   Port 11: 0000.02a0 lowspeed
   Port 12: 0000.02a0 lowspeed
   Port 13: 0000.02a0 lowspeed
   Port 14: 0000.02a0 lowspeed
   Port 15: 0000.02a0 lowspeed
   Port 16: 0000.02a0 lowspeed
   Port 17: 0000.02a0 lowspeed
   Port 18: 0000.02a0 lowspeed
   Port 19: 0000.02a0 lowspeed
   Port 20: 0000.02a0 lowspeed
   Port 21: 0000.02a0 lowspeed
   Port 22: 0000.02a0 lowspeed
   Port 23: 0000.02a0 lowspeed
   Port 24: 0000.02a0 lowspeed
   Port 25: 0000.02a0 lowspeed
   Port 26: 0000.02a0 lowspeed
   Port 27: 0000.02a0 lowspeed
   Port 28: 0000.02a0 lowspeed
   Port 29: 0000.02a0 lowspeed
   Port 30: 0000.02a0 lowspeed
   Port 31: 0000.02a0 lowspeed
   Port 32: 0000.02a0 lowspeed
   Port 33: 0000.02a0 lowspeed
   Port 34: 0000.02a0 lowspeed
   Port 35: 0000.02a0 lowspeed
   Port 36: 0000.02a0 lowspeed
   Port 37: 0000.02a0 lowspeed
   Port 38: 0000.02a0 lowspeed
   Port 39: 0000.02a0 lowspeed
   Port 40: 0000.02a0 lowspeed
   Port 41: 0000.02a0 lowspeed
   Port 42: 0000.02a0 lowspeed
   Port 43: 0000.02a0 lowspeed
   Port 44: 0000.02a0 lowspeed
   Port 45: 0000.02a0 lowspeed
   Port 46: 0000.02a0 lowspeed
   Port 47: 0000.02a0 lowspeed
   Port 48: 0000.02a0 lowspeed
   Port 49: 0000.02a0 lowspeed
   Port 50: 0000.02a0 lowspeed
   Port 51: 0000.02a0 lowspeed
   Port 52: 0000.02a0 lowspeed
   Port 53: 0000.02a0 lowspeed
   Port 54: 0000.02a0 lowspeed
   Port 55: 0000.02a0 lowspeed
   Port 56: 0000.02a0 lowspeed
   Port 57: 0000.02a0 lowspeed
   Port 58: 0000.02a0 lowspeed
   Port 59: 0000.02a0 lowspeed
   Port 60: 0000.02a0 lowspeed
   Port 61: 0000.02a0 lowspeed
   Port 62: 0000.02a0 lowspeed
   Port 63: 0000.02a0 lowspeed
   Port 64: 0000.02a0 lowspeed
   Port 65: 0000.02a0 lowspeed
   Port 66: 0000.02a0 lowspeed
   Port 67: 0000.02a0 lowspeed
   Port 68: 0000.02a0 lowspeed
   Port 69: 0000.02a0 lowspeed
   Port 70: 0000.02a0 lowspeed
   Port 71: 0000.02a0 lowspeed
   Port 72: 0000.02a0 lowspeed
   Port 73: 0000.02a0 lowspeed
   Port 74: 0000.02a0 lowspeed
   Port 75: 0000.02a0 lowspeed
   Port 76: 0000.02a0 lowspeed
   Port 77: 0000.02a0 lowspeed
   Port 78: 0000.02a0 lowspeed
   Port 79: 0000.02a0 lowspeed
   Port 80: 0000.02a0 lowspeed
   Port 81: 0000.02a0 lowspeed
   Port 82: 0000.02a0 lowspeed
   Port 83: 0000.02a0 lowspeed
   Port 84: 0000.02a0 lowspeed
   Port 85: 0000.02a0 lowspeed
   Port 86: 0000.02a0 lowspeed
   Port 87: 0000.02a0 lowspeed
   Port 88: 0000.02a0 lowspeed
   Port 89: 0000.02a0 lowspeed
   Port 90: 0000.02a0 lowspeed
   Port 91: 0000.02a0 lowspeed
   Port 92: 0000.02a0 lowspeed
   Port 93: 0000.02a0 lowspeed
   Port 94: 0000.02a0 lowspeed
   Port 95: 0000.02a0 lowspeed
   Port 96: 0000.02a0 lowspeed
   Port 97: 0000.02a0 lowspeed
   Port 98: 0000.02a0 lowspeed
   Port 99: 0000.02a0 lowspeed
   Port 100: 0000.02a0 lowspeed
   Port 101: 0000.02a0 lowspeed
   Port 102: 0000.02a0 lowspeed
   Port 103: 0000.02a0 lowspeed
   Port 104: 0000.02a0 lowspeed
   Port 105: 0000.02a0 lowspeed
   Port 106: 0000.02a0 lowspeed
   Port 107: 0000.02a0 lowspeed
   Port 108: 0000.02a0 lowspeed
   Port 109: 0000.02a0 lowspeed
   Port 110: 0000.02a0 lowspeed
   Port 111: 0000.02a0 lowspeed
   Port 112: 0000.02a0 lowspeed
   Port 113: 0000.02a0 lowspeed
   Port 114: 0000.02a0 lowspeed
   Port 115: 0000.02a0 lowspeed
   Port 116: 0000.02a0 lowspeed
   Port 117: 0000.02a0 lowspeed
   Port 118: 0000.02a0 lowspeed
   Port 119: 0000.02a0 lowspeed
   Port 120: 0000.02a0 lowspeed
   Port 121: 0000.02a0 lowspeed
   Port 122: 0000.02a0 lowspeed
   Port 123: 0000.02a0 lowspeed
   Port 124: 0000.02a0 lowspeed
   Port 125: 0000.02a0 lowspeed
   Port 126: 0000.02a0 lowspeed
   Port 127: 0000.02a0 lowspeed
   Port 128: 0000.02a0 lowspeed
   Port 129: 0000.02a0 lowspeed
   Port 130: 0000.02a0 lowspeed
   Port 131: 0000.02a0 lowspeed
   Port 132: 0000.02a0 lowspeed
   Port 133: 0000.02a0 lowspeed
   Port 134: 0000.02a0 lowspeed
   Port 135: 0000.02a0 lowspeed
   Port 136: 0000.02a0 lowspeed
   Port 137: 0000.02a0 lowspeed
   Port 138: 0000.02a0 lowspeed
   Port 139: 0000.02a0 lowspeed
   Port 140: 0000.02a0 lowspeed
   Port 141: 0000.02a0 lowspeed
   Port 142: 0000.02a0 lowspeed
Binary Object Store Descriptor:
  bLength                 5
  bDescriptorType        15
  wTotalLength           43
  bNumDeviceCaps          2
  SuperSpeed USB Device Capability:
    bLength                10
    bDescriptorType        16
    bDevCapabilityType      3
    bmAttributes         0x02
      Latency Tolerance Messages (LTM) Supported
    wSpeedsSupported   0x0008
      Device can operate at SuperSpeed (5Gbps)
    bFunctionalitySupport   1
      Lowest fully-functional device speed is Full Speed (12Mbps)
    bU1DevExitLat           0 micro seconds
    bU2DevExitLat           0 micro seconds
  ** UNRECOGNIZED:  1c 10 0a 00 23 00 00 00 04 11 00 00 34 00 05 00 b4 00 05 00 35 40 0a 00 b5 40 0a 00
Device Status:     0x0001
  Self Powered

Bus 003 Device 004: ID 048d:c967 Integrated Technology Express, Inc. 
Device Descriptor:
  bLength                18
  bDescriptorType         1
  bcdUSB               2.00
  bDeviceClass            0 (Defined at Interface level)
  bDeviceSubClass         0 
  bDeviceProtocol         0 
  bMaxPacketSize0        64
  idVendor           0x048d Integrated Technology Express, Inc.
  idProduct          0xc967 
  bcdDevice            0.04
  iManufacturer           1 ITE Tech. Inc.
  iProduct                2 ITE Device(8296)
  iSerial                 0 
  --
  Configuration Descriptor:
    bLength                 9
    bDescriptorType         2
    wTotalLength           34
    bNumInterfaces          1
    bConfigurationValue     1
    iConfiguration          0 
    bmAttributes         0xe0
      Self Powered
      Remote Wakeup
    MaxPower              100mA
    Interface Descriptor:
      bLength                 9
      bDescriptorType         4
      bInterfaceNumber        0
      bAlternateSetting       0
      bNumEndpoints           1
      bInterfaceClass         3 Human Interface Device
      bInterfaceSubClass      1 Boot Interface Subclass
      bInterfaceProtocol      1 Keyboard
      iInterface              0 
        HID Device Descriptor:
          bLength                 9
          bDescriptorType        33
          bcdHID               1.10
          bCountryCode            0 Not supported
          bNumDescriptors         1
          bDescriptorType        34 Report
          wDescriptorLength     202
         Report Descriptors: 
           ** UNAVAILABLE **
      Endpoint Descriptor:
        bLength                 7
        bDescriptorType         5
        bEndpointAddress     0x81  EP 1 IN
        bmAttributes            3
          Transfer Type            Interrupt
          Synch Type               None
          Usage Type               Data
        wMaxPacketSize     0x0040  1x 64 bytes
        bInterval               1
Device Status:     0x0001
  Self Powered

Bus 003 Device 003: ID 13d3:56bb IMC Networks 
Device Descriptor:
  bLength                18
  bDescriptorType         1
  bcdUSB               2.01
  bDeviceClass          239 Miscellaneous Device
  bDeviceSubClass         2 ?
  bDeviceProtocol         1 Interface Association
  bMaxPacketSize0        64
  idVendor           0x13d3 IMC Networks
  idProduct          0x56bb 
  bcdDevice           19.02
  iManufacturer           2 Azurewave
  iProduct                1 Integrated Camera
  iSerial                 0 
  --
  Configuration Descriptor:
    bLength                 9
    bDescriptorType         2
    wTotalLength          820
    bNumInterfaces          2
    bConfigurationValue     1
    iConfiguration          0 
    bmAttributes         0x80
      (Bus Powered)
    MaxPower              500mA
    Interface Association:
      bLength                 8
      bDescriptorType        11
      bFirstInterface         0
      bInterfaceCount         2
      bFunctionClass         14 Video
      bFunctionSubClass       3 Video Interface Collection
      bFunctionProtocol       0 
      iFunction               5 Integrated Camera
    Interface Descriptor:
      bLength                 9
      bDescriptorType         4
      bInterfaceNumber        0
      bAlternateSetting       0
      bNumEndpoints           1
      bInterfaceClass        14 Video
      bInterfaceSubClass      1 Video Control
      bInterfaceProtocol      0 
      iInterface              5 Integrated Camera
      VideoControl Interface Descriptor:
        bLength                13
        bDescriptorType        36
        bDescriptorSubtype      1 (HEADER)
        bcdUVC               1.00
        wTotalLength           78
        dwClockFrequency       15.000000MHz
        bInCollection           1
        baInterfaceNr( 0)       1
      VideoControl Interface Descriptor:
        bLength                 9
        bDescriptorType        36
        bDescriptorSubtype      3 (OUTPUT_TERMINAL)
        bTerminalID             4
        wTerminalType      0x0101 USB Streaming
        bAssocTerminal          0
        bSourceID               3
        iTerminal               0 
      VideoControl Interface Descriptor:
        bLength                27
        bDescriptorType        36
        bDescriptorSubtype      6 (EXTENSION_UNIT)
        bUnitID                 3
        guidExtensionCode         {7D9EEE90-4755-1BBF-954E-FF6A21E446D4}
        bNumControl            16
        bNrPins                 1
        baSourceID( 0)          2
        bControlSize            2
        bmControls( 0)       0x9f
        bmControls( 1)       0x1e
        iExtension              0 
      VideoControl Interface Descriptor:
        bLength                18
        bDescriptorType        36
        bDescriptorSubtype      2 (INPUT_TERMINAL)
        bTerminalID             1
        wTerminalType      0x0201 Camera Sensor
        bAssocTerminal          0
        iTerminal               0 
        wObjectiveFocalLengthMin      0
        wObjectiveFocalLengthMax      0
        wOcularFocalLength            0
        bControlSize                  3
        bmControls           0x0020000e
          Auto-Exposure Mode
          Auto-Exposure Priority
          Exposure Time (Absolute)
      VideoControl Interface Descriptor:
        bLength                11
        bDescriptorType        36
        bDescriptorSubtype      5 (PROCESSING_UNIT)
      Warning: Descriptor too short
        bUnitID                 2
        bSourceID               1
        wMaxMultiplier          0
        bControlSize            2
        bmControls     0x0000157f
          Brightness
          Contrast
          Hue
          Saturation
          Sharpness
          Gamma
          White Balance Temperature
          Backlight Compensation
          Power Line Frequency
          White Balance Temperature, Auto
        iProcessing             0 
        bmVideoStandards     0x 0
      Endpoint Descriptor:
        bLength                 7
        bDescriptorType         5
        bEndpointAddress     0x83  EP 3 IN
        bmAttributes            3
          Transfer Type            Interrupt
          Synch Type               None
          Usage Type               Data
        wMaxPacketSize     0x0010  1x 16 bytes
        bInterval               6
    Interface Descriptor:
      bLength                 9
      bDescriptorType         4
      bInterfaceNumber        1
      bAlternateSetting       0
      bNumEndpoints           0
      bInterfaceClass        14 Video
      bInterfaceSubClass      2 Video Streaming
      bInterfaceProtocol      0 
      iInterface              0 
      VideoStreaming Interface Descriptor:
        bLength                            15
        bDescriptorType                    36
        bDescriptorSubtype                  1 (INPUT_HEADER)
        bNumFormats                         2
        wTotalLength                      599
        bEndPointAddress                  129
        bmInfo                              0
        bTerminalLink                       4
        bStillCaptureMethod                 0
        bTriggerSupport                     0
        bTriggerUsage                       0
        bControlSize                        1
        bmaControls( 0)                    11
        bmaControls( 1)                    11
      VideoStreaming Interface Descriptor:
        bLength                            11
        bDescriptorType                    36
        bDescriptorSubtype                  6 (FORMAT_MJPEG)
        bFormatIndex                        1
        bNumFrameDescriptors                9
        bFlags                              0
          Fixed-size samples: No
        bDefaultFrameIndex                  1
        bAspectRatioX                       0
        bAspectRatioY                       0
        bmInterlaceFlags                 0x00
          Interlaced stream or variable: No
          Fields per frame: 1 fields
          Field 1 first: No
          Field pattern: Field 1 only
          bCopyProtect                      0
      VideoStreaming Interface Descriptor:
        bLength                            30
        bDescriptorType                    36
        bDescriptorSubtype                  7 (FRAME_MJPEG)
        bFrameIndex                         1
        bmCapabilities                   0x00
          Still image unsupported
        wWidth                           1280
        wHeight                           720
        dwMinBitRate                442368000
        dwMaxBitRate                442368000
        dwMaxVideoFrameBufferSize     1843789
        dwDefaultFrameInterval         333333
        bFrameIntervalType                  1
        dwFrameInterval( 0)            333333
      VideoStreaming Interface Descriptor:
        bLength                            30
        bDescriptorType                    36
        bDescriptorSubtype                  7 (FRAME_MJPEG)
        bFrameIndex                         2
        bmCapabilities                   0x00
          Still image unsupported
        wWidth                            960
        wHeight                           540
        dwMinBitRate                248832000
        dwMaxBitRate                248832000
        dwMaxVideoFrameBufferSize     1037389
        dwDefaultFrameInterval         333333
        bFrameIntervalType                  1
        dwFrameInterval( 0)            333333
      VideoStreaming Interface Descriptor:
        bLength                            30
        bDescriptorType                    36
        bDescriptorSubtype                  7 (FRAME_MJPEG)
        bFrameIndex                         3
        bmCapabilities                   0x00
          Still image unsupported
        wWidth                            848
        wHeight                           480
        dwMinBitRate                195379200
        dwMaxBitRate                195379200
        dwMaxVideoFrameBufferSize      814669
        dwDefaultFrameInterval         333333
        bFrameIntervalType                  1
        dwFrameInterval( 0)            333333
      VideoStreaming Interface Descriptor:
        bLength                            30
        bDescriptorType                    36
        bDescriptorSubtype                  7 (FRAME_MJPEG)
        bFrameIndex                         4
        bmCapabilities                   0x00
          Still image unsupported
        wWidth                            640
        wHeight                           480
        dwMinBitRate                147456000
        dwMaxBitRate                147456000
        dwMaxVideoFrameBufferSize      614989
        dwDefaultFrameInterval         333333
        bFrameIntervalType                  1
        dwFrameInterval( 0)            333333
      VideoStreaming Interface Descriptor:
        bLength                            30
        bDescriptorType                    36
        bDescriptorSubtype                  7 (FRAME_MJPEG)
        bFrameIndex                         5
        bmCapabilities                   0x00
          Still image unsupported
        wWidth                            640
        wHeight                           360
        dwMinBitRate                110592000
        dwMaxBitRate                110592000
        dwMaxVideoFrameBufferSize      461389
        dwDefaultFrameInterval         333333
        bFrameIntervalType                  1
        dwFrameInterval( 0)            333333
      VideoStreaming Interface Descriptor:
        bLength                            30
        bDescriptorType                    36
        bDescriptorSubtype                  7 (FRAME_MJPEG)
        bFrameIndex                         6
        bmCapabilities                   0x00
          Still image unsupported
        wWidth                            424
        wHeight                           240
        dwMinBitRate                 48844800
        dwMaxBitRate                 48844800
        dwMaxVideoFrameBufferSize      204109
        dwDefaultFrameInterval         333333
        bFrameIntervalType                  1
        dwFrameInterval( 0)            333333
      VideoStreaming Interface Descriptor:
        bLength                            30
        bDescriptorType                    36
        bDescriptorSubtype                  7 (FRAME_MJPEG)
        bFrameIndex                         7
        bmCapabilities                   0x00
          Still image unsupported
        wWidth                            352
        wHeight                           288
        dwMinBitRate                 48660480
        dwMaxBitRate                 48660480
        dwMaxVideoFrameBufferSize      203341
        dwDefaultFrameInterval         333333
        bFrameIntervalType                  1
        dwFrameInterval( 0)            333333
      VideoStreaming Interface Descriptor:
        bLength                            30
        bDescriptorType                    36
        bDescriptorSubtype                  7 (FRAME_MJPEG)
        bFrameIndex                         8
        bmCapabilities                   0x00
          Still image unsupported
        wWidth                            320
        wHeight                           240
        dwMinBitRate                 36864000
        dwMaxBitRate                 36864000
        dwMaxVideoFrameBufferSize      154189
        dwDefaultFrameInterval         333333
        bFrameIntervalType                  1
        dwFrameInterval( 0)            333333
      VideoStreaming Interface Descriptor:
        bLength                            30
        bDescriptorType                    36
        bDescriptorSubtype                  7 (FRAME_MJPEG)
        bFrameIndex                         9
        bmCapabilities                   0x00
          Still image unsupported
        wWidth                            320
        wHeight                           180
        dwMinBitRate                 27648000
        dwMaxBitRate                 27648000
        dwMaxVideoFrameBufferSize      115789
        dwDefaultFrameInterval         333333
        bFrameIntervalType                  1
        dwFrameInterval( 0)            333333
      VideoStreaming Interface Descriptor:
        bLength                            27
        bDescriptorType                    36
        bDescriptorSubtype                  4 (FORMAT_UNCOMPRESSED)
        bFormatIndex                        2
        bNumFrameDescriptors                9
        guidFormat                            {6E201A97-DDD2-26A0-3784-14A3624F1FC1}
        bBitsPerPixel                      16
        bDefaultFrameIndex                  1
        bAspectRatioX                       0
        bAspectRatioY                       0
        bmInterlaceFlags                 0x00
          Interlaced stream or variable: No
          Fields per frame: 2 fields
          Field 1 first: No
          Field pattern: Field 1 only
          bCopyProtect                      0
      VideoStreaming Interface Descriptor:
        bLength                            30
        bDescriptorType                    36
        bDescriptorSubtype                  5 (FRAME_UNCOMPRESSED)
        bFrameIndex                         1
        bmCapabilities                   0x00
          Still image unsupported
        wWidth                           1280
        wHeight                           720
        dwMinBitRate                147456000
        dwMaxBitRate                147456000
        dwMaxVideoFrameBufferSize     1843200
        dwDefaultFrameInterval        1000000
        bFrameIntervalType                  1
        dwFrameInterval( 0)           1000000
      VideoStreaming Interface Descriptor:
        bLength                            30
        bDescriptorType                    36
        bDescriptorSubtype                  5 (FRAME_UNCOMPRESSED)
        bFrameIndex                         2
        bmCapabilities                   0x00
          Still image unsupported
        wWidth                            960
        wHeight                           540
        dwMinBitRate                124416000
        dwMaxBitRate                124416000
        dwMaxVideoFrameBufferSize     1036800
        dwDefaultFrameInterval         666666
        bFrameIntervalType                  1
        dwFrameInterval( 0)            666666
      VideoStreaming Interface Descriptor:
        bLength                            30
        bDescriptorType                    36
        bDescriptorSubtype                  5 (FRAME_UNCOMPRESSED)
        bFrameIndex                         3
        bmCapabilities                   0x00
          Still image unsupported
        wWidth                            848
        wHeight                           480
        dwMinBitRate                130252800
        dwMaxBitRate                130252800
        dwMaxVideoFrameBufferSize      814080
        dwDefaultFrameInterval         500000
        bFrameIntervalType                  1
        dwFrameInterval( 0)            500000
      VideoStreaming Interface Descriptor:
        bLength                            30
        bDescriptorType                    36
        bDescriptorSubtype                  5 (FRAME_UNCOMPRESSED)
        bFrameIndex                         4
        bmCapabilities                   0x00
          Still image unsupported
        wWidth                            640
        wHeight                           480
        dwMinBitRate                147456000
        dwMaxBitRate                147456000
        dwMaxVideoFrameBufferSize      614400
        dwDefaultFrameInterval         333333
        bFrameIntervalType                  1
        dwFrameInterval( 0)            333333
      VideoStreaming Interface Descriptor:
        bLength                            30
        bDescriptorType                    36
        bDescriptorSubtype                  5 (FRAME_UNCOMPRESSED)
        bFrameIndex                         5
        bmCapabilities                   0x00
          Still image unsupported
        wWidth                            640
        wHeight                           360
        dwMinBitRate                110592000
        dwMaxBitRate                110592000
        dwMaxVideoFrameBufferSize      460800
        dwDefaultFrameInterval         333333
        bFrameIntervalType                  1
        dwFrameInterval( 0)            333333
      VideoStreaming Interface Descriptor:
        bLength                            30
        bDescriptorType                    36
        bDescriptorSubtype                  5 (FRAME_UNCOMPRESSED)
        bFrameIndex                         6
        bmCapabilities                   0x00
          Still image unsupported
        wWidth                            424
        wHeight                           240
        dwMinBitRate                 48844800
        dwMaxBitRate                 48844800
        dwMaxVideoFrameBufferSize      203520
        dwDefaultFrameInterval         333333
        bFrameIntervalType                  1
        dwFrameInterval( 0)            333333
      VideoStreaming Interface Descriptor:
        bLength                            30
        bDescriptorType                    36
        bDescriptorSubtype                  5 (FRAME_UNCOMPRESSED)
        bFrameIndex                         7
        bmCapabilities                   0x00
          Still image unsupported
        wWidth                            352
        wHeight                           288
        dwMinBitRate                 48660480
        dwMaxBitRate                 48660480
        dwMaxVideoFrameBufferSize      202752
        dwDefaultFrameInterval         333333
        bFrameIntervalType                  1
        dwFrameInterval( 0)            333333
      VideoStreaming Interface Descriptor:
        bLength                            30
        bDescriptorType                    36
        bDescriptorSubtype                  5 (FRAME_UNCOMPRESSED)
        bFrameIndex                         8
        bmCapabilities                   0x00
          Still image unsupported
        wWidth                            320
        wHeight                           240
        dwMinBitRate                 36864000
        dwMaxBitRate                 36864000
        dwMaxVideoFrameBufferSize      153600
        dwDefaultFrameInterval         333333
        bFrameIntervalType                  1
        dwFrameInterval( 0)            333333
      VideoStreaming Interface Descriptor:
        bLength                            30
        bDescriptorType                    36
        bDescriptorSubtype                  5 (FRAME_UNCOMPRESSED)
        bFrameIndex                         9
        bmCapabilities                   0x00
          Still image unsupported
        wWidth                            320
        wHeight                           180
        dwMinBitRate                 27648000
        dwMaxBitRate                 27648000
        dwMaxVideoFrameBufferSize      115200
        dwDefaultFrameInterval         333333
        bFrameIntervalType                  1
        dwFrameInterval( 0)            333333
      VideoStreaming Interface Descriptor:
        bLength                             6
        bDescriptorType                    36
        bDescriptorSubtype                 13 (COLORFORMAT)
        bColorPrimaries                     1 (BT.709,sRGB)
        bTransferCharacteristics            1 (BT.709)
        bMatrixCoefficients                 4 (SMPTE 170M (BT.601))
    Interface Descriptor:
      bLength                 9
      bDescriptorType         4
      bInterfaceNumber        1
      bAlternateSetting       1
      bNumEndpoints           1
      bInterfaceClass        14 Video
      bInterfaceSubClass      2 Video Streaming
      bInterfaceProtocol      0 
      iInterface              0 
      Endpoint Descriptor:
        bLength                 7
        bDescriptorType         5
        bEndpointAddress     0x81  EP 1 IN
        bmAttributes            5
          Transfer Type            Isochronous
          Synch Type               Asynchronous
          Usage Type               Data
        wMaxPacketSize     0x0080  1x 128 bytes
        bInterval               1
    Interface Descriptor:
      bLength                 9
      bDescriptorType         4
      bInterfaceNumber        1
      bAlternateSetting       2
      bNumEndpoints           1
      bInterfaceClass        14 Video
      bInterfaceSubClass      2 Video Streaming
      bInterfaceProtocol      0 
      iInterface              0 
      Endpoint Descriptor:
        bLength                 7
        bDescriptorType         5
        bEndpointAddress     0x81  EP 1 IN
        bmAttributes            5
          Transfer Type            Isochronous
          Synch Type               Asynchronous
          Usage Type               Data
        wMaxPacketSize     0x0100  1x 256 bytes
        bInterval               1
    Interface Descriptor:
      bLength                 9
      bDescriptorType         4
      bInterfaceNumber        1
      bAlternateSetting       3
      bNumEndpoints           1
      bInterfaceClass        14 Video
      bInterfaceSubClass      2 Video Streaming
      bInterfaceProtocol      0 
      iInterface              0 
      Endpoint Descriptor:
        bLength                 7
        bDescriptorType         5
        bEndpointAddress     0x81  EP 1 IN
        bmAttributes            5
          Transfer Type            Isochronous
          Synch Type               Asynchronous
          Usage Type               Data
        wMaxPacketSize     0x0320  1x 800 bytes
        bInterval               1
    Interface Descriptor:
      bLength                 9
      bDescriptorType         4
      bInterfaceNumber        1
      bAlternateSetting       4
      bNumEndpoints           1
      bInterfaceClass        14 Video
      bInterfaceSubClass      2 Video Streaming
      bInterfaceProtocol      0 
      iInterface              0 
      Endpoint Descriptor:
        bLength                 7
        bDescriptorType         5
        bEndpointAddress     0x81  EP 1 IN
        bmAttributes            5
          Transfer Type            Isochronous
          Synch Type               Asynchronous
          Usage Type               Data
        wMaxPacketSize     0x0b20  2x 800 bytes
        bInterval               1
    Interface Descriptor:
      bLength                 9
      bDescriptorType         4
      bInterfaceNumber        1
      bAlternateSetting       5
      bNumEndpoints           1
      bInterfaceClass        14 Video
      bInterfaceSubClass      2 Video Streaming
      bInterfaceProtocol      0 
      iInterface              0 
      Endpoint Descriptor:
        bLength                 7
        bDescriptorType         5
        bEndpointAddress     0x81  EP 1 IN
        bmAttributes            5
          Transfer Type            Isochronous
          Synch Type               Asynchronous
          Usage Type               Data
        wMaxPacketSize     0x1320  3x 800 bytes
        bInterval               1
    Interface Descriptor:
      bLength                 9
      bDescriptorType         4
      bInterfaceNumber        1
      bAlternateSetting       6
      bNumEndpoints           1
      bInterfaceClass        14 Video
      bInterfaceSubClass      2 Video Streaming
      bInterfaceProtocol      0 
      iInterface              0 
      Endpoint Descriptor:
        bLength                 7
        bDescriptorType         5
        bEndpointAddress     0x81  EP 1 IN
        bmAttributes            5
          Transfer Type            Isochronous
          Synch Type               Asynchronous
          Usage Type               Data
        wMaxPacketSize     0x1400  3x 1024 bytes
        bInterval               1
Binary Object Store Descriptor:
  bLength                 5
  bDescriptorType        15
  wTotalLength           33
  bNumDeviceCaps          1
  ** UNRECOGNIZED:  1c 10 05 00 df 60 dd d8 89 45 c7 4c 9c d2 65 9d 9e 64 8a 9f 00 00 00 0a 06 03 01 00
Device Status:     0x0002
  (Bus Powered)
  Remote Wakeup Enabled

Bus 003 Device 001: ID 1d6b:0002 Linux Foundation 2.0 root hub
Device Descriptor:
  bLength                18
  bDescriptorType         1
  bcdUSB               2.00
  bDeviceClass            9 Hub
  bDeviceSubClass         0 Unused
  bDeviceProtocol         1 Single TT
  bMaxPacketSize0        64
  idVendor           0x1d6b Linux Foundation
  idProduct          0x0002 2.0 root hub
  bcdDevice            5.15
  iManufacturer           3 Linux 5.15.0-58-generic xhci-hcd
  iProduct                2 xHCI Host Controller
  iSerial                 1 --
  bNumConfigurations      1
  Configuration Descriptor:
    bLength                 9
    bDescriptorType         2
    wTotalLength           25
    bNumInterfaces          1
    bConfigurationValue     1
    iConfiguration          0 
    bmAttributes         0xe0
      Self Powered
      Remote Wakeup
    MaxPower                0mA
    Interface Descriptor:
      bLength                 9
      bDescriptorType         4
      bInterfaceNumber        0
      bAlternateSetting       0
      bNumEndpoints           1
      bInterfaceClass         9 Hub
      bInterfaceSubClass      0 Unused
      bInterfaceProtocol      0 Full speed (or root) hub
      iInterface              0 
      Endpoint Descriptor:
        bLength                 7
        bDescriptorType         5
        bEndpointAddress     0x81  EP 1 IN
        bmAttributes            3
          Transfer Type            Interrupt
          Synch Type               None
          Usage Type               Data
        wMaxPacketSize     0x0004  1x 4 bytes
        bInterval              12
Hub Descriptor:
  bLength               9
  bDescriptorType      41
  nNbrPorts             4
  wHubCharacteristic 0x000a
    No power switching (usb 1.0)
    Per-port overcurrent protection
    TT think time 8 FS bits
  bPwrOn2PwrGood       10 * 2 milli seconds
  bHubContrCurrent      0 milli Ampere
  DeviceRemovable    0x18
  PortPwrCtrlMask    0xff
 Hub Port Status:
   Port 1: 0000.0100 power
   Port 2: 0000.0100 power
   Port 3: 0000.0503 highspeed power enable connect
   Port 4: 0000.0103 power enable connect
Device Status:     0x0001
  Self Powered

Bus 002 Device 001: ID 1d6b:0003 Linux Foundation 3.0 root hub
Device Descriptor:
  bLength                18
  bDescriptorType         1
  bcdUSB               3.10
  bDeviceClass            9 Hub
  bDeviceSubClass         0 Unused
  bDeviceProtocol         3 
  bMaxPacketSize0         9
  idVendor           0x1d6b Linux Foundation
  idProduct          0x0003 3.0 root hub
  bcdDevice            5.15
  iManufacturer           3 Linux 5.15.0-58-generic xhci-hcd
  iProduct                2 xHCI Host Controller
  iSerial                 1 --
  bNumConfigurations      1
  Configuration Descriptor:
    bLength                 9
    bDescriptorType         2
    wTotalLength           31
    bNumInterfaces          1
    bConfigurationValue     1
    iConfiguration          0 
    bmAttributes         0xe0
      Self Powered
      Remote Wakeup
    MaxPower                0mA
    Interface Descriptor:
      bLength                 9
      bDescriptorType         4
      bInterfaceNumber        0
      bAlternateSetting       0
      bNumEndpoints           1
      bInterfaceClass         9 Hub
      bInterfaceSubClass      0 Unused
      bInterfaceProtocol      0 Full speed (or root) hub
      iInterface              0 
      Endpoint Descriptor:
        bLength                 7
        bDescriptorType         5
        bEndpointAddress     0x81  EP 1 IN
        bmAttributes            3
          Transfer Type            Interrupt
          Synch Type               None
          Usage Type               Data
        wMaxPacketSize     0x0004  1x 4 bytes
        bInterval              12
        bMaxBurst               0
Hub Descriptor:
  bLength               0
  bDescriptorType      41
  nNbrPorts           142
  wHubCharacteristic 0xfd39
    Per-port power switching
    No overcurrent protection
  bPwrOn2PwrGood      127 * 2 milli seconds
  bHubContrCurrent      0 milli Ampere
  bHubDecLat          0.0 micro seconds
  wHubDelay             0 nano seconds
  DeviceRemovable    0x37 0xec 0x2c
 Hub Port Status:
   Port 1: 0000.02a0 lowspeed
   Port 2: 0000.02a0 lowspeed
   Port 3: 0000.02a0 lowspeed
   Port 4: 0000.02a0 lowspeed
   Port 5: 0000.02a0 lowspeed
   Port 6: 0000.02a0 lowspeed
   Port 7: 0000.02a0 lowspeed
   Port 8: 0000.02a0 lowspeed
   Port 9: 0000.02a0 lowspeed
   Port 10: 0000.02a0 lowspeed
   Port 11: 0000.02a0 lowspeed
   Port 12: 0000.02a0 lowspeed
   Port 13: 0000.02a0 lowspeed
   Port 14: 0000.02a0 lowspeed
   Port 15: 0000.02a0 lowspeed
   Port 16: 0000.02a0 lowspeed
   Port 17: 0000.02a0 lowspeed
   Port 18: 0000.02a0 lowspeed
   Port 19: 0000.02a0 lowspeed
   Port 20: 0000.02a0 lowspeed
   Port 21: 0000.02a0 lowspeed
   Port 22: 0000.02a0 lowspeed
   Port 23: 0000.02a0 lowspeed
   Port 24: 0000.02a0 lowspeed
   Port 25: 0000.02a0 lowspeed
   Port 26: 0000.02a0 lowspeed
   Port 27: 0000.02a0 lowspeed
   Port 28: 0000.02a0 lowspeed
   Port 29: 0000.02a0 lowspeed
   Port 30: 0000.02a0 lowspeed
   Port 31: 0000.02a0 lowspeed
   Port 32: 0000.02a0 lowspeed
   Port 33: 0000.02a0 lowspeed
   Port 34: 0000.02a0 lowspeed
   Port 35: 0000.02a0 lowspeed
   Port 36: 0000.02a0 lowspeed
   Port 37: 0000.02a0 lowspeed
   Port 38: 0000.02a0 lowspeed
   Port 39: 0000.02a0 lowspeed
   Port 40: 0000.02a0 lowspeed
   Port 41: 0000.02a0 lowspeed
   Port 42: 0000.02a0 lowspeed
   Port 43: 0000.02a0 lowspeed
   Port 44: 0000.02a0 lowspeed
   Port 45: 0000.02a0 lowspeed
   Port 46: 0000.02a0 lowspeed
   Port 47: 0000.02a0 lowspeed
   Port 48: 0000.02a0 lowspeed
   Port 49: 0000.02a0 lowspeed
   Port 50: 0000.02a0 lowspeed
   Port 51: 0000.02a0 lowspeed
   Port 52: 0000.02a0 lowspeed
   Port 53: 0000.02a0 lowspeed
   Port 54: 0000.02a0 lowspeed
   Port 55: 0000.02a0 lowspeed
   Port 56: 0000.02a0 lowspeed
   Port 57: 0000.02a0 lowspeed
   Port 58: 0000.02a0 lowspeed
   Port 59: 0000.02a0 lowspeed
   Port 60: 0000.02a0 lowspeed
   Port 61: 0000.02a0 lowspeed
   Port 62: 0000.02a0 lowspeed
   Port 63: 0000.02a0 lowspeed
   Port 64: 0000.02a0 lowspeed
   Port 65: 0000.02a0 lowspeed
   Port 66: 0000.02a0 lowspeed
   Port 67: 0000.02a0 lowspeed
   Port 68: 0000.02a0 lowspeed
   Port 69: 0000.02a0 lowspeed
   Port 70: 0000.02a0 lowspeed
   Port 71: 0000.02a0 lowspeed
   Port 72: 0000.02a0 lowspeed
   Port 73: 0000.02a0 lowspeed
   Port 74: 0000.02a0 lowspeed
   Port 75: 0000.02a0 lowspeed
   Port 76: 0000.02a0 lowspeed
   Port 77: 0000.02a0 lowspeed
   Port 78: 0000.02a0 lowspeed
   Port 79: 0000.02a0 lowspeed
   Port 80: 0000.02a0 lowspeed
   Port 81: 0000.02a0 lowspeed
   Port 82: 0000.02a0 lowspeed
   Port 83: 0000.02a0 lowspeed
   Port 84: 0000.02a0 lowspeed
   Port 85: 0000.02a0 lowspeed
   Port 86: 0000.02a0 lowspeed
   Port 87: 0000.02a0 lowspeed
   Port 88: 0000.02a0 lowspeed
   Port 89: 0000.02a0 lowspeed
   Port 90: 0000.02a0 lowspeed
   Port 91: 0000.02a0 lowspeed
   Port 92: 0000.02a0 lowspeed
   Port 93: 0000.02a0 lowspeed
   Port 94: 0000.02a0 lowspeed
   Port 95: 0000.02a0 lowspeed
   Port 96: 0000.02a0 lowspeed
   Port 97: 0000.02a0 lowspeed
   Port 98: 0000.02a0 lowspeed
   Port 99: 0000.02a0 lowspeed
   Port 100: 0000.02a0 lowspeed
   Port 101: 0000.02a0 lowspeed
   Port 102: 0000.02a0 lowspeed
   Port 103: 0000.02a0 lowspeed
   Port 104: 0000.02a0 lowspeed
   Port 105: 0000.02a0 lowspeed
   Port 106: 0000.02a0 lowspeed
   Port 107: 0000.02a0 lowspeed
   Port 108: 0000.02a0 lowspeed
   Port 109: 0000.02a0 lowspeed
   Port 110: 0000.02a0 lowspeed
   Port 111: 0000.02a0 lowspeed
   Port 112: 0000.02a0 lowspeed
   Port 113: 0000.02a0 lowspeed
   Port 114: 0000.02a0 lowspeed
   Port 115: 0000.02a0 lowspeed
   Port 116: 0000.02a0 lowspeed
   Port 117: 0000.02a0 lowspeed
   Port 118: 0000.02a0 lowspeed
   Port 119: 0000.02a0 lowspeed
   Port 120: 0000.02a0 lowspeed
   Port 121: 0000.02a0 lowspeed
   Port 122: 0000.02a0 lowspeed
   Port 123: 0000.02a0 lowspeed
   Port 124: 0000.02a0 lowspeed
   Port 125: 0000.02a0 lowspeed
   Port 126: 0000.02a0 lowspeed
   Port 127: 0000.02a0 lowspeed
   Port 128: 0000.02a0 lowspeed
   Port 129: 0000.02a0 lowspeed
   Port 130: 0000.02a0 lowspeed
   Port 131: 0000.02a0 lowspeed
   Port 132: 0000.02a0 lowspeed
   Port 133: 0000.02a0 lowspeed
   Port 134: 0000.02a0 lowspeed
   Port 135: 0000.02a0 lowspeed
   Port 136: 0000.02a0 lowspeed
   Port 137: 0000.02a0 lowspeed
   Port 138: 0000.02a0 lowspeed
   Port 139: 0000.02a0 lowspeed
   Port 140: 0000.02a0 lowspeed
   Port 141: 0000.02a0 lowspeed
   Port 142: 0000.02a0 lowspeed
Binary Object Store Descriptor:
  bLength                 5
  bDescriptorType        15
  wTotalLength           43
  bNumDeviceCaps          2
  SuperSpeed USB Device Capability:
    bLength                10
    bDescriptorType        16
    bDevCapabilityType      3
    bmAttributes         0x02
      Latency Tolerance Messages (LTM) Supported
    wSpeedsSupported   0x0008
      Device can operate at SuperSpeed (5Gbps)
    bFunctionalitySupport   1
      Lowest fully-functional device speed is Full Speed (12Mbps)
    bU1DevExitLat           0 micro seconds
    bU2DevExitLat           0 micro seconds
  ** UNRECOGNIZED:  1c 10 0a 00 23 00 00 00 04 11 00 00 34 00 05 00 b4 00 05 00 35 40 0a 00 b5 40 0a 00
Device Status:     0x0001
  Self Powered

Bus 001 Device 003: ID 04f3:0c4b Elan Microelectronics Corp. 
Device Descriptor:
  bLength                18
  bDescriptorType         1
  bcdUSB               2.00
  bDeviceClass            0 (Defined at Interface level)
  bDeviceSubClass         0 
  bDeviceProtocol         0 
  bMaxPacketSize0        64
  idVendor           0x04f3 Elan Microelectronics Corp.
  idProduct          0x0c4b 
  bcdDevice           35.01
  iManufacturer           1 ELAN
  iProduct                2 ELAN:Fingerprint
  iSerial                 0 
  --
  Configuration Descriptor:
    bLength                 9
    bDescriptorType         2
    wTotalLength           62
    bNumInterfaces          1
    bConfigurationValue     1
    iConfiguration          0 
    bmAttributes         0xa0
      (Bus Powered)
      Remote Wakeup
    MaxPower              100mA
    Interface Descriptor:
      bLength                 9
      bDescriptorType         4
      bInterfaceNumber        0
      bAlternateSetting       0
      bNumEndpoints           5
      bInterfaceClass       255 Vendor Specific Class
      bInterfaceSubClass      0 
      bInterfaceProtocol      0 
      iInterface              0 
      ** UNRECOGNIZED:  09 21 10 01 00 01 22 15 00
      Endpoint Descriptor:
        bLength                 7
        bDescriptorType         5
        bEndpointAddress     0x81  EP 1 IN
        bmAttributes            2
          Transfer Type            Bulk
          Synch Type               None
          Usage Type               Data
        wMaxPacketSize     0x0040  1x 64 bytes
        bInterval               1
      Endpoint Descriptor:
        bLength                 7
        bDescriptorType         5
        bEndpointAddress     0x01  EP 1 OUT
        bmAttributes            2
          Transfer Type            Bulk
          Synch Type               None
          Usage Type               Data
        wMaxPacketSize     0x0040  1x 64 bytes
        bInterval               1
      Endpoint Descriptor:
        bLength                 7
        bDescriptorType         5
        bEndpointAddress     0x82  EP 2 IN
        bmAttributes            2
          Transfer Type            Bulk
          Synch Type               None
          Usage Type               Data
        wMaxPacketSize     0x0040  1x 64 bytes
        bInterval               1
      Endpoint Descriptor:
        bLength                 7
        bDescriptorType         5
        bEndpointAddress     0x83  EP 3 IN
        bmAttributes            2
          Transfer Type            Bulk
          Synch Type               None
          Usage Type               Data
        wMaxPacketSize     0x0040  1x 64 bytes
        bInterval               1
      Endpoint Descriptor:
        bLength                 7
        bDescriptorType         5
        bEndpointAddress     0x03  EP 3 OUT
        bmAttributes            2
          Transfer Type            Bulk
          Synch Type               None
          Usage Type               Data
        wMaxPacketSize     0x0040  1x 64 bytes
        bInterval               1
Device Status:     0x0000
  (Bus Powered)

Bus 001 Device 002: ID 8087:0029 Intel Corp. AX200 Bluetooth
Device Descriptor:
  bLength                18
  bDescriptorType         1
  bcdUSB               2.01
  bDeviceClass          224 Wireless
  bDeviceSubClass         1 Radio Frequency
  bDeviceProtocol         1 Bluetooth
  bMaxPacketSize0        64
  idVendor           0x8087 Intel Corp.
  idProduct          0x0029 AX200 Bluetooth
  bcdDevice            0.01
  iManufacturer           0 
  iProduct                0 
  iSerial                 0 
  --
  Configuration Descriptor:
    bLength                 9
    bDescriptorType         2
    wTotalLength          200
    bNumInterfaces          2
    bConfigurationValue     1
    iConfiguration          0 
    bmAttributes         0xe0
      Self Powered
      Remote Wakeup
    MaxPower              100mA
    Interface Descriptor:
      bLength                 9
      bDescriptorType         4
      bInterfaceNumber        0
      bAlternateSetting       0
      bNumEndpoints           3
      bInterfaceClass       224 Wireless
      bInterfaceSubClass      1 Radio Frequency
      bInterfaceProtocol      1 Bluetooth
      iInterface              0 
      Endpoint Descriptor:
        bLength                 7
        bDescriptorType         5
        bEndpointAddress     0x81  EP 1 IN
        bmAttributes            3
          Transfer Type            Interrupt
          Synch Type               None
          Usage Type               Data
        wMaxPacketSize     0x0040  1x 64 bytes
        bInterval               1
      Endpoint Descriptor:
        bLength                 7
        bDescriptorType         5
        bEndpointAddress     0x02  EP 2 OUT
        bmAttributes            2
          Transfer Type            Bulk
          Synch Type               None
          Usage Type               Data
        wMaxPacketSize     0x0040  1x 64 bytes
        bInterval               1
      Endpoint Descriptor:
        bLength                 7
        bDescriptorType         5
        bEndpointAddress     0x82  EP 2 IN
        bmAttributes            2
          Transfer Type            Bulk
          Synch Type               None
          Usage Type               Data
        wMaxPacketSize     0x0040  1x 64 bytes
        bInterval               1
    Interface Descriptor:
      bLength                 9
      bDescriptorType         4
      bInterfaceNumber        1
      bAlternateSetting       0
      bNumEndpoints           2
      bInterfaceClass       224 Wireless
      bInterfaceSubClass      1 Radio Frequency
      bInterfaceProtocol      1 Bluetooth
      iInterface              0 
      Endpoint Descriptor:
        bLength                 7
        bDescriptorType         5
        bEndpointAddress     0x03  EP 3 OUT
        bmAttributes            1
          Transfer Type            Isochronous
          Synch Type               None
          Usage Type               Data
        wMaxPacketSize     0x0000  1x 0 bytes
        bInterval               1
      Endpoint Descriptor:
        bLength                 7
        bDescriptorType         5
        bEndpointAddress     0x83  EP 3 IN
        bmAttributes            1
          Transfer Type            Isochronous
          Synch Type               None
          Usage Type               Data
        wMaxPacketSize     0x0000  1x 0 bytes
        bInterval               1
    Interface Descriptor:
      bLength                 9
      bDescriptorType         4
      bInterfaceNumber        1
      bAlternateSetting       1
      bNumEndpoints           2
      bInterfaceClass       224 Wireless
      bInterfaceSubClass      1 Radio Frequency
      bInterfaceProtocol      1 Bluetooth
      iInterface              0 
      Endpoint Descriptor:
        bLength                 7
        bDescriptorType         5
        bEndpointAddress     0x03  EP 3 OUT
        bmAttributes            1
          Transfer Type            Isochronous
          Synch Type               None
          Usage Type               Data
        wMaxPacketSize     0x0009  1x 9 bytes
        bInterval               1
      Endpoint Descriptor:
        bLength                 7
        bDescriptorType         5
        bEndpointAddress     0x83  EP 3 IN
        bmAttributes            1
          Transfer Type            Isochronous
          Synch Type               None
          Usage Type               Data
        wMaxPacketSize     0x0009  1x 9 bytes
        bInterval               1
    Interface Descriptor:
      bLength                 9
      bDescriptorType         4
      bInterfaceNumber        1
      bAlternateSetting       2
      bNumEndpoints           2
      bInterfaceClass       224 Wireless
      bInterfaceSubClass      1 Radio Frequency
      bInterfaceProtocol      1 Bluetooth
      iInterface              0 
      Endpoint Descriptor:
        bLength                 7
        bDescriptorType         5
        bEndpointAddress     0x03  EP 3 OUT
        bmAttributes            1
          Transfer Type            Isochronous
          Synch Type               None
          Usage Type               Data
        wMaxPacketSize     0x0011  1x 17 bytes
        bInterval               1
      Endpoint Descriptor:
        bLength                 7
        bDescriptorType         5
        bEndpointAddress     0x83  EP 3 IN
        bmAttributes            1
          Transfer Type            Isochronous
          Synch Type               None
          Usage Type               Data
        wMaxPacketSize     0x0011  1x 17 bytes
        bInterval               1
    Interface Descriptor:
      bLength                 9
      bDescriptorType         4
      bInterfaceNumber        1
      bAlternateSetting       3
      bNumEndpoints           2
      bInterfaceClass       224 Wireless
      bInterfaceSubClass      1 Radio Frequency
      bInterfaceProtocol      1 Bluetooth
      iInterface              0 
      Endpoint Descriptor:
        bLength                 7
        bDescriptorType         5
        bEndpointAddress     0x03  EP 3 OUT
        bmAttributes            1
          Transfer Type            Isochronous
          Synch Type               None
          Usage Type               Data
        wMaxPacketSize     0x0019  1x 25 bytes
        bInterval               1
      Endpoint Descriptor:
        bLength                 7
        bDescriptorType         5
        bEndpointAddress     0x83  EP 3 IN
        bmAttributes            1
          Transfer Type            Isochronous
          Synch Type               None
          Usage Type               Data
        wMaxPacketSize     0x0019  1x 25 bytes
        bInterval               1
    Interface Descriptor:
      bLength                 9
      bDescriptorType         4
      bInterfaceNumber        1
      bAlternateSetting       4
      bNumEndpoints           2
      bInterfaceClass       224 Wireless
      bInterfaceSubClass      1 Radio Frequency
      bInterfaceProtocol      1 Bluetooth
      iInterface              0 
      Endpoint Descriptor:
        bLength                 7
        bDescriptorType         5
        bEndpointAddress     0x03  EP 3 OUT
        bmAttributes            1
          Transfer Type            Isochronous
          Synch Type               None
          Usage Type               Data
        wMaxPacketSize     0x0021  1x 33 bytes
        bInterval               1
      Endpoint Descriptor:
        bLength                 7
        bDescriptorType         5
        bEndpointAddress     0x83  EP 3 IN
        bmAttributes            1
          Transfer Type            Isochronous
          Synch Type               None
          Usage Type               Data
        wMaxPacketSize     0x0021  1x 33 bytes
        bInterval               1
    Interface Descriptor:
      bLength                 9
      bDescriptorType         4
      bInterfaceNumber        1
      bAlternateSetting       5
      bNumEndpoints           2
      bInterfaceClass       224 Wireless
      bInterfaceSubClass      1 Radio Frequency
      bInterfaceProtocol      1 Bluetooth
      iInterface              0 
      Endpoint Descriptor:
        bLength                 7
        bDescriptorType         5
        bEndpointAddress     0x03  EP 3 OUT
        bmAttributes            1
          Transfer Type            Isochronous
          Synch Type               None
          Usage Type               Data
        wMaxPacketSize     0x0031  1x 49 bytes
        bInterval               1
      Endpoint Descriptor:
        bLength                 7
        bDescriptorType         5
        bEndpointAddress     0x83  EP 3 IN
        bmAttributes            1
          Transfer Type            Isochronous
          Synch Type               None
          Usage Type               Data
        wMaxPacketSize     0x0031  1x 49 bytes
        bInterval               1
    Interface Descriptor:
      bLength                 9
      bDescriptorType         4
      bInterfaceNumber        1
      bAlternateSetting       6
      bNumEndpoints           2
      bInterfaceClass       224 Wireless
      bInterfaceSubClass      1 Radio Frequency
      bInterfaceProtocol      1 Bluetooth
      iInterface              0 
      Endpoint Descriptor:
        bLength                 7
        bDescriptorType         5
        bEndpointAddress     0x03  EP 3 OUT
        bmAttributes            1
          Transfer Type            Isochronous
          Synch Type               None
          Usage Type               Data
        wMaxPacketSize     0x003f  1x 63 bytes
        bInterval               1
      Endpoint Descriptor:
        bLength                 7
        bDescriptorType         5
        bEndpointAddress     0x83  EP 3 IN
        bmAttributes            1
          Transfer Type            Isochronous
          Synch Type               None
          Usage Type               Data
        wMaxPacketSize     0x003f  1x 63 bytes
        bInterval               1
Binary Object Store Descriptor:
  bLength                 5
  bDescriptorType        15
  wTotalLength           12
  bNumDeviceCaps          1
  USB 2.0 Extension Device Capability:
    bLength                 7
    bDescriptorType        16
    bDevCapabilityType      2
    bmAttributes   0x0000040e
      Link Power Management (LPM) Supported
Device Status:     0x0001
  Self Powered

Bus 001 Device 001: ID 1d6b:0002 Linux Foundation 2.0 root hub
Device Descriptor:
  bLength                18
  bDescriptorType         1
  bcdUSB               2.00
  bDeviceClass            9 Hub
  bDeviceSubClass         0 Unused
  bDeviceProtocol         1 Single TT
  bMaxPacketSize0        64
  idVendor           0x1d6b Linux Foundation
  idProduct          0x0002 2.0 root hub
  bcdDevice            5.15
  iManufacturer           3 Linux 5.15.0-58-generic xhci-hcd
  iProduct                2 xHCI Host Controller
  iSerial                 1 --
  bNumConfigurations      1
  Configuration Descriptor:
    bLength                 9
    bDescriptorType         2
    wTotalLength           25
    bNumInterfaces          1
    bConfigurationValue     1
    iConfiguration          0 
    bmAttributes         0xe0
      Self Powered
      Remote Wakeup
    MaxPower                0mA
    Interface Descriptor:
      bLength                 9
      bDescriptorType         4
      bInterfaceNumber        0
      bAlternateSetting       0
      bNumEndpoints           1
      bInterfaceClass         9 Hub
      bInterfaceSubClass      0 Unused
      bInterfaceProtocol      0 Full speed (or root) hub
      iInterface              0 
      Endpoint Descriptor:
        bLength                 7
        bDescriptorType         5
        bEndpointAddress     0x81  EP 1 IN
        bmAttributes            3
          Transfer Type            Interrupt
          Synch Type               None
          Usage Type               Data
        wMaxPacketSize     0x0004  1x 4 bytes
        bInterval              12
Hub Descriptor:
  bLength               9
  bDescriptorType      41
  nNbrPorts             4
  wHubCharacteristic 0x000a
    No power switching (usb 1.0)
    Per-port overcurrent protection
    TT think time 8 FS bits
  bPwrOn2PwrGood       10 * 2 milli seconds
  bHubContrCurrent      0 milli Ampere
  DeviceRemovable    0x18
  PortPwrCtrlMask    0xff
 Hub Port Status:
   Port 1: 0000.0100 power
   Port 2: 0000.0100 power
   Port 3: 0000.0103 power enable connect
   Port 4: 0000.0103 power enable connect
Device Status:     0x0001
  Self Powered
