Protocol spec without prior Class and Subclass spec at line 23281

Bus 001 Device 003: ID 05e3:0610 Genesys Logic, Inc. Hub
Device Descriptor:
  bLength                18
  bDescriptorType         1
  bcdUSB               2.10
  bDeviceClass            9 Hub
  bDeviceSubClass         0 Unused
  bDeviceProtocol         2 TT per port
  bMaxPacketSize0        64
  idVendor           0x05e3 Genesys Logic, Inc.
  idProduct          0x0610 Hub
  bcdDevice           23.11
  iManufacturer           1 
  iProduct                2 
  iSerial                 0 
  --
  Configuration Descriptor:
    bLength                 9
    bDescriptorType         2
    wTotalLength           41
    bNumInterfaces          1
    bConfigurationValue     1
    iConfiguration          0 
    bmAttributes         0xe0
      Self Powered
      Remote Wakeup
    MaxPower                0mA
    Interface Descriptor:
      bLength                 9
      bDescriptorType         4
      bInterfaceNumber        0
      bAlternateSetting       0
      bNumEndpoints           1
      bInterfaceClass         9 Hub
      bInterfaceSubClass      0 Unused
      bInterfaceProtocol      1 Single TT
      iInterface              0 
      Endpoint Descriptor:
        bLength                 7
        bDescriptorType         5
        bEndpointAddress     0x81  EP 1 IN
        bmAttributes            3
          Transfer Type            Interrupt
          Synch Type               None
          Usage Type               Data
        wMaxPacketSize     0x0001  1x 1 bytes
        bInterval              12
    Interface Descriptor:
      bLength                 9
      bDescriptorType         4
      bInterfaceNumber        0
      bAlternateSetting       1
      bNumEndpoints           1
      bInterfaceClass         9 Hub
      bInterfaceSubClass      0 Unused
      bInterfaceProtocol      2 TT per port
      iInterface              0 
      Endpoint Descriptor:
        bLength                 7
        bDescriptorType         5
        bEndpointAddress     0x81  EP 1 IN
        bmAttributes            3
          Transfer Type            Interrupt
          Synch Type               None
          Usage Type               Data
        wMaxPacketSize     0x0001  1x 1 bytes
        bInterval              12

Bus 001 Device 004: ID 04f2:b71a Chicony Electronics Co., Ltd 
Device Descriptor:
  bLength                18
  bDescriptorType         1
  bcdUSB               2.01
  bDeviceClass          239 Miscellaneous Device
  bDeviceSubClass         2 ?
  bDeviceProtocol         1 Interface Association
  bMaxPacketSize0        64
  idVendor           0x04f2 Chicony Electronics Co., Ltd
  idProduct          0xb71a 
  bcdDevice            0.03
  iManufacturer           1 
  iProduct                2 
  iSerial                 3 
  --
  Configuration Descriptor:
    bLength                 9
    bDescriptorType         2
    wTotalLength          971
    bNumInterfaces          4
    bConfigurationValue     1
    iConfiguration          0 
    bmAttributes         0x80
      (Bus Powered)
    MaxPower              500mA
    Interface Association:
      bLength                 8
      bDescriptorType        11
      bFirstInterface         0
      bInterfaceCount         2
      bFunctionClass         14 Video
      bFunctionSubClass       3 Video Interface Collection
      bFunctionProtocol       0 
      iFunction               4 
    Interface Descriptor:
      bLength                 9
      bDescriptorType         4
      bInterfaceNumber        0
      bAlternateSetting       0
      bNumEndpoints           1
      bInterfaceClass        14 Video
      bInterfaceSubClass      1 Video Control
      bInterfaceProtocol      1 
      iInterface              4 
      VideoControl Interface Descriptor:
        bLength                13
        bDescriptorType        36
        bDescriptorSubtype      1 (HEADER)
        bcdUVC               1.50
        wTotalLength          111
        dwClockFrequency       48.000000MHz
        bInCollection           1
        baInterfaceNr( 0)       1
      VideoControl Interface Descriptor:
        bLength                18
        bDescriptorType        36
        bDescriptorSubtype      2 (INPUT_TERMINAL)
        bTerminalID             1
        wTerminalType      0x0201 Camera Sensor
        bAssocTerminal          0
        iTerminal               0 
        wObjectiveFocalLengthMin      0
        wObjectiveFocalLengthMax      0
        wOcularFocalLength            0
        bControlSize                  3
        bmControls           0x0030000e
          Auto-Exposure Mode
          Auto-Exposure Priority
          Exposure Time (Absolute)
      VideoControl Interface Descriptor:
        bLength                13
        bDescriptorType        36
        bDescriptorSubtype      5 (PROCESSING_UNIT)
        bUnitID                 2
        bSourceID               1
        wMaxMultiplier      16384
        bControlSize            3
        bmControls     0x0000177f
          Brightness
          Contrast
          Hue
          Saturation
          Sharpness
          Gamma
          White Balance Temperature
          Backlight Compensation
          Gain
          Power Line Frequency
          White Balance Temperature, Auto
        iProcessing             0 
        bmVideoStandards     0x 0
      VideoControl Interface Descriptor:
        bLength                29
        bDescriptorType        36
        bDescriptorSubtype      6 (EXTENSION_UNIT)
        bUnitID                 3
        guidExtensionCode         {C3336EC4-CCA4-0006-DBD2-6B033FEA5A18}
        bNumControl             5
        bNrPins                 1
        baSourceID( 0)          2
        bControlSize            4
        bmControls( 0)       0x1f
        bmControls( 1)       0x00
        bmControls( 2)       0x00
        bmControls( 3)       0x00
        iExtension              0 
      VideoControl Interface Descriptor:
        bLength                29
        bDescriptorType        36
        bDescriptorSubtype      6 (EXTENSION_UNIT)
        bUnitID                 4
        guidExtensionCode         {57A40D85-DBB8-0870-409F-14220B2521DC}
        bNumControl            20
        bNrPins                 1
        baSourceID( 0)          3
        bControlSize            4
        bmControls( 0)       0xff
        bmControls( 1)       0xff
        bmControls( 2)       0x71
        bmControls( 3)       0x00
        iExtension              0 
      VideoControl Interface Descriptor:
        bLength                 9
        bDescriptorType        36
        bDescriptorSubtype      3 (OUTPUT_TERMINAL)
        bTerminalID             5
        wTerminalType      0x0101 USB Streaming
        bAssocTerminal          0
        bSourceID               4
        iTerminal               0 
      Endpoint Descriptor:
        bLength                 7
        bDescriptorType         5
        bEndpointAddress     0x87  EP 7 IN
        bmAttributes            3
          Transfer Type            Interrupt
          Synch Type               None
          Usage Type               Data
        wMaxPacketSize     0x0010  1x 16 bytes
        bInterval               8
    Interface Descriptor:
      bLength                 9
      bDescriptorType         4
      bInterfaceNumber        1
      bAlternateSetting       0
      bNumEndpoints           0
      bInterfaceClass        14 Video
      bInterfaceSubClass      2 Video Streaming
      bInterfaceProtocol      1 
      iInterface              0 
      VideoStreaming Interface Descriptor:
        bLength                            15
        bDescriptorType                    36
        bDescriptorSubtype                  1 (INPUT_HEADER)
        bNumFormats                         2
        wTotalLength                      395
        bEndPointAddress                  129
        bmInfo                              0
        bTerminalLink                       5
        bStillCaptureMethod                 1
        bTriggerSupport                     0
        bTriggerUsage                       0
        bControlSize                        1
        bmaControls( 0)                    11
        bmaControls( 1)                    11
      VideoStreaming Interface Descriptor:
        bLength                            11
        bDescriptorType                    36
        bDescriptorSubtype                  6 (FORMAT_MJPEG)
        bFormatIndex                        1
        bNumFrameDescriptors                6
        bFlags                              1
          Fixed-size samples: Yes
        bDefaultFrameIndex                  1
        bAspectRatioX                       0
        bAspectRatioY                       0
        bmInterlaceFlags                 0x00
          Interlaced stream or variable: No
          Fields per frame: 1 fields
          Field 1 first: No
          Field pattern: Field 1 only
          bCopyProtect                      0
      VideoStreaming Interface Descriptor:
        bLength                            30
        bDescriptorType                    36
        bDescriptorSubtype                  7 (FRAME_MJPEG)
        bFrameIndex                         1
        bmCapabilities                   0x01
          Still image supported
        wWidth                           1280
        wHeight                           720
        dwMinBitRate                442368000
        dwMaxBitRate                442368000
        dwMaxVideoFrameBufferSize     1843200
        dwDefaultFrameInterval         333333
        bFrameIntervalType                  1
        dwFrameInterval( 0)            333333
      VideoStreaming Interface Descriptor:
        bLength                            30
        bDescriptorType                    36
        bDescriptorSubtype                  7 (FRAME_MJPEG)
        bFrameIndex                         2
        bmCapabilities                   0x01
          Still image supported
        wWidth                            640
        wHeight                           480
        dwMinBitRate                147456000
        dwMaxBitRate                147456000
        dwMaxVideoFrameBufferSize      614400
        dwDefaultFrameInterval         333333
        bFrameIntervalType                  1
        dwFrameInterval( 0)            333333
      VideoStreaming Interface Descriptor:
        bLength                            30
        bDescriptorType                    36
        bDescriptorSubtype                  7 (FRAME_MJPEG)
        bFrameIndex                         3
        bmCapabilities                   0x01
          Still image supported
        wWidth                            640
        wHeight                           360
        dwMinBitRate                110592000
        dwMaxBitRate                110592000
        dwMaxVideoFrameBufferSize      460800
        dwDefaultFrameInterval         333333
        bFrameIntervalType                  1
        dwFrameInterval( 0)            333333
      VideoStreaming Interface Descriptor:
        bLength                            30
        bDescriptorType                    36
        bDescriptorSubtype                  7 (FRAME_MJPEG)
        bFrameIndex                         4
        bmCapabilities                   0x01
          Still image supported
        wWidth                            352
        wHeight                           288
        dwMinBitRate                 48660480
        dwMaxBitRate                 48660480
        dwMaxVideoFrameBufferSize      202752
        dwDefaultFrameInterval         333333
        bFrameIntervalType                  1
        dwFrameInterval( 0)            333333
      VideoStreaming Interface Descriptor:
        bLength                            30
        bDescriptorType                    36
        bDescriptorSubtype                  7 (FRAME_MJPEG)
        bFrameIndex                         5
        bmCapabilities                   0x01
          Still image supported
        wWidth                            320
        wHeight                           240
        dwMinBitRate                 36864000
        dwMaxBitRate                 36864000
        dwMaxVideoFrameBufferSize      153600
        dwDefaultFrameInterval         333333
        bFrameIntervalType                  1
        dwFrameInterval( 0)            333333
      VideoStreaming Interface Descriptor:
        bLength                            30
        bDescriptorType                    36
        bDescriptorSubtype                  7 (FRAME_MJPEG)
        bFrameIndex                         6
        bmCapabilities                   0x01
          Still image supported
        wWidth                            176
        wHeight                           144
        dwMinBitRate                 12165120
        dwMaxBitRate                 12165120
        dwMaxVideoFrameBufferSize       50688
        dwDefaultFrameInterval         333333
        bFrameIntervalType                  1
        dwFrameInterval( 0)            333333
      VideoStreaming Interface Descriptor:
        bLength                             6
        bDescriptorType                    36
        bDescriptorSubtype                 13 (COLORFORMAT)
        bColorPrimaries                     1 (BT.709,sRGB)
        bTransferCharacteristics            1 (BT.709)
        bMatrixCoefficients                 4 (SMPTE 170M (BT.601))
      VideoStreaming Interface Descriptor:
        bLength                            27
        bDescriptorType                    36
        bDescriptorSubtype                  4 (FORMAT_UNCOMPRESSED)
        bFormatIndex                        2
        bNumFrameDescriptors                5
        guidFormat                            {6E201A97-DDD2-26A0-3784-14A3624F1FC1}
        bBitsPerPixel                      16
        bDefaultFrameIndex                  1
        bAspectRatioX                       0
        bAspectRatioY                       0
        bmInterlaceFlags                 0x00
          Interlaced stream or variable: No
          Fields per frame: 2 fields
          Field 1 first: No
          Field pattern: Field 1 only
          bCopyProtect                      0
      VideoStreaming Interface Descriptor:
        bLength                            30
        bDescriptorType                    36
        bDescriptorSubtype                  5 (FRAME_UNCOMPRESSED)
        bFrameIndex                         1
        bmCapabilities                   0x01
          Still image supported
        wWidth                            640
        wHeight                           480
        dwMinBitRate                147456000
        dwMaxBitRate                147456000
        dwMaxVideoFrameBufferSize      614400
        dwDefaultFrameInterval         333333
        bFrameIntervalType                  1
        dwFrameInterval( 0)            333333
      VideoStreaming Interface Descriptor:
        bLength                            30
        bDescriptorType                    36
        bDescriptorSubtype                  5 (FRAME_UNCOMPRESSED)
        bFrameIndex                         2
        bmCapabilities                   0x01
          Still image supported
        wWidth                            640
        wHeight                           360
        dwMinBitRate                110592000
        dwMaxBitRate                110592000
        dwMaxVideoFrameBufferSize      460800
        dwDefaultFrameInterval         333333
        bFrameIntervalType                  1
        dwFrameInterval( 0)            333333
      VideoStreaming Interface Descriptor:
        bLength                            30
        bDescriptorType                    36
        bDescriptorSubtype                  5 (FRAME_UNCOMPRESSED)
        bFrameIndex                         3
        bmCapabilities                   0x01
          Still image supported
        wWidth                            352
        wHeight                           288
        dwMinBitRate                 48660480
        dwMaxBitRate                 48660480
        dwMaxVideoFrameBufferSize      202752
        dwDefaultFrameInterval         333333
        bFrameIntervalType                  1
        dwFrameInterval( 0)            333333
      VideoStreaming Interface Descriptor:
        bLength                            30
        bDescriptorType                    36
        bDescriptorSubtype                  5 (FRAME_UNCOMPRESSED)
        bFrameIndex                         4
        bmCapabilities                   0x01
          Still image supported
        wWidth                            320
        wHeight                           240
        dwMinBitRate                 36864000
        dwMaxBitRate                 36864000
        dwMaxVideoFrameBufferSize      153600
        dwDefaultFrameInterval         333333
        bFrameIntervalType                  1
        dwFrameInterval( 0)            333333
      VideoStreaming Interface Descriptor:
        bLength                            30
        bDescriptorType                    36
        bDescriptorSubtype                  5 (FRAME_UNCOMPRESSED)
        bFrameIndex                         5
        bmCapabilities                   0x01
          Still image supported
        wWidth                            176
        wHeight                           144
        dwMinBitRate                 12165120
        dwMaxBitRate                 12165120
        dwMaxVideoFrameBufferSize       50688
        dwDefaultFrameInterval         333333
        bFrameIntervalType                  1
        dwFrameInterval( 0)            333333
      VideoStreaming Interface Descriptor:
        bLength                             6
        bDescriptorType                    36
        bDescriptorSubtype                 13 (COLORFORMAT)
        bColorPrimaries                     1 (BT.709,sRGB)
        bTransferCharacteristics            1 (BT.709)
        bMatrixCoefficients                 4 (SMPTE 170M (BT.601))
    Interface Descriptor:
      bLength                 9
      bDescriptorType         4
      bInterfaceNumber        1
      bAlternateSetting       1
      bNumEndpoints           1
      bInterfaceClass        14 Video
      bInterfaceSubClass      2 Video Streaming
      bInterfaceProtocol      1 
      iInterface              0 
      Endpoint Descriptor:
        bLength                 7
        bDescriptorType         5
        bEndpointAddress     0x81  EP 1 IN
        bmAttributes            5
          Transfer Type            Isochronous
          Synch Type               Asynchronous
          Usage Type               Data
        wMaxPacketSize     0x00c0  1x 192 bytes
        bInterval               1
    Interface Descriptor:
      bLength                 9
      bDescriptorType         4
      bInterfaceNumber        1
      bAlternateSetting       2
      bNumEndpoints           1
      bInterfaceClass        14 Video
      bInterfaceSubClass      2 Video Streaming
      bInterfaceProtocol      1 
      iInterface              0 
      Endpoint Descriptor:
        bLength                 7
        bDescriptorType         5
        bEndpointAddress     0x81  EP 1 IN
        bmAttributes            5
          Transfer Type            Isochronous
          Synch Type               Asynchronous
          Usage Type               Data
        wMaxPacketSize     0x0180  1x 384 bytes
        bInterval               1
    Interface Descriptor:
      bLength                 9
      bDescriptorType         4
      bInterfaceNumber        1
      bAlternateSetting       3
      bNumEndpoints           1
      bInterfaceClass        14 Video
      bInterfaceSubClass      2 Video Streaming
      bInterfaceProtocol      1 
      iInterface              0 
      Endpoint Descriptor:
        bLength                 7
        bDescriptorType         5
        bEndpointAddress     0x81  EP 1 IN
        bmAttributes            5
          Transfer Type            Isochronous
          Synch Type               Asynchronous
          Usage Type               Data
        wMaxPacketSize     0x0200  1x 512 bytes
        bInterval               1
    Interface Descriptor:
      bLength                 9
      bDescriptorType         4
      bInterfaceNumber        1
      bAlternateSetting       4
      bNumEndpoints           1
      bInterfaceClass        14 Video
      bInterfaceSubClass      2 Video Streaming
      bInterfaceProtocol      1 
      iInterface              0 
      Endpoint Descriptor:
        bLength                 7
        bDescriptorType         5
        bEndpointAddress     0x81  EP 1 IN
        bmAttributes            5
          Transfer Type            Isochronous
          Synch Type               Asynchronous
          Usage Type               Data
        wMaxPacketSize     0x0280  1x 640 bytes
        bInterval               1
    Interface Descriptor:
      bLength                 9
      bDescriptorType         4
      bInterfaceNumber        1
      bAlternateSetting       5
      bNumEndpoints           1
      bInterfaceClass        14 Video
      bInterfaceSubClass      2 Video Streaming
      bInterfaceProtocol      1 
      iInterface              0 
      Endpoint Descriptor:
        bLength                 7
        bDescriptorType         5
        bEndpointAddress     0x81  EP 1 IN
        bmAttributes            5
          Transfer Type            Isochronous
          Synch Type               Asynchronous
          Usage Type               Data
        wMaxPacketSize     0x0320  1x 800 bytes
        bInterval               1
    Interface Descriptor:
      bLength                 9
      bDescriptorType         4
      bInterfaceNumber        1
      bAlternateSetting       6
      bNumEndpoints           1
      bInterfaceClass        14 Video
      bInterfaceSubClass      2 Video Streaming
      bInterfaceProtocol      1 
      iInterface              0 
      Endpoint Descriptor:
        bLength                 7
        bDescriptorType         5
        bEndpointAddress     0x81  EP 1 IN
        bmAttributes            5
          Transfer Type            Isochronous
          Synch Type               Asynchronous
          Usage Type               Data
        wMaxPacketSize     0x03b0  1x 944 bytes
        bInterval               1
    Interface Descriptor:
      bLength                 9
      bDescriptorType         4
      bInterfaceNumber        1
      bAlternateSetting       7
      bNumEndpoints           1
      bInterfaceClass        14 Video
      bInterfaceSubClass      2 Video Streaming
      bInterfaceProtocol      1 
      iInterface              0 
      Endpoint Descriptor:
        bLength                 7
        bDescriptorType         5
        bEndpointAddress     0x81  EP 1 IN
        bmAttributes            5
          Transfer Type            Isochronous
          Synch Type               Asynchronous
          Usage Type               Data
        wMaxPacketSize     0x0a80  2x 640 bytes
        bInterval               1
    Interface Descriptor:
      bLength                 9
      bDescriptorType         4
      bInterfaceNumber        1
      bAlternateSetting       8
      bNumEndpoints           1
      bInterfaceClass        14 Video
      bInterfaceSubClass      2 Video Streaming
      bInterfaceProtocol      1 
      iInterface              0 
      Endpoint Descriptor:
        bLength                 7
        bDescriptorType         5
        bEndpointAddress     0x81  EP 1 IN
        bmAttributes            5
          Transfer Type            Isochronous
          Synch Type               Asynchronous
          Usage Type               Data
        wMaxPacketSize     0x0b20  2x 800 bytes
        bInterval               1
    Interface Descriptor:
      bLength                 9
      bDescriptorType         4
      bInterfaceNumber        1
      bAlternateSetting       9
      bNumEndpoints           1
      bInterfaceClass        14 Video
      bInterfaceSubClass      2 Video Streaming
      bInterfaceProtocol      1 
      iInterface              0 
      Endpoint Descriptor:
        bLength                 7
        bDescriptorType         5
        bEndpointAddress     0x81  EP 1 IN
        bmAttributes            5
          Transfer Type            Isochronous
          Synch Type               Asynchronous
          Usage Type               Data
        wMaxPacketSize     0x0be0  2x 992 bytes
        bInterval               1
    Interface Descriptor:
      bLength                 9
      bDescriptorType         4
      bInterfaceNumber        1
      bAlternateSetting      10
      bNumEndpoints           1
      bInterfaceClass        14 Video
      bInterfaceSubClass      2 Video Streaming
      bInterfaceProtocol      1 
      iInterface              0 
      Endpoint Descriptor:
        bLength                 7
        bDescriptorType         5
        bEndpointAddress     0x81  EP 1 IN
        bmAttributes            5
          Transfer Type            Isochronous
          Synch Type               Asynchronous
          Usage Type               Data
        wMaxPacketSize     0x13c0  3x 960 bytes
        bInterval               1
    Interface Descriptor:
      bLength                 9
      bDescriptorType         4
      bInterfaceNumber        1
      bAlternateSetting      11
      bNumEndpoints           1
      bInterfaceClass        14 Video
      bInterfaceSubClass      2 Video Streaming
      bInterfaceProtocol      1 
      iInterface              0 
      Endpoint Descriptor:
        bLength                 7
        bDescriptorType         5
        bEndpointAddress     0x81  EP 1 IN
        bmAttributes            5
          Transfer Type            Isochronous
          Synch Type               Asynchronous
          Usage Type               Data
        wMaxPacketSize     0x13fc  3x 1020 bytes
        bInterval               1
    Interface Association:
      bLength                 8
      bDescriptorType        11
      bFirstInterface         2
      bInterfaceCount         2
      bFunctionClass         14 Video
      bFunctionSubClass       3 Video Interface Collection
      bFunctionProtocol       0 
      iFunction              11 
    Interface Descriptor:
      bLength                 9
      bDescriptorType         4
      bInterfaceNumber        2
      bAlternateSetting       0
      bNumEndpoints           1
      bInterfaceClass        14 Video
      bInterfaceSubClass      1 Video Control
      bInterfaceProtocol      1 
      iInterface             11 
      VideoControl Interface Descriptor:
        bLength                13
        bDescriptorType        36
        bDescriptorSubtype      1 (HEADER)
        bcdUVC               1.50
        wTotalLength          111
        dwClockFrequency       48.000000MHz
        bInCollection           1
        baInterfaceNr( 0)       3
      VideoControl Interface Descriptor:
        bLength                18
        bDescriptorType        36
        bDescriptorSubtype      2 (INPUT_TERMINAL)
        bTerminalID             1
        wTerminalType      0x0201 Camera Sensor
        bAssocTerminal          0
        iTerminal               0 
        wObjectiveFocalLengthMin      0
        wObjectiveFocalLengthMax      0
        wOcularFocalLength            0
        bControlSize                  3
        bmControls           0x00300000
      VideoControl Interface Descriptor:
        bLength                13
        bDescriptorType        36
        bDescriptorSubtype      5 (PROCESSING_UNIT)
        bUnitID                 2
        bSourceID               1
        wMaxMultiplier      16384
        bControlSize            3
        bmControls     0x00000000
        iProcessing             0 
        bmVideoStandards     0x 0
      VideoControl Interface Descriptor:
        bLength                29
        bDescriptorType        36
        bDescriptorSubtype      6 (EXTENSION_UNIT)
        bUnitID                 7
        guidExtensionCode         {E9F01841-1E1E-7FA2-269A-FECD110859DC}
        bNumControl             4
        bNrPins                 1
        baSourceID( 0)          2
        bControlSize            4
        bmControls( 0)       0xe0
        bmControls( 1)       0x01
        bmControls( 2)       0x00
        bmControls( 3)       0x00
        iExtension              0 
      VideoControl Interface Descriptor:
        bLength                29
        bDescriptorType        36
        bDescriptorSubtype      6 (EXTENSION_UNIT)
        bUnitID                 4
        guidExtensionCode         {57A40D85-DBB8-0870-409F-14220B2521DC}
        bNumControl            27
        bNrPins                 1
        baSourceID( 0)          7
        bControlSize            4
        bmControls( 0)       0xff
        bmControls( 1)       0xff
        bmControls( 2)       0x77
        bmControls( 3)       0x1f
        iExtension              0 
      VideoControl Interface Descriptor:
        bLength                 9
        bDescriptorType        36
        bDescriptorSubtype      3 (OUTPUT_TERMINAL)
        bTerminalID             5
        wTerminalType      0x0101 USB Streaming
        bAssocTerminal          0
        bSourceID               4
        iTerminal               0 
      Endpoint Descriptor:
        bLength                 7
        bDescriptorType         5
        bEndpointAddress     0x84  EP 4 IN
        bmAttributes            3
          Transfer Type            Interrupt
          Synch Type               None
          Usage Type               Data
        wMaxPacketSize     0x0010  1x 16 bytes
        bInterval               8
    Interface Descriptor:
      bLength                 9
      bDescriptorType         4
      bInterfaceNumber        3
      bAlternateSetting       0
      bNumEndpoints           0
      bInterfaceClass        14 Video
      bInterfaceSubClass      2 Video Streaming
      bInterfaceProtocol      1 
      iInterface              0 
      VideoStreaming Interface Descriptor:
        bLength                            14
        bDescriptorType                    36
        bDescriptorSubtype                  1 (INPUT_HEADER)
        bNumFormats                         1
        wTotalLength                       77
        bEndPointAddress                  130
        bmInfo                              0
        bTerminalLink                       5
        bStillCaptureMethod                 1
        bTriggerSupport                     0
        bTriggerUsage                       0
        bControlSize                        1
        bmaControls( 0)                    27
      VideoStreaming Interface Descriptor:
        bLength                            27
        bDescriptorType                    36
        bDescriptorSubtype                  4 (FORMAT_UNCOMPRESSED)
        bFormatIndex                        1
        bNumFrameDescriptors                1
        guidFormat                            {23FB201E-C9A5-AA45-7A3A-97F8E7122BD6}
        bBitsPerPixel                       8
        bDefaultFrameIndex                  1
        bAspectRatioX                       0
        bAspectRatioY                       0
        bmInterlaceFlags                 0x00
          Interlaced stream or variable: No
          Fields per frame: 2 fields
          Field 1 first: No
          Field pattern: Field 1 only
          bCopyProtect                      0
      VideoStreaming Interface Descriptor:
        bLength                            30
        bDescriptorType                    36
        bDescriptorSubtype                  5 (FRAME_UNCOMPRESSED)
        bFrameIndex                         1
        bmCapabilities                   0x01
          Still image supported
        wWidth                            640
        wHeight                           360
        dwMinBitRate                 55296000
        dwMaxBitRate                 55296000
        dwMaxVideoFrameBufferSize      460800
        dwDefaultFrameInterval         333333
        bFrameIntervalType                  1
        dwFrameInterval( 0)            333333
      VideoStreaming Interface Descriptor:
        bLength                             6
        bDescriptorType                    36
        bDescriptorSubtype                 13 (COLORFORMAT)
        bColorPrimaries                     1 (BT.709,sRGB)
        bTransferCharacteristics            1 (BT.709)
        bMatrixCoefficients                 4 (SMPTE 170M (BT.601))
    Interface Descriptor:
      bLength                 9
      bDescriptorType         4
      bInterfaceNumber        3
      bAlternateSetting       1
      bNumEndpoints           1
      bInterfaceClass        14 Video
      bInterfaceSubClass      2 Video Streaming
      bInterfaceProtocol      1 
      iInterface              0 
      Endpoint Descriptor:
        bLength                 7
        bDescriptorType         5
        bEndpointAddress     0x82  EP 2 IN
        bmAttributes            5
          Transfer Type            Isochronous
          Synch Type               Asynchronous
          Usage Type               Data
        wMaxPacketSize     0x0a80  2x 640 bytes
        bInterval               1

Bus 003 Device 009: ID 1532:0067 Razer USA, Ltd Naga Trinity
Device Descriptor:
  bLength                18
  bDescriptorType         1
  bcdUSB               2.00
  bDeviceClass            0 (Defined at Interface level)
  bDeviceSubClass         0 
  bDeviceProtocol         0 
  bMaxPacketSize0        64
  idVendor           0x1532 Razer USA, Ltd
  idProduct          0x0067 Naga Trinity
  bcdDevice            2.00
  iManufacturer           1 
  iProduct                2 
  iSerial                 3 
  --
  Configuration Descriptor:
    bLength                 9
    bDescriptorType         2
    wTotalLength           84
    bNumInterfaces          3
    bConfigurationValue     1
    iConfiguration          0 
    bmAttributes         0xa0
      (Bus Powered)
      Remote Wakeup
    MaxPower              500mA
    Interface Descriptor:
      bLength                 9
      bDescriptorType         4
      bInterfaceNumber        0
      bAlternateSetting       0
      bNumEndpoints           1
      bInterfaceClass         3 Human Interface Device
      bInterfaceSubClass      1 Boot Interface Subclass
      bInterfaceProtocol      2 Mouse
      iInterface              0 
        HID Device Descriptor:
          bLength                 9
          bDescriptorType        33
          bcdHID               1.11
          bCountryCode            0 Not supported
          bNumDescriptors         1
          bDescriptorType        34 Report
          wDescriptorLength      94
         Report Descriptors: 
           ** UNAVAILABLE **
      Endpoint Descriptor:
        bLength                 7
        bDescriptorType         5
        bEndpointAddress     0x81  EP 1 IN
        bmAttributes            3
          Transfer Type            Interrupt
          Synch Type               None
          Usage Type               Data
        wMaxPacketSize     0x0008  1x 8 bytes
        bInterval               1
    Interface Descriptor:
      bLength                 9
      bDescriptorType         4
      bInterfaceNumber        1
      bAlternateSetting       0
      bNumEndpoints           1
      bInterfaceClass         3 Human Interface Device
      bInterfaceSubClass      0 No Subclass
      bInterfaceProtocol      1 Keyboard
      iInterface              0 
        HID Device Descriptor:
          bLength                 9
          bDescriptorType        33
          bcdHID               1.11
          bCountryCode            0 Not supported
          bNumDescriptors         1
          bDescriptorType        34 Report
          wDescriptorLength     159
         Report Descriptors: 
           ** UNAVAILABLE **
      Endpoint Descriptor:
        bLength                 7
        bDescriptorType         5
        bEndpointAddress     0x82  EP 2 IN
        bmAttributes            3
          Transfer Type            Interrupt
          Synch Type               None
          Usage Type               Data
        wMaxPacketSize     0x0010  1x 16 bytes
        bInterval               1
    Interface Descriptor:
      bLength                 9
      bDescriptorType         4
      bInterfaceNumber        2
      bAlternateSetting       0
      bNumEndpoints           1
      bInterfaceClass         3 Human Interface Device
      bInterfaceSubClass      0 No Subclass
      bInterfaceProtocol      1 Keyboard
      iInterface              0 
        HID Device Descriptor:
          bLength                 9
          bDescriptorType        33
          bcdHID               1.11
          bCountryCode            0 Not supported
          bNumDescriptors         1
          bDescriptorType        34 Report
          wDescriptorLength      61
         Report Descriptors: 
           ** UNAVAILABLE **
      Endpoint Descriptor:
        bLength                 7
        bDescriptorType         5
        bEndpointAddress     0x83  EP 3 IN
        bmAttributes            3
          Transfer Type            Interrupt
          Synch Type               None
          Usage Type               Data
        wMaxPacketSize     0x0008  1x 8 bytes
        bInterval               1

Bus 003 Device 008: ID 291a:8346  
Device Descriptor:
  bLength                18
  bDescriptorType         1
  bcdUSB               2.01
  bDeviceClass           17 
  bDeviceSubClass         0 
  bDeviceProtocol         0 
  bMaxPacketSize0        64
  idVendor           0x291a 
  idProduct          0x8346 
  bcdDevice            0.01
  iManufacturer           1 
  iProduct                2 
  iSerial                 3 
  --
  Configuration Descriptor:
    bLength                 9
    bDescriptorType         2
    wTotalLength           18
    bNumInterfaces          1
    bConfigurationValue     1
    iConfiguration          4 
    bmAttributes         0x80
      (Bus Powered)
    MaxPower              100mA
    Interface Descriptor:
      bLength                 9
      bDescriptorType         4
      bInterfaceNumber        0
      bAlternateSetting       0
      bNumEndpoints           0
      bInterfaceClass        17 
      bInterfaceSubClass      0 
      bInterfaceProtocol      0 
      iInterface              4 

Bus 002 Device 002: ID 05e3:0620 Genesys Logic, Inc. GL3523 Hub
Device Descriptor:
  bLength                18
  bDescriptorType         1
  bcdUSB               3.20
  bDeviceClass            9 Hub
  bDeviceSubClass         0 Unused
  bDeviceProtocol         3 
  bMaxPacketSize0         9
  idVendor           0x05e3 Genesys Logic, Inc.
  idProduct          0x0620 GL3523 Hub
  bcdDevice           23.11
  iManufacturer           1 
  iProduct                2 
  iSerial                 0 
  --
  Configuration Descriptor:
    bLength                 9
    bDescriptorType         2
    wTotalLength           31
    bNumInterfaces          1
    bConfigurationValue     1
    iConfiguration          0 
    bmAttributes         0xe0
      Self Powered
      Remote Wakeup
    MaxPower                0mA
    Interface Descriptor:
      bLength                 9
      bDescriptorType         4
      bInterfaceNumber        0
      bAlternateSetting       0
      bNumEndpoints           1
      bInterfaceClass         9 Hub
      bInterfaceSubClass      0 Unused
      bInterfaceProtocol      0 Full speed (or root) hub
      iInterface              0 
      Endpoint Descriptor:
        bLength                 7
        bDescriptorType         5
        bEndpointAddress     0x83  EP 3 IN
        bmAttributes           19
          Transfer Type            Interrupt
          Synch Type               None
          Usage Type               Feedback
        wMaxPacketSize     0x0002  1x 2 bytes
        bInterval               8
        bMaxBurst               0

Bus 004 Device 003: ID 04e8:61f5 Samsung Electronics Co., Ltd Portable SSD T5
Device Descriptor:
  bLength                18
  bDescriptorType         1
  bcdUSB               3.10
  bDeviceClass            0 (Defined at Interface level)
  bDeviceSubClass         0 
  bDeviceProtocol         0 
  bMaxPacketSize0         9
  idVendor           0x04e8 Samsung Electronics Co., Ltd
  idProduct          0x61f5 Portable SSD T5
  bcdDevice            1.00
  iManufacturer           2 
  iProduct                3 
  iSerial                 1 
  --
  Configuration Descriptor:
    bLength                 9
    bDescriptorType         2
    wTotalLength          121
    bNumInterfaces          1
    bConfigurationValue     1
    iConfiguration          0 
    bmAttributes         0x80
      (Bus Powered)
    MaxPower              224mA
    Interface Descriptor:
      bLength                 9
      bDescriptorType         4
      bInterfaceNumber        0
      bAlternateSetting       0
      bNumEndpoints           2
      bInterfaceClass         8 Mass Storage
      bInterfaceSubClass      6 SCSI
      bInterfaceProtocol     80 Bulk-Only
      iInterface              0 
      Endpoint Descriptor:
        bLength                 7
        bDescriptorType         5
        bEndpointAddress     0x81  EP 1 IN
        bmAttributes            2
          Transfer Type            Bulk
          Synch Type               None
          Usage Type               Data
        wMaxPacketSize     0x0400  1x 1024 bytes
        bInterval               0
        bMaxBurst              15
      Endpoint Descriptor:
        bLength                 7
        bDescriptorType         5
        bEndpointAddress     0x02  EP 2 OUT
        bmAttributes            2
          Transfer Type            Bulk
          Synch Type               None
          Usage Type               Data
        wMaxPacketSize     0x0400  1x 1024 bytes
        bInterval               0
        bMaxBurst              15
    Interface Descriptor:
      bLength                 9
      bDescriptorType         4
      bInterfaceNumber        0
      bAlternateSetting       1
      bNumEndpoints           4
      bInterfaceClass         8 Mass Storage
      bInterfaceSubClass      6 SCSI
      bInterfaceProtocol     98 
      iInterface              0 
      Endpoint Descriptor:
        bLength                 7
        bDescriptorType         5
        bEndpointAddress     0x81  EP 1 IN
        bmAttributes            2
          Transfer Type            Bulk
          Synch Type               None
          Usage Type               Data
        wMaxPacketSize     0x0400  1x 1024 bytes
        bInterval               0
        bMaxBurst              15
        MaxStreams             32
        Data-in pipe (0x03)
      Endpoint Descriptor:
        bLength                 7
        bDescriptorType         5
        bEndpointAddress     0x02  EP 2 OUT
        bmAttributes            2
          Transfer Type            Bulk
          Synch Type               None
          Usage Type               Data
        wMaxPacketSize     0x0400  1x 1024 bytes
        bInterval               0
        bMaxBurst              15
        MaxStreams             32
        Data-out pipe (0x04)
      Endpoint Descriptor:
        bLength                 7
        bDescriptorType         5
        bEndpointAddress     0x83  EP 3 IN
        bmAttributes            2
          Transfer Type            Bulk
          Synch Type               None
          Usage Type               Data
        wMaxPacketSize     0x0400  1x 1024 bytes
        bInterval               0
        bMaxBurst              15
        MaxStreams             32
        Status pipe (0x02)
      Endpoint Descriptor:
        bLength                 7
        bDescriptorType         5
        bEndpointAddress     0x04  EP 4 OUT
        bmAttributes            2
          Transfer Type            Bulk
          Synch Type               None
          Usage Type               Data
        wMaxPacketSize     0x0400  1x 1024 bytes
        bInterval               0
        bMaxBurst               0
        Command pipe (0x01)

Bus 004 Device 005: ID 2109:0813 VIA Labs, Inc. VL813 Hub
Device Descriptor:
  bLength                18
  bDescriptorType         1
  bcdUSB               3.00
  bDeviceClass            9 Hub
  bDeviceSubClass         0 Unused
  bDeviceProtocol         3 
  bMaxPacketSize0         9
  idVendor           0x2109 VIA Labs, Inc.
  idProduct          0x0813 VL813 Hub
  bcdDevice           90.11
  iManufacturer           1 
  iProduct                2 
  iSerial                 0 
  --
  Configuration Descriptor:
    bLength                 9
    bDescriptorType         2
    wTotalLength           31
    bNumInterfaces          1
    bConfigurationValue     1
    iConfiguration          0 
    bmAttributes         0xe0
      Self Powered
      Remote Wakeup
    MaxPower                0mA
    Interface Descriptor:
      bLength                 9
      bDescriptorType         4
      bInterfaceNumber        0
      bAlternateSetting       0
      bNumEndpoints           1
      bInterfaceClass         9 Hub
      bInterfaceSubClass      0 Unused
      bInterfaceProtocol      0 Full speed (or root) hub
      iInterface              0 
      Endpoint Descriptor:
        bLength                 7
        bDescriptorType         5
        bEndpointAddress     0x81  EP 1 IN
        bmAttributes           19
          Transfer Type            Interrupt
          Synch Type               None
          Usage Type               Feedback
        wMaxPacketSize     0x0002  1x 2 bytes
        bInterval               8
        bMaxBurst               0

Bus 003 Device 004: ID 8087:0029 Intel Corp. AX200 Bluetooth
Device Descriptor:
  bLength                18
  bDescriptorType         1
  bcdUSB               2.01
  bDeviceClass          224 Wireless
  bDeviceSubClass         1 Radio Frequency
  bDeviceProtocol         1 Bluetooth
  bMaxPacketSize0        64
  idVendor           0x8087 Intel Corp.
  idProduct          0x0029 AX200 Bluetooth
  bcdDevice            0.01
  iManufacturer           0 
  iProduct                0 
  iSerial                 0 
  --
  Configuration Descriptor:
    bLength                 9
    bDescriptorType         2
    wTotalLength          200
    bNumInterfaces          2
    bConfigurationValue     1
    iConfiguration          0 
    bmAttributes         0xe0
      Self Powered
      Remote Wakeup
    MaxPower              100mA
    Interface Descriptor:
      bLength                 9
      bDescriptorType         4
      bInterfaceNumber        0
      bAlternateSetting       0
      bNumEndpoints           3
      bInterfaceClass       224 Wireless
      bInterfaceSubClass      1 Radio Frequency
      bInterfaceProtocol      1 Bluetooth
      iInterface              0 
      Endpoint Descriptor:
        bLength                 7
        bDescriptorType         5
        bEndpointAddress     0x81  EP 1 IN
        bmAttributes            3
          Transfer Type            Interrupt
          Synch Type               None
          Usage Type               Data
        wMaxPacketSize     0x0040  1x 64 bytes
        bInterval               1
      Endpoint Descriptor:
        bLength                 7
        bDescriptorType         5
        bEndpointAddress     0x02  EP 2 OUT
        bmAttributes            2
          Transfer Type            Bulk
          Synch Type               None
          Usage Type               Data
        wMaxPacketSize     0x0040  1x 64 bytes
        bInterval               1
      Endpoint Descriptor:
        bLength                 7
        bDescriptorType         5
        bEndpointAddress     0x82  EP 2 IN
        bmAttributes            2
          Transfer Type            Bulk
          Synch Type               None
          Usage Type               Data
        wMaxPacketSize     0x0040  1x 64 bytes
        bInterval               1
    Interface Descriptor:
      bLength                 9
      bDescriptorType         4
      bInterfaceNumber        1
      bAlternateSetting       0
      bNumEndpoints           2
      bInterfaceClass       224 Wireless
      bInterfaceSubClass      1 Radio Frequency
      bInterfaceProtocol      1 Bluetooth
      iInterface              0 
      Endpoint Descriptor:
        bLength                 7
        bDescriptorType         5
        bEndpointAddress     0x03  EP 3 OUT
        bmAttributes            1
          Transfer Type            Isochronous
          Synch Type               None
          Usage Type               Data
        wMaxPacketSize     0x0000  1x 0 bytes
        bInterval               1
      Endpoint Descriptor:
        bLength                 7
        bDescriptorType         5
        bEndpointAddress     0x83  EP 3 IN
        bmAttributes            1
          Transfer Type            Isochronous
          Synch Type               None
          Usage Type               Data
        wMaxPacketSize     0x0000  1x 0 bytes
        bInterval               1
    Interface Descriptor:
      bLength                 9
      bDescriptorType         4
      bInterfaceNumber        1
      bAlternateSetting       1
      bNumEndpoints           2
      bInterfaceClass       224 Wireless
      bInterfaceSubClass      1 Radio Frequency
      bInterfaceProtocol      1 Bluetooth
      iInterface              0 
      Endpoint Descriptor:
        bLength                 7
        bDescriptorType         5
        bEndpointAddress     0x03  EP 3 OUT
        bmAttributes            1
          Transfer Type            Isochronous
          Synch Type               None
          Usage Type               Data
        wMaxPacketSize     0x0009  1x 9 bytes
        bInterval               1
      Endpoint Descriptor:
        bLength                 7
        bDescriptorType         5
        bEndpointAddress     0x83  EP 3 IN
        bmAttributes            1
          Transfer Type            Isochronous
          Synch Type               None
          Usage Type               Data
        wMaxPacketSize     0x0009  1x 9 bytes
        bInterval               1
    Interface Descriptor:
      bLength                 9
      bDescriptorType         4
      bInterfaceNumber        1
      bAlternateSetting       2
      bNumEndpoints           2
      bInterfaceClass       224 Wireless
      bInterfaceSubClass      1 Radio Frequency
      bInterfaceProtocol      1 Bluetooth
      iInterface              0 
      Endpoint Descriptor:
        bLength                 7
        bDescriptorType         5
        bEndpointAddress     0x03  EP 3 OUT
        bmAttributes            1
          Transfer Type            Isochronous
          Synch Type               None
          Usage Type               Data
        wMaxPacketSize     0x0011  1x 17 bytes
        bInterval               1
      Endpoint Descriptor:
        bLength                 7
        bDescriptorType         5
        bEndpointAddress     0x83  EP 3 IN
        bmAttributes            1
          Transfer Type            Isochronous
          Synch Type               None
          Usage Type               Data
        wMaxPacketSize     0x0011  1x 17 bytes
        bInterval               1
    Interface Descriptor:
      bLength                 9
      bDescriptorType         4
      bInterfaceNumber        1
      bAlternateSetting       3
      bNumEndpoints           2
      bInterfaceClass       224 Wireless
      bInterfaceSubClass      1 Radio Frequency
      bInterfaceProtocol      1 Bluetooth
      iInterface              0 
      Endpoint Descriptor:
        bLength                 7
        bDescriptorType         5
        bEndpointAddress     0x03  EP 3 OUT
        bmAttributes            1
          Transfer Type            Isochronous
          Synch Type               None
          Usage Type               Data
        wMaxPacketSize     0x0019  1x 25 bytes
        bInterval               1
      Endpoint Descriptor:
        bLength                 7
        bDescriptorType         5
        bEndpointAddress     0x83  EP 3 IN
        bmAttributes            1
          Transfer Type            Isochronous
          Synch Type               None
          Usage Type               Data
        wMaxPacketSize     0x0019  1x 25 bytes
        bInterval               1
    Interface Descriptor:
      bLength                 9
      bDescriptorType         4
      bInterfaceNumber        1
      bAlternateSetting       4
      bNumEndpoints           2
      bInterfaceClass       224 Wireless
      bInterfaceSubClass      1 Radio Frequency
      bInterfaceProtocol      1 Bluetooth
      iInterface              0 
      Endpoint Descriptor:
        bLength                 7
        bDescriptorType         5
        bEndpointAddress     0x03  EP 3 OUT
        bmAttributes            1
          Transfer Type            Isochronous
          Synch Type               None
          Usage Type               Data
        wMaxPacketSize     0x0021  1x 33 bytes
        bInterval               1
      Endpoint Descriptor:
        bLength                 7
        bDescriptorType         5
        bEndpointAddress     0x83  EP 3 IN
        bmAttributes            1
          Transfer Type            Isochronous
          Synch Type               None
          Usage Type               Data
        wMaxPacketSize     0x0021  1x 33 bytes
        bInterval               1
    Interface Descriptor:
      bLength                 9
      bDescriptorType         4
      bInterfaceNumber        1
      bAlternateSetting       5
      bNumEndpoints           2
      bInterfaceClass       224 Wireless
      bInterfaceSubClass      1 Radio Frequency
      bInterfaceProtocol      1 Bluetooth
      iInterface              0 
      Endpoint Descriptor:
        bLength                 7
        bDescriptorType         5
        bEndpointAddress     0x03  EP 3 OUT
        bmAttributes            1
          Transfer Type            Isochronous
          Synch Type               None
          Usage Type               Data
        wMaxPacketSize     0x0031  1x 49 bytes
        bInterval               1
      Endpoint Descriptor:
        bLength                 7
        bDescriptorType         5
        bEndpointAddress     0x83  EP 3 IN
        bmAttributes            1
          Transfer Type            Isochronous
          Synch Type               None
          Usage Type               Data
        wMaxPacketSize     0x0031  1x 49 bytes
        bInterval               1
    Interface Descriptor:
      bLength                 9
      bDescriptorType         4
      bInterfaceNumber        1
      bAlternateSetting       6
      bNumEndpoints           2
      bInterfaceClass       224 Wireless
      bInterfaceSubClass      1 Radio Frequency
      bInterfaceProtocol      1 Bluetooth
      iInterface              0 
      Endpoint Descriptor:
        bLength                 7
        bDescriptorType         5
        bEndpointAddress     0x03  EP 3 OUT
        bmAttributes            1
          Transfer Type            Isochronous
          Synch Type               None
          Usage Type               Data
        wMaxPacketSize     0x003f  1x 63 bytes
        bInterval               1
      Endpoint Descriptor:
        bLength                 7
        bDescriptorType         5
        bEndpointAddress     0x83  EP 3 IN
        bmAttributes            1
          Transfer Type            Isochronous
          Synch Type               None
          Usage Type               Data
        wMaxPacketSize     0x003f  1x 63 bytes
        bInterval               1

Bus 003 Device 006: ID 048d:6004 Integrated Technology Express, Inc. 
Device Descriptor:
  bLength                18
  bDescriptorType         1
  bcdUSB               2.00
  bDeviceClass            0 (Defined at Interface level)
  bDeviceSubClass         0 
  bDeviceProtocol         0 
  bMaxPacketSize0        64
  idVendor           0x048d Integrated Technology Express, Inc.
  idProduct          0x6004 
  bcdDevice            0.03
  iManufacturer           1 
  iProduct                2 
  iSerial                 0 
  --
  Configuration Descriptor:
    bLength                 9
    bDescriptorType         2
    wTotalLength           59
    bNumInterfaces          2
    bConfigurationValue     1
    iConfiguration          0 
    bmAttributes         0xc0
      Self Powered
    MaxPower              100mA
    Interface Descriptor:
      bLength                 9
      bDescriptorType         4
      bInterfaceNumber        0
      bAlternateSetting       0
      bNumEndpoints           0
      bInterfaceClass         3 Human Interface Device
      bInterfaceSubClass      1 Boot Interface Subclass
      bInterfaceProtocol      1 Keyboard
      iInterface              0 
        HID Device Descriptor:
          bLength                 9
          bDescriptorType        33
          bcdHID               1.10
          bCountryCode            0 Not supported
          bNumDescriptors         1
          bDescriptorType        34 Report
          wDescriptorLength      23
         Report Descriptors: 
           ** UNAVAILABLE **
    Interface Descriptor:
      bLength                 9
      bDescriptorType         4
      bInterfaceNumber        1
      bAlternateSetting       0
      bNumEndpoints           2
      bInterfaceClass         3 Human Interface Device
      bInterfaceSubClass      0 No Subclass
      bInterfaceProtocol      0 None
      iInterface              0 
        HID Device Descriptor:
          bLength                 9
          bDescriptorType        33
          bcdHID               1.10
          bCountryCode            0 Not supported
          bNumDescriptors         1
          bDescriptorType        34 Report
          wDescriptorLength      31
         Report Descriptors: 
           ** UNAVAILABLE **
      Endpoint Descriptor:
        bLength                 7
        bDescriptorType         5
        bEndpointAddress     0x81  EP 1 IN
        bmAttributes            3
          Transfer Type            Interrupt
          Synch Type               None
          Usage Type               Data
        wMaxPacketSize     0x0040  1x 64 bytes
        bInterval               1
      Endpoint Descriptor:
        bLength                 7
        bDescriptorType         5
        bEndpointAddress     0x02  EP 2 OUT
        bmAttributes            3
          Transfer Type            Interrupt
          Synch Type               None
          Usage Type               Data
        wMaxPacketSize     0x0040  1x 64 bytes
        bInterval               1

Bus 003 Device 003: ID 05e3:0608 Genesys Logic, Inc. Hub
Device Descriptor:
  bLength                18
  bDescriptorType         1
  bcdUSB               2.10
  bDeviceClass            9 Hub
  bDeviceSubClass         0 Unused
  bDeviceProtocol         1 Single TT
  bMaxPacketSize0        64
  idVendor           0x05e3 Genesys Logic, Inc.
  idProduct          0x0608 Hub
  bcdDevice           60.70
  iManufacturer           0 
  iProduct                0 
  iSerial                 0 
  --
  Configuration Descriptor:
    bLength                 9
    bDescriptorType         2
    wTotalLength           25
    bNumInterfaces          1
    bConfigurationValue     1
    iConfiguration          0 
    bmAttributes         0xe0
      Self Powered
      Remote Wakeup
    MaxPower              500mA
    Interface Descriptor:
      bLength                 9
      bDescriptorType         4
      bInterfaceNumber        0
      bAlternateSetting       0
      bNumEndpoints           1
      bInterfaceClass         9 Hub
      bInterfaceSubClass      0 Unused
      bInterfaceProtocol      0 Full speed (or root) hub
      iInterface              0 
      Endpoint Descriptor:
        bLength                 7
        bDescriptorType         5
        bEndpointAddress     0x81  EP 1 IN
        bmAttributes            3
          Transfer Type            Interrupt
          Synch Type               None
          Usage Type               Data
        wMaxPacketSize     0x0001  1x 1 bytes
        bInterval              12

Bus 001 Device 001: ID 1d6b:0002 Linux Foundation 2.0 root hub
Device Descriptor:
  bLength                18
  bDescriptorType         1
  bcdUSB               2.00
  bDeviceClass            9 Hub
  bDeviceSubClass         0 Unused
  bDeviceProtocol         1 Single TT
  bMaxPacketSize0        64
  idVendor           0x1d6b Linux Foundation
  idProduct          0x0002 2.0 root hub
  bcdDevice            5.15
  iManufacturer           3 
  iProduct                2 
  iSerial                 1 
  --
  Configuration Descriptor:
    bLength                 9
    bDescriptorType         2
    wTotalLength           25
    bNumInterfaces          1
    bConfigurationValue     1
    iConfiguration          0 
    bmAttributes         0xe0
      Self Powered
      Remote Wakeup
    MaxPower                0mA
    Interface Descriptor:
      bLength                 9
      bDescriptorType         4
      bInterfaceNumber        0
      bAlternateSetting       0
      bNumEndpoints           1
      bInterfaceClass         9 Hub
      bInterfaceSubClass      0 Unused
      bInterfaceProtocol      0 Full speed (or root) hub
      iInterface              0 
      Endpoint Descriptor:
        bLength                 7
        bDescriptorType         5
        bEndpointAddress     0x81  EP 1 IN
        bmAttributes            3
          Transfer Type            Interrupt
          Synch Type               None
          Usage Type               Data
        wMaxPacketSize     0x0004  1x 4 bytes
        bInterval              12

Bus 003 Device 007: ID 2109:2813 VIA Labs, Inc. VL813 Hub
Device Descriptor:
  bLength                18
  bDescriptorType         1
  bcdUSB               2.10
  bDeviceClass            9 Hub
  bDeviceSubClass         0 Unused
  bDeviceProtocol         1 Single TT
  bMaxPacketSize0        64
  idVendor           0x2109 VIA Labs, Inc.
  idProduct          0x2813 VL813 Hub
  bcdDevice           90.11
  iManufacturer           1 
  iProduct                2 
  iSerial                 0 
  --
  Configuration Descriptor:
    bLength                 9
    bDescriptorType         2
    wTotalLength           25
    bNumInterfaces          1
    bConfigurationValue     1
    iConfiguration          0 
    bmAttributes         0xe0
      Self Powered
      Remote Wakeup
    MaxPower                0mA
    Interface Descriptor:
      bLength                 9
      bDescriptorType         4
      bInterfaceNumber        0
      bAlternateSetting       0
      bNumEndpoints           1
      bInterfaceClass         9 Hub
      bInterfaceSubClass      0 Unused
      bInterfaceProtocol      0 Full speed (or root) hub
      iInterface              0 
      Endpoint Descriptor:
        bLength                 7
        bDescriptorType         5
        bEndpointAddress     0x81  EP 1 IN
        bmAttributes            3
          Transfer Type            Interrupt
          Synch Type               None
          Usage Type               Data
        wMaxPacketSize     0x0001  1x 1 bytes
        bInterval              12

Bus 003 Device 002: ID 2109:2817 VIA Labs, Inc. 
Device Descriptor:
  bLength                18
  bDescriptorType         1
  bcdUSB               2.10
  bDeviceClass            9 Hub
  bDeviceSubClass         0 Unused
  bDeviceProtocol         2 TT per port
  bMaxPacketSize0        64
  idVendor           0x2109 VIA Labs, Inc.
  idProduct          0x2817 
  bcdDevice            a.04
  iManufacturer           1 
  iProduct                2 
  iSerial                 3 
  --
  Configuration Descriptor:
    bLength                 9
    bDescriptorType         2
    wTotalLength           41
    bNumInterfaces          1
    bConfigurationValue     1
    iConfiguration          0 
    bmAttributes         0xe0
      Self Powered
      Remote Wakeup
    MaxPower                0mA
    Interface Descriptor:
      bLength                 9
      bDescriptorType         4
      bInterfaceNumber        0
      bAlternateSetting       0
      bNumEndpoints           1
      bInterfaceClass         9 Hub
      bInterfaceSubClass      0 Unused
      bInterfaceProtocol      1 Single TT
      iInterface              0 
      Endpoint Descriptor:
        bLength                 7
        bDescriptorType         5
        bEndpointAddress     0x81  EP 1 IN
        bmAttributes            3
          Transfer Type            Interrupt
          Synch Type               None
          Usage Type               Data
        wMaxPacketSize     0x0001  1x 1 bytes
        bInterval              12
    Interface Descriptor:
      bLength                 9
      bDescriptorType         4
      bInterfaceNumber        0
      bAlternateSetting       1
      bNumEndpoints           1
      bInterfaceClass         9 Hub
      bInterfaceSubClass      0 Unused
      bInterfaceProtocol      2 TT per port
      iInterface              0 
      Endpoint Descriptor:
        bLength                 7
        bDescriptorType         5
        bEndpointAddress     0x81  EP 1 IN
        bmAttributes            3
          Transfer Type            Interrupt
          Synch Type               None
          Usage Type               Data
        wMaxPacketSize     0x0001  1x 1 bytes
        bInterval              12

Bus 002 Device 003: ID 0bda:0316 Realtek Semiconductor Corp. Card Reader
Device Descriptor:
  bLength                18
  bDescriptorType         1
  bcdUSB               3.00
  bDeviceClass            0 (Defined at Interface level)
  bDeviceSubClass         0 
  bDeviceProtocol         0 
  bMaxPacketSize0         9
  idVendor           0x0bda Realtek Semiconductor Corp.
  idProduct          0x0316 Card Reader
  bcdDevice            2.04
  iManufacturer           1 
  iProduct                2 
  iSerial                 3 
  --
  Configuration Descriptor:
    bLength                 9
    bDescriptorType         2
    wTotalLength           44
    bNumInterfaces          1
    bConfigurationValue     1
    iConfiguration          4 
    bmAttributes         0xa0
      (Bus Powered)
      Remote Wakeup
    MaxPower              200mA
    Interface Descriptor:
      bLength                 9
      bDescriptorType         4
      bInterfaceNumber        0
      bAlternateSetting       0
      bNumEndpoints           2
      bInterfaceClass         8 Mass Storage
      bInterfaceSubClass      6 SCSI
      bInterfaceProtocol     80 Bulk-Only
      iInterface              5 
      Endpoint Descriptor:
        bLength                 7
        bDescriptorType         5
        bEndpointAddress     0x01  EP 1 OUT
        bmAttributes            2
          Transfer Type            Bulk
          Synch Type               None
          Usage Type               Data
        wMaxPacketSize     0x0400  1x 1024 bytes
        bInterval               0
        bMaxBurst               3
      Endpoint Descriptor:
        bLength                 7
        bDescriptorType         5
        bEndpointAddress     0x82  EP 2 IN
        bmAttributes            2
          Transfer Type            Bulk
          Synch Type               None
          Usage Type               Data
        wMaxPacketSize     0x0400  1x 1024 bytes
        bInterval               0
        bMaxBurst               3

Bus 002 Device 001: ID 1d6b:0003 Linux Foundation 3.0 root hub
Device Descriptor:
  bLength                18
  bDescriptorType         1
  bcdUSB               3.10
  bDeviceClass            9 Hub
  bDeviceSubClass         0 Unused
  bDeviceProtocol         3 
  bMaxPacketSize0         9
  idVendor           0x1d6b Linux Foundation
  idProduct          0x0003 3.0 root hub
  bcdDevice            5.15
  iManufacturer           3 
  iProduct                2 
  iSerial                 1 
  --
  Configuration Descriptor:
    bLength                 9
    bDescriptorType         2
    wTotalLength           31
    bNumInterfaces          1
    bConfigurationValue     1
    iConfiguration          0 
    bmAttributes         0xe0
      Self Powered
      Remote Wakeup
    MaxPower                0mA
    Interface Descriptor:
      bLength                 9
      bDescriptorType         4
      bInterfaceNumber        0
      bAlternateSetting       0
      bNumEndpoints           1
      bInterfaceClass         9 Hub
      bInterfaceSubClass      0 Unused
      bInterfaceProtocol      0 Full speed (or root) hub
      iInterface              0 
      Endpoint Descriptor:
        bLength                 7
        bDescriptorType         5
        bEndpointAddress     0x81  EP 1 IN
        bmAttributes            3
          Transfer Type            Interrupt
          Synch Type               None
          Usage Type               Data
        wMaxPacketSize     0x0004  1x 4 bytes
        bInterval              12
        bMaxBurst               0

Bus 003 Device 001: ID 1d6b:0002 Linux Foundation 2.0 root hub
Device Descriptor:
  bLength                18
  bDescriptorType         1
  bcdUSB               2.00
  bDeviceClass            9 Hub
  bDeviceSubClass         0 Unused
  bDeviceProtocol         1 Single TT
  bMaxPacketSize0        64
  idVendor           0x1d6b Linux Foundation
  idProduct          0x0002 2.0 root hub
  bcdDevice            5.15
  iManufacturer           3 
  iProduct                2 
  iSerial                 1 
  --
  Configuration Descriptor:
    bLength                 9
    bDescriptorType         2
    wTotalLength           25
    bNumInterfaces          1
    bConfigurationValue     1
    iConfiguration          0 
    bmAttributes         0xe0
      Self Powered
      Remote Wakeup
    MaxPower                0mA
    Interface Descriptor:
      bLength                 9
      bDescriptorType         4
      bInterfaceNumber        0
      bAlternateSetting       0
      bNumEndpoints           1
      bInterfaceClass         9 Hub
      bInterfaceSubClass      0 Unused
      bInterfaceProtocol      0 Full speed (or root) hub
      iInterface              0 
      Endpoint Descriptor:
        bLength                 7
        bDescriptorType         5
        bEndpointAddress     0x81  EP 1 IN
        bmAttributes            3
          Transfer Type            Interrupt
          Synch Type               None
          Usage Type               Data
        wMaxPacketSize     0x0004  1x 4 bytes
        bInterval              12

Bus 004 Device 004: ID 05e3:0749 Genesys Logic, Inc. SD Card Reader and Writer
Device Descriptor:
  bLength                18
  bDescriptorType         1
  bcdUSB               3.20
  bDeviceClass            0 (Defined at Interface level)
  bDeviceSubClass         0 
  bDeviceProtocol         0 
  bMaxPacketSize0         9
  idVendor           0x05e3 Genesys Logic, Inc.
  idProduct          0x0749 SD Card Reader and Writer
  bcdDevice           15.39
  iManufacturer           3 
  iProduct                4 
  iSerial                 2 
  --
  Configuration Descriptor:
    bLength                 9
    bDescriptorType         2
    wTotalLength           44
    bNumInterfaces          1
    bConfigurationValue     1
    iConfiguration          0 
    bmAttributes         0x80
      (Bus Powered)
    MaxPower              224mA
    Interface Descriptor:
      bLength                 9
      bDescriptorType         4
      bInterfaceNumber        0
      bAlternateSetting       0
      bNumEndpoints           2
      bInterfaceClass         8 Mass Storage
      bInterfaceSubClass      6 SCSI
      bInterfaceProtocol     80 Bulk-Only
      iInterface              0 
      Endpoint Descriptor:
        bLength                 7
        bDescriptorType         5
        bEndpointAddress     0x81  EP 1 IN
        bmAttributes            2
          Transfer Type            Bulk
          Synch Type               None
          Usage Type               Data
        wMaxPacketSize     0x0400  1x 1024 bytes
        bInterval               0
        bMaxBurst               4
      Endpoint Descriptor:
        bLength                 7
        bDescriptorType         5
        bEndpointAddress     0x02  EP 2 OUT
        bmAttributes            2
          Transfer Type            Bulk
          Synch Type               None
          Usage Type               Data
        wMaxPacketSize     0x0400  1x 1024 bytes
        bInterval               0
        bMaxBurst               4

Bus 004 Device 002: ID 2109:0817 VIA Labs, Inc. 
Device Descriptor:
  bLength                18
  bDescriptorType         1
  bcdUSB               3.10
  bDeviceClass            9 Hub
  bDeviceSubClass         0 Unused
  bDeviceProtocol         3 
  bMaxPacketSize0         9
  idVendor           0x2109 VIA Labs, Inc.
  idProduct          0x0817 
  bcdDevice            a.04
  iManufacturer           1 
  iProduct                2 
  iSerial                 3 
  --
  Configuration Descriptor:
    bLength                 9
    bDescriptorType         2
    wTotalLength           31
    bNumInterfaces          1
    bConfigurationValue     1
    iConfiguration          0 
    bmAttributes         0xe0
      Self Powered
      Remote Wakeup
    MaxPower                0mA
    Interface Descriptor:
      bLength                 9
      bDescriptorType         4
      bInterfaceNumber        0
      bAlternateSetting       0
      bNumEndpoints           1
      bInterfaceClass         9 Hub
      bInterfaceSubClass      0 Unused
      bInterfaceProtocol      0 Full speed (or root) hub
      iInterface              0 
      Endpoint Descriptor:
        bLength                 7
        bDescriptorType         5
        bEndpointAddress     0x81  EP 1 IN
        bmAttributes           19
          Transfer Type            Interrupt
          Synch Type               None
          Usage Type               Feedback
        wMaxPacketSize     0x0002  1x 2 bytes
        bInterval               8
        bMaxBurst               0

Bus 004 Device 001: ID 1d6b:0003 Linux Foundation 3.0 root hub
Device Descriptor:
  bLength                18
  bDescriptorType         1
  bcdUSB               3.10
  bDeviceClass            9 Hub
  bDeviceSubClass         0 Unused
  bDeviceProtocol         3 
  bMaxPacketSize0         9
  idVendor           0x1d6b Linux Foundation
  idProduct          0x0003 3.0 root hub
  bcdDevice            5.15
  iManufacturer           3 
  iProduct                2 
  iSerial                 1 
  --
  Configuration Descriptor:
    bLength                 9
    bDescriptorType         2
    wTotalLength           31
    bNumInterfaces          1
    bConfigurationValue     1
    iConfiguration          0 
    bmAttributes         0xe0
      Self Powered
      Remote Wakeup
    MaxPower                0mA
    Interface Descriptor:
      bLength                 9
      bDescriptorType         4
      bInterfaceNumber        0
      bAlternateSetting       0
      bNumEndpoints           1
      bInterfaceClass         9 Hub
      bInterfaceSubClass      0 Unused
      bInterfaceProtocol      0 Full speed (or root) hub
      iInterface              0 
      Endpoint Descriptor:
        bLength                 7
        bDescriptorType         5
        bEndpointAddress     0x81  EP 1 IN
        bmAttributes            3
          Transfer Type            Interrupt
          Synch Type               None
          Usage Type               Data
        wMaxPacketSize     0x0004  1x 4 bytes
        bInterval              12
        bMaxBurst               0
