
Bus 002 Device 002: ID 8087:8002 Intel Corp. 8 channel internal hub
Device Descriptor:
  bLength                18
  bDescriptorType         1
  bcdUSB               2.00
  bDeviceClass            9 Hub
  bDeviceSubClass         0 
  bDeviceProtocol         1 Single TT
  bMaxPacketSize0        64
  idVendor           0x8087 Intel Corp.
  idProduct          0x8002 8 channel internal hub
  bcdDevice            0.05
  iManufacturer           0 
  iProduct                0 
  iSerial                 0 
  --
  Configuration Descriptor:
    bLength                 9
    bDescriptorType         2
    wTotalLength       0x0019
    bNumInterfaces          1
    bConfigurationValue     1
    iConfiguration          0 
    bmAttributes         0xe0
      Self Powered
      Remote Wakeup
    MaxPower                0mA
    Interface Descriptor:
      bLength                 9
      bDescriptorType         4
      bInterfaceNumber        0
      bAlternateSetting       0
      bNumEndpoints           1
      bInterfaceClass         9 Hub
      bInterfaceSubClass      0 
      bInterfaceProtocol      0 Full speed (or root) hub
      iInterface              0 
      Endpoint Descriptor:
        bLength                 7
        bDescriptorType         5
        bEndpointAddress     0x81  EP 1 IN
        bmAttributes            3
          Transfer Type            Interrupt
          Synch Type               None
          Usage Type               Data
        wMaxPacketSize     0x0002  1x 2 bytes
        bInterval              12
Hub Descriptor:
  bLength              11
  bDescriptorType      41
  nNbrPorts             8
  wHubCharacteristic 0x0009
    Per-port power switching
    Per-port overcurrent protection
    TT think time 8 FS bits
  bPwrOn2PwrGood        0 * 2 milli seconds
  bHubContrCurrent      0 milli Ampere
  DeviceRemovable    0x72 0x00
  PortPwrCtrlMask    0xff 0xff
 Hub Port Status:
   Port 1: 0000.0100 power
   Port 2: 0000.0100 power
   Port 3: 0000.0100 power
   Port 4: 0000.0100 power
   Port 5: 0000.0100 power
   Port 6: 0000.0100 power
   Port 7: 0000.0100 power
   Port 8: 0000.0100 power
Device Qualifier (for other device speed):
  bLength                10
  bDescriptorType         6
  bcdUSB               2.00
  bDeviceClass            9 Hub
  bDeviceSubClass         0 
  bDeviceProtocol         0 Full speed (or root) hub
  bMaxPacketSize0        64
  bNumConfigurations      1
Device Status:     0x0001
  Self Powered

Bus 002 Device 001: ID 1d6b:0002 Linux Foundation 2.0 root hub
Device Descriptor:
  bLength                18
  bDescriptorType         1
  bcdUSB               2.00
  bDeviceClass            9 Hub
  bDeviceSubClass         0 
  bDeviceProtocol         0 Full speed (or root) hub
  bMaxPacketSize0        64
  idVendor           0x1d6b Linux Foundation
  idProduct          0x0002 2.0 root hub
  bcdDevice            6.01
  iManufacturer           3 Linux 6.1.15-200.fc37.x86_64 ehci_hcd
  iProduct                2 EHCI Host Controller
  iSerial                 1 --
  bNumConfigurations      1
  Configuration Descriptor:
    bLength                 9
    bDescriptorType         2
    wTotalLength       0x0019
    bNumInterfaces          1
    bConfigurationValue     1
    iConfiguration          0 
    bmAttributes         0xe0
      Self Powered
      Remote Wakeup
    MaxPower                0mA
    Interface Descriptor:
      bLength                 9
      bDescriptorType         4
      bInterfaceNumber        0
      bAlternateSetting       0
      bNumEndpoints           1
      bInterfaceClass         9 Hub
      bInterfaceSubClass      0 
      bInterfaceProtocol      0 Full speed (or root) hub
      iInterface              0 
      Endpoint Descriptor:
        bLength                 7
        bDescriptorType         5
        bEndpointAddress     0x81  EP 1 IN
        bmAttributes            3
          Transfer Type            Interrupt
          Synch Type               None
          Usage Type               Data
        wMaxPacketSize     0x0004  1x 4 bytes
        bInterval              12
Hub Descriptor:
  bLength               9
  bDescriptorType      41
  nNbrPorts             2
  wHubCharacteristic 0x000a
    No power switching (usb 1.0)
    Per-port overcurrent protection
  bPwrOn2PwrGood       10 * 2 milli seconds
  bHubContrCurrent      0 milli Ampere
  DeviceRemovable    0x02
  PortPwrCtrlMask    0xff
 Hub Port Status:
   Port 1: 0000.0507 highspeed power suspend enable connect
   Port 2: 0000.0100 power
Device Status:     0x0001
  Self Powered

Bus 006 Device 001: ID 1d6b:0003 Linux Foundation 3.0 root hub
Device Descriptor:
  bLength                18
  bDescriptorType         1
  bcdUSB               3.00
  bDeviceClass            9 Hub
  bDeviceSubClass         0 
  bDeviceProtocol         3 
  bMaxPacketSize0         9
  idVendor           0x1d6b Linux Foundation
  idProduct          0x0003 3.0 root hub
  bcdDevice            6.01
  iManufacturer           3 Linux 6.1.15-200.fc37.x86_64 xhci-hcd
  iProduct                2 xHCI Host Controller
  iSerial                 1 --
  bNumConfigurations      1
  Configuration Descriptor:
    bLength                 9
    bDescriptorType         2
    wTotalLength       0x001f
    bNumInterfaces          1
    bConfigurationValue     1
    iConfiguration          0 
    bmAttributes         0xe0
      Self Powered
      Remote Wakeup
    MaxPower                0mA
    Interface Descriptor:
      bLength                 9
      bDescriptorType         4
      bInterfaceNumber        0
      bAlternateSetting       0
      bNumEndpoints           1
      bInterfaceClass         9 Hub
      bInterfaceSubClass      0 
      bInterfaceProtocol      0 Full speed (or root) hub
      iInterface              0 
      Endpoint Descriptor:
        bLength                 7
        bDescriptorType         5
        bEndpointAddress     0x81  EP 1 IN
        bmAttributes            3
          Transfer Type            Interrupt
          Synch Type               None
          Usage Type               Data
        wMaxPacketSize     0x0004  1x 4 bytes
        bInterval              12
        bMaxBurst               0
Binary Object Store Descriptor:
  bLength                 5
  bDescriptorType        15
  wTotalLength       0x000f
  bNumDeviceCaps          1
  SuperSpeed USB Device Capability:
    bLength                10
    bDescriptorType        16
    bDevCapabilityType      3
    bmAttributes         0x00
    wSpeedsSupported   0x0008
      Device can operate at SuperSpeed (5Gbps)
    bFunctionalitySupport   1
      Lowest fully-functional device speed is Full Speed (12Mbps)
    bU1DevExitLat           0 micro seconds
    bU2DevExitLat           0 micro seconds
Hub Descriptor:
  bLength              12
  bDescriptorType      42
  nNbrPorts             2
  wHubCharacteristic 0x000a
    No power switching (usb 1.0)
    Per-port overcurrent protection
  bPwrOn2PwrGood       50 * 2 milli seconds
  bHubContrCurrent      0 milli Ampere
  bHubDecLat          0.0 micro seconds
  wHubDelay             0 nano seconds
  DeviceRemovable    0x00
 Hub Port Status:
   Port 1: 0000.02a0 5Gbps power Rx.Detect
   Port 2: 0000.02a0 5Gbps power Rx.Detect
Device Status:     0x0001
  Self Powered

Bus 005 Device 001: ID 1d6b:0002 Linux Foundation 2.0 root hub
Device Descriptor:
  bLength                18
  bDescriptorType         1
  bcdUSB               2.00
  bDeviceClass            9 Hub
  bDeviceSubClass         0 
  bDeviceProtocol         1 Single TT
  bMaxPacketSize0        64
  idVendor           0x1d6b Linux Foundation
  idProduct          0x0002 2.0 root hub
  bcdDevice            6.01
  iManufacturer           3 Linux 6.1.15-200.fc37.x86_64 xhci-hcd
  iProduct                2 xHCI Host Controller
  iSerial                 1 --
  bNumConfigurations      1
  Configuration Descriptor:
    bLength                 9
    bDescriptorType         2
    wTotalLength       0x0019
    bNumInterfaces          1
    bConfigurationValue     1
    iConfiguration          0 
    bmAttributes         0xe0
      Self Powered
      Remote Wakeup
    MaxPower                0mA
    Interface Descriptor:
      bLength                 9
      bDescriptorType         4
      bInterfaceNumber        0
      bAlternateSetting       0
      bNumEndpoints           1
      bInterfaceClass         9 Hub
      bInterfaceSubClass      0 
      bInterfaceProtocol      0 Full speed (or root) hub
      iInterface              0 
      Endpoint Descriptor:
        bLength                 7
        bDescriptorType         5
        bEndpointAddress     0x81  EP 1 IN
        bmAttributes            3
          Transfer Type            Interrupt
          Synch Type               None
          Usage Type               Data
        wMaxPacketSize     0x0004  1x 4 bytes
        bInterval              12
Hub Descriptor:
  bLength               9
  bDescriptorType      41
  nNbrPorts             2
  wHubCharacteristic 0x000a
    No power switching (usb 1.0)
    Per-port overcurrent protection
    TT think time 8 FS bits
  bPwrOn2PwrGood       10 * 2 milli seconds
  bHubContrCurrent      0 milli Ampere
  DeviceRemovable    0x00
  PortPwrCtrlMask    0xff
 Hub Port Status:
   Port 1: 0000.0100 power
   Port 2: 0000.0100 power
Device Status:     0x0001
  Self Powered

Bus 001 Device 002: ID 8087:800a Intel Corp. Hub
Device Descriptor:
  bLength                18
  bDescriptorType         1
  bcdUSB               2.00
  bDeviceClass            9 Hub
  bDeviceSubClass         0 
  bDeviceProtocol         1 Single TT
  bMaxPacketSize0        64
  idVendor           0x8087 Intel Corp.
  idProduct          0x800a Hub
  bcdDevice            0.05
  iManufacturer           0 
  iProduct                0 
  iSerial                 0 
  --
  Configuration Descriptor:
    bLength                 9
    bDescriptorType         2
    wTotalLength       0x0019
    bNumInterfaces          1
    bConfigurationValue     1
    iConfiguration          0 
    bmAttributes         0xe0
      Self Powered
      Remote Wakeup
    MaxPower                0mA
    Interface Descriptor:
      bLength                 9
      bDescriptorType         4
      bInterfaceNumber        0
      bAlternateSetting       0
      bNumEndpoints           1
      bInterfaceClass         9 Hub
      bInterfaceSubClass      0 
      bInterfaceProtocol      0 Full speed (or root) hub
      iInterface              0 
      Endpoint Descriptor:
        bLength                 7
        bDescriptorType         5
        bEndpointAddress     0x81  EP 1 IN
        bmAttributes            3
          Transfer Type            Interrupt
          Synch Type               None
          Usage Type               Data
        wMaxPacketSize     0x0001  1x 1 bytes
        bInterval              12
Hub Descriptor:
  bLength               9
  bDescriptorType      41
  nNbrPorts             6
  wHubCharacteristic 0x0009
    Per-port power switching
    Per-port overcurrent protection
    TT think time 8 FS bits
  bPwrOn2PwrGood        0 * 2 milli seconds
  bHubContrCurrent      0 milli Ampere
  DeviceRemovable    0x6a
  PortPwrCtrlMask    0xff
 Hub Port Status:
   Port 1: 0000.0100 power
   Port 2: 0000.0100 power
   Port 3: 0000.0100 power
   Port 4: 0000.0100 power
   Port 5: 0000.0100 power
   Port 6: 0000.0100 power
Device Qualifier (for other device speed):
  bLength                10
  bDescriptorType         6
  bcdUSB               2.00
  bDeviceClass            9 Hub
  bDeviceSubClass         0 
  bDeviceProtocol         0 Full speed (or root) hub
  bMaxPacketSize0        64
  bNumConfigurations      1
Device Status:     0x0001
  Self Powered

Bus 001 Device 001: ID 1d6b:0002 Linux Foundation 2.0 root hub
Device Descriptor:
  bLength                18
  bDescriptorType         1
  bcdUSB               2.00
  bDeviceClass            9 Hub
  bDeviceSubClass         0 
  bDeviceProtocol         0 Full speed (or root) hub
  bMaxPacketSize0        64
  idVendor           0x1d6b Linux Foundation
  idProduct          0x0002 2.0 root hub
  bcdDevice            6.01
  iManufacturer           3 Linux 6.1.15-200.fc37.x86_64 ehci_hcd
  iProduct                2 EHCI Host Controller
  iSerial                 1 --
  bNumConfigurations      1
  Configuration Descriptor:
    bLength                 9
    bDescriptorType         2
    wTotalLength       0x0019
    bNumInterfaces          1
    bConfigurationValue     1
    iConfiguration          0 
    bmAttributes         0xe0
      Self Powered
      Remote Wakeup
    MaxPower                0mA
    Interface Descriptor:
      bLength                 9
      bDescriptorType         4
      bInterfaceNumber        0
      bAlternateSetting       0
      bNumEndpoints           1
      bInterfaceClass         9 Hub
      bInterfaceSubClass      0 
      bInterfaceProtocol      0 Full speed (or root) hub
      iInterface              0 
      Endpoint Descriptor:
        bLength                 7
        bDescriptorType         5
        bEndpointAddress     0x81  EP 1 IN
        bmAttributes            3
          Transfer Type            Interrupt
          Synch Type               None
          Usage Type               Data
        wMaxPacketSize     0x0004  1x 4 bytes
        bInterval              12
Hub Descriptor:
  bLength               9
  bDescriptorType      41
  nNbrPorts             2
  wHubCharacteristic 0x000a
    No power switching (usb 1.0)
    Per-port overcurrent protection
  bPwrOn2PwrGood       10 * 2 milli seconds
  bHubContrCurrent      0 milli Ampere
  DeviceRemovable    0x02
  PortPwrCtrlMask    0xff
 Hub Port Status:
   Port 1: 0000.0507 highspeed power suspend enable connect
   Port 2: 0000.0100 power
Device Status:     0x0001
  Self Powered

Bus 004 Device 003: ID 174c:3074 ASMedia Technology Inc. ASM1074 SuperSpeed hub
Device Descriptor:
  bLength                18
  bDescriptorType         1
  bcdUSB               3.00
  bDeviceClass            9 Hub
  bDeviceSubClass         0 
  bDeviceProtocol         3 
  bMaxPacketSize0         9
  idVendor           0x174c ASMedia Technology Inc.
  idProduct          0x3074 ASM1074 SuperSpeed hub
  bcdDevice            0.01
  iManufacturer           2 ASUS TEK.
  iProduct                3 ASM107x
  iSerial                 0 
  --
  Configuration Descriptor:
    bLength                 9
    bDescriptorType         2
    wTotalLength       0x001f
    bNumInterfaces          1
    bConfigurationValue     1
    iConfiguration          0 
    bmAttributes         0xe0
      Self Powered
      Remote Wakeup
    MaxPower                8mA
    Interface Descriptor:
      bLength                 9
      bDescriptorType         4
      bInterfaceNumber        0
      bAlternateSetting       0
      bNumEndpoints           1
      bInterfaceClass         9 Hub
      bInterfaceSubClass      0 
      bInterfaceProtocol      0 Full speed (or root) hub
      iInterface              0 
      Endpoint Descriptor:
        bLength                 7
        bDescriptorType         5
        bEndpointAddress     0x81  EP 1 IN
        bmAttributes           19
          Transfer Type            Interrupt
          Synch Type               None
          Usage Type               Feedback
        wMaxPacketSize     0x0002  1x 2 bytes
        bInterval               8
        bMaxBurst               0
Binary Object Store Descriptor:
  bLength                 5
  bDescriptorType        15
  wTotalLength       0x002a
  bNumDeviceCaps          3
  USB 2.0 Extension Device Capability:
    bLength                 7
    bDescriptorType        16
    bDevCapabilityType      2
    bmAttributes   0x00000000
      (Missing must-be-set LPM bit!)
  SuperSpeed USB Device Capability:
    bLength                10
    bDescriptorType        16
    bDevCapabilityType      3
    bmAttributes         0x00
    wSpeedsSupported   0x000e
      Device can operate at Full Speed (12Mbps)
      Device can operate at High Speed (480Mbps)
      Device can operate at SuperSpeed (5Gbps)
    bFunctionalitySupport   1
      Lowest fully-functional device speed is Full Speed (12Mbps)
    bU1DevExitLat          10 micro seconds
    bU2DevExitLat        2047 micro seconds
  Container ID Device Capability:
    bLength                20
    bDescriptorType        16
    bDevCapabilityType      4
    bReserved               0
    ContainerID             {850BBDB4-2379-AA08-0C06-4BC4E21EDC06}
Hub Descriptor:
  bLength              12
  bDescriptorType      42
  nNbrPorts             4
  wHubCharacteristic 0x0009
    Per-port power switching
    Per-port overcurrent protection
  bPwrOn2PwrGood       60 * 2 milli seconds
  bHubContrCurrent    400 milli Ampere
  bHubDecLat          0.4 micro seconds
  wHubDelay          3492 nano seconds
  DeviceRemovable    0x00
 Hub Port Status:
   Port 1: 0000.02a0 5Gbps power Rx.Detect
   Port 2: 0000.02a0 5Gbps power Rx.Detect
   Port 3: 0000.02a0 5Gbps power Rx.Detect
   Port 4: 0000.02a0 5Gbps power Rx.Detect
Device Status:     0x000d
  Self Powered
  U1 Enabled
  U2 Enabled

Bus 004 Device 002: ID 174c:3074 ASMedia Technology Inc. ASM1074 SuperSpeed hub
Device Descriptor:
  bLength                18
  bDescriptorType         1
  bcdUSB               3.00
  bDeviceClass            9 Hub
  bDeviceSubClass         0 
  bDeviceProtocol         3 
  bMaxPacketSize0         9
  idVendor           0x174c ASMedia Technology Inc.
  idProduct          0x3074 ASM1074 SuperSpeed hub
  bcdDevice            0.01
  iManufacturer           2 ASUS TEK.
  iProduct                3 ASM107x
  iSerial                 0 
  --
  Configuration Descriptor:
    bLength                 9
    bDescriptorType         2
    wTotalLength       0x001f
    bNumInterfaces          1
    bConfigurationValue     1
    iConfiguration          0 
    bmAttributes         0xe0
      Self Powered
      Remote Wakeup
    MaxPower                8mA
    Interface Descriptor:
      bLength                 9
      bDescriptorType         4
      bInterfaceNumber        0
      bAlternateSetting       0
      bNumEndpoints           1
      bInterfaceClass         9 Hub
      bInterfaceSubClass      0 
      bInterfaceProtocol      0 Full speed (or root) hub
      iInterface              0 
      Endpoint Descriptor:
        bLength                 7
        bDescriptorType         5
        bEndpointAddress     0x81  EP 1 IN
        bmAttributes           19
          Transfer Type            Interrupt
          Synch Type               None
          Usage Type               Feedback
        wMaxPacketSize     0x0002  1x 2 bytes
        bInterval               8
        bMaxBurst               0
Binary Object Store Descriptor:
  bLength                 5
  bDescriptorType        15
  wTotalLength       0x002a
  bNumDeviceCaps          3
  USB 2.0 Extension Device Capability:
    bLength                 7
    bDescriptorType        16
    bDevCapabilityType      2
    bmAttributes   0x00000000
      (Missing must-be-set LPM bit!)
  SuperSpeed USB Device Capability:
    bLength                10
    bDescriptorType        16
    bDevCapabilityType      3
    bmAttributes         0x00
    wSpeedsSupported   0x000e
      Device can operate at Full Speed (12Mbps)
      Device can operate at High Speed (480Mbps)
      Device can operate at SuperSpeed (5Gbps)
    bFunctionalitySupport   1
      Lowest fully-functional device speed is Full Speed (12Mbps)
    bU1DevExitLat          10 micro seconds
    bU2DevExitLat        2047 micro seconds
  Container ID Device Capability:
    bLength                20
    bDescriptorType        16
    bDevCapabilityType      4
    bReserved               0
    ContainerID             {850BBDB4-2379-AA08-0C06-4BC4E21EDC06}
Hub Descriptor:
  bLength              12
  bDescriptorType      42
  nNbrPorts             4
  wHubCharacteristic 0x0009
    Per-port power switching
    Per-port overcurrent protection
  bPwrOn2PwrGood       60 * 2 milli seconds
  bHubContrCurrent    400 milli Ampere
  bHubDecLat          0.4 micro seconds
  wHubDelay          3492 nano seconds
  DeviceRemovable    0x00
 Hub Port Status:
   Port 1: 0000.02a0 5Gbps power Rx.Detect
   Port 2: 0000.02a0 5Gbps power Rx.Detect
   Port 3: 0000.02a0 5Gbps power Rx.Detect
   Port 4: 0000.02a0 5Gbps power Rx.Detect
Device Status:     0x000d
  Self Powered
  U1 Enabled
  U2 Enabled

Bus 004 Device 001: ID 1d6b:0003 Linux Foundation 3.0 root hub
Device Descriptor:
  bLength                18
  bDescriptorType         1
  bcdUSB               3.00
  bDeviceClass            9 Hub
  bDeviceSubClass         0 
  bDeviceProtocol         3 
  bMaxPacketSize0         9
  idVendor           0x1d6b Linux Foundation
  idProduct          0x0003 3.0 root hub
  bcdDevice            6.01
  iManufacturer           3 Linux 6.1.15-200.fc37.x86_64 xhci-hcd
  iProduct                2 xHCI Host Controller
  iSerial                 1 --
  bNumConfigurations      1
  Configuration Descriptor:
    bLength                 9
    bDescriptorType         2
    wTotalLength       0x001f
    bNumInterfaces          1
    bConfigurationValue     1
    iConfiguration          0 
    bmAttributes         0xe0
      Self Powered
      Remote Wakeup
    MaxPower                0mA
    Interface Descriptor:
      bLength                 9
      bDescriptorType         4
      bInterfaceNumber        0
      bAlternateSetting       0
      bNumEndpoints           1
      bInterfaceClass         9 Hub
      bInterfaceSubClass      0 
      bInterfaceProtocol      0 Full speed (or root) hub
      iInterface              0 
      Endpoint Descriptor:
        bLength                 7
        bDescriptorType         5
        bEndpointAddress     0x81  EP 1 IN
        bmAttributes            3
          Transfer Type            Interrupt
          Synch Type               None
          Usage Type               Data
        wMaxPacketSize     0x0004  1x 4 bytes
        bInterval              12
        bMaxBurst               0
Binary Object Store Descriptor:
  bLength                 5
  bDescriptorType        15
  wTotalLength       0x000f
  bNumDeviceCaps          1
  SuperSpeed USB Device Capability:
    bLength                10
    bDescriptorType        16
    bDevCapabilityType      3
    bmAttributes         0x02
      Latency Tolerance Messages (LTM) Supported
    wSpeedsSupported   0x0008
      Device can operate at SuperSpeed (5Gbps)
    bFunctionalitySupport   1
      Lowest fully-functional device speed is Full Speed (12Mbps)
    bU1DevExitLat          10 micro seconds
    bU2DevExitLat         512 micro seconds
Hub Descriptor:
  bLength              12
  bDescriptorType      42
  nNbrPorts             6
  wHubCharacteristic 0x000a
    No power switching (usb 1.0)
    Per-port overcurrent protection
  bPwrOn2PwrGood       50 * 2 milli seconds
  bHubContrCurrent      0 milli Ampere
  bHubDecLat          0.0 micro seconds
  wHubDelay             0 nano seconds
  DeviceRemovable    0x60
 Hub Port Status:
   Port 1: 0000.02a0 5Gbps power Rx.Detect
   Port 2: 0000.02a0 5Gbps power Rx.Detect
   Port 3: 0000.02a0 5Gbps power Rx.Detect
   Port 4: 0000.02a0 5Gbps power Rx.Detect
   Port 5: 0000.0263 5Gbps power suspend enable connect
   Port 6: 0000.0263 5Gbps power suspend enable connect
Device Status:     0x0001
  Self Powered

Bus 003 Device 002: ID 174c:2074 ASMedia Technology Inc. ASM1074 High-Speed hub
Device Descriptor:
  bLength                18
  bDescriptorType         1
  bcdUSB               2.10
  bDeviceClass            9 Hub
  bDeviceSubClass         0 
  bDeviceProtocol         2 TT per port
  bMaxPacketSize0        64
  idVendor           0x174c ASMedia Technology Inc.
  idProduct          0x2074 ASM1074 High-Speed hub
  bcdDevice            0.01
  iManufacturer           2 ASUS TEK.
  iProduct                3 ASM107x
  iSerial                 0 
  --
  Configuration Descriptor:
    bLength                 9
    bDescriptorType         2
    wTotalLength       0x0029
    bNumInterfaces          1
    bConfigurationValue     1
    iConfiguration          0 
    bmAttributes         0xe0
      Self Powered
      Remote Wakeup
    MaxPower              100mA
    Interface Descriptor:
      bLength                 9
      bDescriptorType         4
      bInterfaceNumber        0
      bAlternateSetting       0
      bNumEndpoints           1
      bInterfaceClass         9 Hub
      bInterfaceSubClass      0 
      bInterfaceProtocol      1 Single TT
      iInterface              0 
      Endpoint Descriptor:
        bLength                 7
        bDescriptorType         5
        bEndpointAddress     0x81  EP 1 IN
        bmAttributes            3
          Transfer Type            Interrupt
          Synch Type               None
          Usage Type               Data
        wMaxPacketSize     0x0001  1x 1 bytes
        bInterval              12
    Interface Descriptor:
      bLength                 9
      bDescriptorType         4
      bInterfaceNumber        0
      bAlternateSetting       1
      bNumEndpoints           1
      bInterfaceClass         9 Hub
      bInterfaceSubClass      0 
      bInterfaceProtocol      2 TT per port
      iInterface              0 
      Endpoint Descriptor:
        bLength                 7
        bDescriptorType         5
        bEndpointAddress     0x81  EP 1 IN
        bmAttributes            3
          Transfer Type            Interrupt
          Synch Type               None
          Usage Type               Data
        wMaxPacketSize     0x0001  1x 1 bytes
        bInterval              12
Binary Object Store Descriptor:
  bLength                 5
  bDescriptorType        15
  wTotalLength       0x002a
  bNumDeviceCaps          3
  USB 2.0 Extension Device Capability:
    bLength                 7
    bDescriptorType        16
    bDevCapabilityType      2
    bmAttributes   0x00000000
      (Missing must-be-set LPM bit!)
  SuperSpeed USB Device Capability:
    bLength                10
    bDescriptorType        16
    bDevCapabilityType      3
    bmAttributes         0x00
    wSpeedsSupported   0x000e
      Device can operate at Full Speed (12Mbps)
      Device can operate at High Speed (480Mbps)
      Device can operate at SuperSpeed (5Gbps)
    bFunctionalitySupport   1
      Lowest fully-functional device speed is Full Speed (12Mbps)
    bU1DevExitLat          10 micro seconds
    bU2DevExitLat        2047 micro seconds
  Container ID Device Capability:
    bLength                20
    bDescriptorType        16
    bDevCapabilityType      4
    bReserved               0
    ContainerID             {850BBDB4-2379-AA08-0C06-4BC4E21EDC06}
Hub Descriptor:
  bLength               9
  bDescriptorType      41
  nNbrPorts             4
  wHubCharacteristic 0x00a9
    Per-port power switching
    Per-port overcurrent protection
    TT think time 16 FS bits
    Port indicators
  bPwrOn2PwrGood        1 * 2 milli seconds
  bHubContrCurrent    100 milli Ampere
  DeviceRemovable    0x00
  PortPwrCtrlMask    0xff
 Hub Port Status:
   Port 1: 0000.0100 power
   Port 2: 0000.0100 power
   Port 3: 0000.0100 power
   Port 4: 0000.0100 power
Device Status:     0x0001
  Self Powered

Bus 003 Device 007: ID 8087:0029 Intel Corp. AX200 Bluetooth
Device Descriptor:
  bLength                18
  bDescriptorType         1
  bcdUSB               2.01
  bDeviceClass          224 Wireless
  bDeviceSubClass         1 Radio Frequency
  bDeviceProtocol         1 Bluetooth
  bMaxPacketSize0        64
  idVendor           0x8087 Intel Corp.
  idProduct          0x0029 AX200 Bluetooth
  bcdDevice            0.01
  iManufacturer           0 
  iProduct                0 
  iSerial                 0 
  --
  Configuration Descriptor:
    bLength                 9
    bDescriptorType         2
    wTotalLength       0x00c8
    bNumInterfaces          2
    bConfigurationValue     1
    iConfiguration          0 
    bmAttributes         0xe0
      Self Powered
      Remote Wakeup
    MaxPower              100mA
    Interface Descriptor:
      bLength                 9
      bDescriptorType         4
      bInterfaceNumber        0
      bAlternateSetting       0
      bNumEndpoints           3
      bInterfaceClass       224 Wireless
      bInterfaceSubClass      1 Radio Frequency
      bInterfaceProtocol      1 Bluetooth
      iInterface              0 
      Endpoint Descriptor:
        bLength                 7
        bDescriptorType         5
        bEndpointAddress     0x81  EP 1 IN
        bmAttributes            3
          Transfer Type            Interrupt
          Synch Type               None
          Usage Type               Data
        wMaxPacketSize     0x0040  1x 64 bytes
        bInterval               1
      Endpoint Descriptor:
        bLength                 7
        bDescriptorType         5
        bEndpointAddress     0x02  EP 2 OUT
        bmAttributes            2
          Transfer Type            Bulk
          Synch Type               None
          Usage Type               Data
        wMaxPacketSize     0x0040  1x 64 bytes
        bInterval               1
      Endpoint Descriptor:
        bLength                 7
        bDescriptorType         5
        bEndpointAddress     0x82  EP 2 IN
        bmAttributes            2
          Transfer Type            Bulk
          Synch Type               None
          Usage Type               Data
        wMaxPacketSize     0x0040  1x 64 bytes
        bInterval               1
    Interface Descriptor:
      bLength                 9
      bDescriptorType         4
      bInterfaceNumber        1
      bAlternateSetting       0
      bNumEndpoints           2
      bInterfaceClass       224 Wireless
      bInterfaceSubClass      1 Radio Frequency
      bInterfaceProtocol      1 Bluetooth
      iInterface              0 
      Endpoint Descriptor:
        bLength                 7
        bDescriptorType         5
        bEndpointAddress     0x03  EP 3 OUT
        bmAttributes            1
          Transfer Type            Isochronous
          Synch Type               None
          Usage Type               Data
        wMaxPacketSize     0x0000  1x 0 bytes
        bInterval               1
      Endpoint Descriptor:
        bLength                 7
        bDescriptorType         5
        bEndpointAddress     0x83  EP 3 IN
        bmAttributes            1
          Transfer Type            Isochronous
          Synch Type               None
          Usage Type               Data
        wMaxPacketSize     0x0000  1x 0 bytes
        bInterval               1
    Interface Descriptor:
      bLength                 9
      bDescriptorType         4
      bInterfaceNumber        1
      bAlternateSetting       1
      bNumEndpoints           2
      bInterfaceClass       224 Wireless
      bInterfaceSubClass      1 Radio Frequency
      bInterfaceProtocol      1 Bluetooth
      iInterface              0 
      Endpoint Descriptor:
        bLength                 7
        bDescriptorType         5
        bEndpointAddress     0x03  EP 3 OUT
        bmAttributes            1
          Transfer Type            Isochronous
          Synch Type               None
          Usage Type               Data
        wMaxPacketSize     0x0009  1x 9 bytes
        bInterval               1
      Endpoint Descriptor:
        bLength                 7
        bDescriptorType         5
        bEndpointAddress     0x83  EP 3 IN
        bmAttributes            1
          Transfer Type            Isochronous
          Synch Type               None
          Usage Type               Data
        wMaxPacketSize     0x0009  1x 9 bytes
        bInterval               1
    Interface Descriptor:
      bLength                 9
      bDescriptorType         4
      bInterfaceNumber        1
      bAlternateSetting       2
      bNumEndpoints           2
      bInterfaceClass       224 Wireless
      bInterfaceSubClass      1 Radio Frequency
      bInterfaceProtocol      1 Bluetooth
      iInterface              0 
      Endpoint Descriptor:
        bLength                 7
        bDescriptorType         5
        bEndpointAddress     0x03  EP 3 OUT
        bmAttributes            1
          Transfer Type            Isochronous
          Synch Type               None
          Usage Type               Data
        wMaxPacketSize     0x0011  1x 17 bytes
        bInterval               1
      Endpoint Descriptor:
        bLength                 7
        bDescriptorType         5
        bEndpointAddress     0x83  EP 3 IN
        bmAttributes            1
          Transfer Type            Isochronous
          Synch Type               None
          Usage Type               Data
        wMaxPacketSize     0x0011  1x 17 bytes
        bInterval               1
    Interface Descriptor:
      bLength                 9
      bDescriptorType         4
      bInterfaceNumber        1
      bAlternateSetting       3
      bNumEndpoints           2
      bInterfaceClass       224 Wireless
      bInterfaceSubClass      1 Radio Frequency
      bInterfaceProtocol      1 Bluetooth
      iInterface              0 
      Endpoint Descriptor:
        bLength                 7
        bDescriptorType         5
        bEndpointAddress     0x03  EP 3 OUT
        bmAttributes            1
          Transfer Type            Isochronous
          Synch Type               None
          Usage Type               Data
        wMaxPacketSize     0x0019  1x 25 bytes
        bInterval               1
      Endpoint Descriptor:
        bLength                 7
        bDescriptorType         5
        bEndpointAddress     0x83  EP 3 IN
        bmAttributes            1
          Transfer Type            Isochronous
          Synch Type               None
          Usage Type               Data
        wMaxPacketSize     0x0019  1x 25 bytes
        bInterval               1
    Interface Descriptor:
      bLength                 9
      bDescriptorType         4
      bInterfaceNumber        1
      bAlternateSetting       4
      bNumEndpoints           2
      bInterfaceClass       224 Wireless
      bInterfaceSubClass      1 Radio Frequency
      bInterfaceProtocol      1 Bluetooth
      iInterface              0 
      Endpoint Descriptor:
        bLength                 7
        bDescriptorType         5
        bEndpointAddress     0x03  EP 3 OUT
        bmAttributes            1
          Transfer Type            Isochronous
          Synch Type               None
          Usage Type               Data
        wMaxPacketSize     0x0021  1x 33 bytes
        bInterval               1
      Endpoint Descriptor:
        bLength                 7
        bDescriptorType         5
        bEndpointAddress     0x83  EP 3 IN
        bmAttributes            1
          Transfer Type            Isochronous
          Synch Type               None
          Usage Type               Data
        wMaxPacketSize     0x0021  1x 33 bytes
        bInterval               1
    Interface Descriptor:
      bLength                 9
      bDescriptorType         4
      bInterfaceNumber        1
      bAlternateSetting       5
      bNumEndpoints           2
      bInterfaceClass       224 Wireless
      bInterfaceSubClass      1 Radio Frequency
      bInterfaceProtocol      1 Bluetooth
      iInterface              0 
      Endpoint Descriptor:
        bLength                 7
        bDescriptorType         5
        bEndpointAddress     0x03  EP 3 OUT
        bmAttributes            1
          Transfer Type            Isochronous
          Synch Type               None
          Usage Type               Data
        wMaxPacketSize     0x0031  1x 49 bytes
        bInterval               1
      Endpoint Descriptor:
        bLength                 7
        bDescriptorType         5
        bEndpointAddress     0x83  EP 3 IN
        bmAttributes            1
          Transfer Type            Isochronous
          Synch Type               None
          Usage Type               Data
        wMaxPacketSize     0x0031  1x 49 bytes
        bInterval               1
    Interface Descriptor:
      bLength                 9
      bDescriptorType         4
      bInterfaceNumber        1
      bAlternateSetting       6
      bNumEndpoints           2
      bInterfaceClass       224 Wireless
      bInterfaceSubClass      1 Radio Frequency
      bInterfaceProtocol      1 Bluetooth
      iInterface              0 
      Endpoint Descriptor:
        bLength                 7
        bDescriptorType         5
        bEndpointAddress     0x03  EP 3 OUT
        bmAttributes            1
          Transfer Type            Isochronous
          Synch Type               None
          Usage Type               Data
        wMaxPacketSize     0x003f  1x 63 bytes
        bInterval               1
      Endpoint Descriptor:
        bLength                 7
        bDescriptorType         5
        bEndpointAddress     0x83  EP 3 IN
        bmAttributes            1
          Transfer Type            Isochronous
          Synch Type               None
          Usage Type               Data
        wMaxPacketSize     0x003f  1x 63 bytes
        bInterval               1
Binary Object Store Descriptor:
  bLength                 5
  bDescriptorType        15
  wTotalLength       0x000c
  bNumDeviceCaps          1
  USB 2.0 Extension Device Capability:
    bLength                 7
    bDescriptorType        16
    bDevCapabilityType      2
    bmAttributes   0x0000040e
      BESL Link Power Management (LPM) Supported
    BESL value     1024 us 
Device Status:     0x0001
  Self Powered

Bus 003 Device 006: ID 258a:0036 SINOWEALTH Wired Gaming Mouse
Device Descriptor:
  bLength                18
  bDescriptorType         1
  bcdUSB               1.10
  bDeviceClass            0 
  bDeviceSubClass         0 
  bDeviceProtocol         0 
  bMaxPacketSize0         8
  idVendor           0x258a 
  idProduct          0x0036 
  bcdDevice            1.00
  iManufacturer           1 SINOWEALTH
  iProduct                2 Wired Gaming Mouse
  iSerial                 0 
  --
  Configuration Descriptor:
    bLength                 9
    bDescriptorType         2
    wTotalLength       0x003b
    bNumInterfaces          2
    bConfigurationValue     1
    iConfiguration          0 
    bmAttributes         0xa0
      (Bus Powered)
      Remote Wakeup
    MaxPower              480mA
    Interface Descriptor:
      bLength                 9
      bDescriptorType         4
      bInterfaceNumber        0
      bAlternateSetting       0
      bNumEndpoints           1
      bInterfaceClass         3 Human Interface Device
      bInterfaceSubClass      1 Boot Interface Subclass
      bInterfaceProtocol      2 Mouse
      iInterface              0 
        HID Device Descriptor:
          bLength                 9
          bDescriptorType        33
          bcdHID               1.11
          bCountryCode            0 Not supported
          bNumDescriptors         1
          bDescriptorType        34 Report
          wDescriptorLength      71
         Report Descriptors: 
           ** UNAVAILABLE **
      Endpoint Descriptor:
        bLength                 7
        bDescriptorType         5
        bEndpointAddress     0x81  EP 1 IN
        bmAttributes            3
          Transfer Type            Interrupt
          Synch Type               None
          Usage Type               Data
        wMaxPacketSize     0x0008  1x 8 bytes
        bInterval               1
    Interface Descriptor:
      bLength                 9
      bDescriptorType         4
      bInterfaceNumber        1
      bAlternateSetting       0
      bNumEndpoints           1
      bInterfaceClass         3 Human Interface Device
      bInterfaceSubClass      1 Boot Interface Subclass
      bInterfaceProtocol      1 Keyboard
      iInterface              0 
        HID Device Descriptor:
          bLength                 9
          bDescriptorType        33
          bcdHID               1.11
          bCountryCode            0 Not supported
          bNumDescriptors         1
          bDescriptorType        34 Report
          wDescriptorLength     213
         Report Descriptors: 
           ** UNAVAILABLE **
      Endpoint Descriptor:
        bLength                 7
        bDescriptorType         5
        bEndpointAddress     0x82  EP 2 IN
        bmAttributes            3
          Transfer Type            Interrupt
          Synch Type               None
          Usage Type               Data
        wMaxPacketSize     0x0008  1x 8 bytes
        bInterval               1
Device Status:     0x0000
  (Bus Powered)

Bus 003 Device 005: ID 17ef:602d Lenovo Black Silk Keyboard
Device Descriptor:
  bLength                18
  bDescriptorType         1
  bcdUSB               2.00
  bDeviceClass            0 
  bDeviceSubClass         0 
  bDeviceProtocol         0 
  bMaxPacketSize0         8
  idVendor           0x17ef Lenovo
  idProduct          0x602d Black Silk Keyboard
  bcdDevice            1.30
  iManufacturer           1 Lenovo
  iProduct                2 Lenovo Black Silk USB Keyboard
  iSerial                 0 
  --
  Configuration Descriptor:
    bLength                 9
    bDescriptorType         2
    wTotalLength       0x003b
    bNumInterfaces          2
    bConfigurationValue     1
    iConfiguration          0 
    bmAttributes         0xa0
      (Bus Powered)
      Remote Wakeup
    MaxPower              100mA
    Interface Descriptor:
      bLength                 9
      bDescriptorType         4
      bInterfaceNumber        0
      bAlternateSetting       0
      bNumEndpoints           1
      bInterfaceClass         3 Human Interface Device
      bInterfaceSubClass      1 Boot Interface Subclass
      bInterfaceProtocol      1 Keyboard
      iInterface              0 
        HID Device Descriptor:
          bLength                 9
          bDescriptorType        33
          bcdHID               1.11
          bCountryCode            0 Not supported
          bNumDescriptors         1
          bDescriptorType        34 Report
          wDescriptorLength      65
         Report Descriptors: 
           ** UNAVAILABLE **
      Endpoint Descriptor:
        bLength                 7
        bDescriptorType         5
        bEndpointAddress     0x81  EP 1 IN
        bmAttributes            3
          Transfer Type            Interrupt
          Synch Type               None
          Usage Type               Data
        wMaxPacketSize     0x0008  1x 8 bytes
        bInterval              10
    Interface Descriptor:
      bLength                 9
      bDescriptorType         4
      bInterfaceNumber        1
      bAlternateSetting       0
      bNumEndpoints           1
      bInterfaceClass         3 Human Interface Device
      bInterfaceSubClass      0 
      bInterfaceProtocol      0 
      iInterface              0 
        HID Device Descriptor:
          bLength                 9
          bDescriptorType        33
          bcdHID               1.11
          bCountryCode            0 Not supported
          bNumDescriptors         1
          bDescriptorType        34 Report
          wDescriptorLength     165
         Report Descriptors: 
           ** UNAVAILABLE **
      Endpoint Descriptor:
        bLength                 7
        bDescriptorType         5
        bEndpointAddress     0x82  EP 2 IN
        bmAttributes            3
          Transfer Type            Interrupt
          Synch Type               None
          Usage Type               Data
        wMaxPacketSize     0x0005  1x 5 bytes
        bInterval              10
Device Status:     0x0000
  (Bus Powered)

Bus 003 Device 003: ID 174c:2074 ASMedia Technology Inc. ASM1074 High-Speed hub
Device Descriptor:
  bLength                18
  bDescriptorType         1
  bcdUSB               2.10
  bDeviceClass            9 Hub
  bDeviceSubClass         0 
  bDeviceProtocol         2 TT per port
  bMaxPacketSize0        64
  idVendor           0x174c ASMedia Technology Inc.
  idProduct          0x2074 ASM1074 High-Speed hub
  bcdDevice            0.01
  iManufacturer           2 ASUS TEK.
  iProduct                3 ASM107x
  iSerial                 0 
  --
  Configuration Descriptor:
    bLength                 9
    bDescriptorType         2
    wTotalLength       0x0029
    bNumInterfaces          1
    bConfigurationValue     1
    iConfiguration          0 
    bmAttributes         0xe0
      Self Powered
      Remote Wakeup
    MaxPower              100mA
    Interface Descriptor:
      bLength                 9
      bDescriptorType         4
      bInterfaceNumber        0
      bAlternateSetting       0
      bNumEndpoints           1
      bInterfaceClass         9 Hub
      bInterfaceSubClass      0 
      bInterfaceProtocol      1 Single TT
      iInterface              0 
      Endpoint Descriptor:
        bLength                 7
        bDescriptorType         5
        bEndpointAddress     0x81  EP 1 IN
        bmAttributes            3
          Transfer Type            Interrupt
          Synch Type               None
          Usage Type               Data
        wMaxPacketSize     0x0001  1x 1 bytes
        bInterval              12
    Interface Descriptor:
      bLength                 9
      bDescriptorType         4
      bInterfaceNumber        0
      bAlternateSetting       1
      bNumEndpoints           1
      bInterfaceClass         9 Hub
      bInterfaceSubClass      0 
      bInterfaceProtocol      2 TT per port
      iInterface              0 
      Endpoint Descriptor:
        bLength                 7
        bDescriptorType         5
        bEndpointAddress     0x81  EP 1 IN
        bmAttributes            3
          Transfer Type            Interrupt
          Synch Type               None
          Usage Type               Data
        wMaxPacketSize     0x0001  1x 1 bytes
        bInterval              12
Binary Object Store Descriptor:
  bLength                 5
  bDescriptorType        15
  wTotalLength       0x002a
  bNumDeviceCaps          3
  USB 2.0 Extension Device Capability:
    bLength                 7
    bDescriptorType        16
    bDevCapabilityType      2
    bmAttributes   0x00000000
      (Missing must-be-set LPM bit!)
  SuperSpeed USB Device Capability:
    bLength                10
    bDescriptorType        16
    bDevCapabilityType      3
    bmAttributes         0x00
    wSpeedsSupported   0x000e
      Device can operate at Full Speed (12Mbps)
      Device can operate at High Speed (480Mbps)
      Device can operate at SuperSpeed (5Gbps)
    bFunctionalitySupport   1
      Lowest fully-functional device speed is Full Speed (12Mbps)
    bU1DevExitLat          10 micro seconds
    bU2DevExitLat        2047 micro seconds
  Container ID Device Capability:
    bLength                20
    bDescriptorType        16
    bDevCapabilityType      4
    bReserved               0
    ContainerID             {850BBDB4-2379-AA08-0C06-4BC4E21EDC06}
Hub Descriptor:
  bLength               9
  bDescriptorType      41
  nNbrPorts             4
  wHubCharacteristic 0x00a9
    Per-port power switching
    Per-port overcurrent protection
    TT think time 16 FS bits
    Port indicators
  bPwrOn2PwrGood        1 * 2 milli seconds
  bHubContrCurrent    100 milli Ampere
  DeviceRemovable    0x00
  PortPwrCtrlMask    0xff
 Hub Port Status:
   Port 1: 0000.0303 lowspeed power enable connect
   Port 2: 0000.0103 power enable connect
   Port 3: 0000.0100 power
   Port 4: 0000.0100 power
Device Status:     0x0001
  Self Powered

Bus 003 Device 001: ID 1d6b:0002 Linux Foundation 2.0 root hub
Device Descriptor:
  bLength                18
  bDescriptorType         1
  bcdUSB               2.00
  bDeviceClass            9 Hub
  bDeviceSubClass         0 
  bDeviceProtocol         1 Single TT
  bMaxPacketSize0        64
  idVendor           0x1d6b Linux Foundation
  idProduct          0x0002 2.0 root hub
  bcdDevice            6.01
  iManufacturer           3 Linux 6.1.15-200.fc37.x86_64 xhci-hcd
  iProduct                2 xHCI Host Controller
  iSerial                 1 --
  bNumConfigurations      1
  Configuration Descriptor:
    bLength                 9
    bDescriptorType         2
    wTotalLength       0x0019
    bNumInterfaces          1
    bConfigurationValue     1
    iConfiguration          0 
    bmAttributes         0xe0
      Self Powered
      Remote Wakeup
    MaxPower                0mA
    Interface Descriptor:
      bLength                 9
      bDescriptorType         4
      bInterfaceNumber        0
      bAlternateSetting       0
      bNumEndpoints           1
      bInterfaceClass         9 Hub
      bInterfaceSubClass      0 
      bInterfaceProtocol      0 Full speed (or root) hub
      iInterface              0 
      Endpoint Descriptor:
        bLength                 7
        bDescriptorType         5
        bEndpointAddress     0x81  EP 1 IN
        bmAttributes            3
          Transfer Type            Interrupt
          Synch Type               None
          Usage Type               Data
        wMaxPacketSize     0x0004  1x 4 bytes
        bInterval              12
Hub Descriptor:
  bLength              11
  bDescriptorType      41
  nNbrPorts            15
  wHubCharacteristic 0x000a
    No power switching (usb 1.0)
    Per-port overcurrent protection
    TT think time 8 FS bits
  bPwrOn2PwrGood       10 * 2 milli seconds
  bHubContrCurrent      0 milli Ampere
  DeviceRemovable    0x00 0x06
  PortPwrCtrlMask    0xff 0xff
 Hub Port Status:
   Port 1: 0000.0100 power
   Port 2: 0000.0100 power
   Port 3: 0000.0100 power
   Port 4: 0000.0100 power
   Port 5: 0000.0100 power
   Port 6: 0000.0100 power
   Port 7: 0000.0100 power
   Port 8: 0000.0100 power
   Port 9: 0000.0507 highspeed power suspend enable connect
   Port 10: 0000.0503 highspeed power enable connect
   Port 11: 0000.0100 power
   Port 12: 0000.0103 power enable connect
   Port 13: 0000.0100 power
   Port 14: 0000.0100 power
   Port 15: 0000.0100 power
Device Status:     0x0001
  Self Powered
