Unknown line at line 1
Unknown line at line 2
Unknown line at line 3
Unknown line at line 4
Unknown line at line 5
Unknown line at line 6
Unknown line at line 7
Unknown line at line 9
Unknown line at line 10
Unknown line at line 11
Unknown line at line 12
Unknown line at line 14
Unknown line at line 15
Unknown line at line 16
Unknown line at line 17
Unknown line at line 18
Unknown line at line 19
Unknown line at line 20
Unknown line at line 21

Bus 002 Device 001: ID 1d6b:0003 Linux Foundation 3.0 root hub
Device Descriptor:
  bLength                18
  bDescriptorType         1
  bcdUSB               3.00
  bDeviceClass            9 
  bDeviceSubClass         0 
  bDeviceProtocol         3 
  bMaxPacketSize0         9
  idVendor           0x1d6b Linux Foundation
  idProduct          0x0003 3.0 root hub
  bcdDevice            5.00
  iManufacturer           3 
  iProduct                2 
  iSerial                 1 
  --
  Configuration Descriptor:
    bLength                 9
    bDescriptorType         2
    wTotalLength           31
    bNumInterfaces          1
    bConfigurationValue     1
    iConfiguration          0 
    bmAttributes         0xe0
      Self Powered
      Remote Wakeup
    MaxPower                0mA
    Interface Descriptor:
      bLength                 9
      bDescriptorType         4
      bInterfaceNumber        0
      bAlternateSetting       0
      bNumEndpoints           1
      bInterfaceClass         9 
      bInterfaceSubClass      0 
      bInterfaceProtocol      0 
      iInterface              0 
      Endpoint Descriptor:
        bLength                 7
        bDescriptorType         5
        bEndpointAddress     0x81  EP 1 IN
        bmAttributes            3
          Transfer Type            Interrupt
          Synch Type               None
          Usage Type               Data
        wMaxPacketSize     0x0004  1x 4 bytes
        bInterval              12
        bMaxBurst               0

Bus 001 Device 008: ID 04ca:005a  
Device Descriptor:
  bLength                18
  bDescriptorType         1
  bcdUSB               2.00
  bDeviceClass            0 
  bDeviceSubClass         0 
  bDeviceProtocol         0 
  bMaxPacketSize0         8
  idVendor           0x04ca 
  idProduct          0x005a 
  bcdDevice            2.00
  iManufacturer           1 
  iProduct                2 
  iSerial                 0 
  --
  Configuration Descriptor:
    bLength                 9
    bDescriptorType         2
    wTotalLength           59
    bNumInterfaces          2
    bConfigurationValue     1
    iConfiguration          0 
    bmAttributes         0xa0
      (Bus Powered)
      Remote Wakeup
    MaxPower              100mA
    Interface Descriptor:
      bLength                 9
      bDescriptorType         4
      bInterfaceNumber        0
      bAlternateSetting       0
      bNumEndpoints           1
      bInterfaceClass         3 
      bInterfaceSubClass      1 
      bInterfaceProtocol      1 
      iInterface              0 
        HID Device Descriptor:
          bLength                 9
          bDescriptorType        33
          bcdHID               1.11
          bCountryCode            0 Unknown
          bNumDescriptors         1
          bDescriptorType        34 (null)
          wDescriptorLength      65
         Report Descriptors: 
           ** UNAVAILABLE **
      Endpoint Descriptor:
        bLength                 7
        bDescriptorType         5
        bEndpointAddress     0x81  EP 1 IN
        bmAttributes            3
          Transfer Type            Interrupt
          Synch Type               None
          Usage Type               Data
        wMaxPacketSize     0x0008  1x 8 bytes
        bInterval              10
    Interface Descriptor:
      bLength                 9
      bDescriptorType         4
      bInterfaceNumber        1
      bAlternateSetting       0
      bNumEndpoints           1
      bInterfaceClass         3 
      bInterfaceSubClass      0 
      bInterfaceProtocol      0 
      iInterface              0 
        HID Device Descriptor:
          bLength                 9
          bDescriptorType        33
          bcdHID               1.11
          bCountryCode            0 Unknown
          bNumDescriptors         1
          bDescriptorType        34 (null)
          wDescriptorLength      52
         Report Descriptors: 
           ** UNAVAILABLE **
      Endpoint Descriptor:
        bLength                 7
        bDescriptorType         5
        bEndpointAddress     0x82  EP 2 IN
        bmAttributes            3
          Transfer Type            Interrupt
          Synch Type               None
          Usage Type               Data
        wMaxPacketSize     0x0003  1x 3 bytes
        bInterval              10

Bus 001 Device 006: ID 0d8c:013c C-Media Electronics, Inc. CM108 Audio Controller
Device Descriptor:
  bLength                18
  bDescriptorType         1
  bcdUSB               1.10
  bDeviceClass            0 
  bDeviceSubClass         0 
  bDeviceProtocol         0 
  bMaxPacketSize0         8
  idVendor           0x0d8c C-Media Electronics, Inc.
  idProduct          0x013c CM108 Audio Controller
  bcdDevice            1.00
  iManufacturer           1 
  iProduct                2 
  iSerial                 0 
  --
  Configuration Descriptor:
    bLength                 9
    bDescriptorType         2
    wTotalLength          224
    bNumInterfaces          4
    bConfigurationValue     1
    iConfiguration          0 
    bmAttributes         0x80
      (Bus Powered)
    MaxPower              100mA
    Interface Descriptor:
      bLength                 9
      bDescriptorType         4
      bInterfaceNumber        0
      bAlternateSetting       0
      bNumEndpoints           0
      bInterfaceClass         1 
      bInterfaceSubClass      1 
      bInterfaceProtocol      0 
      iInterface              0 
      AudioControl Interface Descriptor:
        bLength                10
        bDescriptorType        36
        bDescriptorSubtype      1 (HEADER)
        bcdADC               1.00
        wTotalLength           71
        bInCollection           2
        baInterfaceNr( 0)       1
        baInterfaceNr( 1)       2
      AudioControl Interface Descriptor:
        bLength                12
        bDescriptorType        36
        bDescriptorSubtype      2 (INPUT_TERMINAL)
        bTerminalID             1
        wTerminalType      0x0101 
        bAssocTerminal          0
        bNrChannels             2
        wChannelConfig     0x0003
          Left Front (L)
          Right Front (R)
        iChannelNames           0 
        iTerminal               0 
      AudioControl Interface Descriptor:
        bLength                12
        bDescriptorType        36
        bDescriptorSubtype      2 (INPUT_TERMINAL)
        bTerminalID             2
        wTerminalType      0x0201 
        bAssocTerminal          0
        bNrChannels             1
        wChannelConfig     0x0001
          Left Front (L)
        iChannelNames           0 
        iTerminal               0 
      AudioControl Interface Descriptor:
        bLength                 9
        bDescriptorType        36
        bDescriptorSubtype      3 (OUTPUT_TERMINAL)
        bTerminalID             6
        wTerminalType      0x0301 
        bAssocTerminal          0
        bSourceID               9
        iTerminal               0 
      AudioControl Interface Descriptor:
        bLength                 9
        bDescriptorType        36
        bDescriptorSubtype      3 (OUTPUT_TERMINAL)
        bTerminalID             7
        wTerminalType      0x0101 
        bAssocTerminal          0
        bSourceID              10
        iTerminal               0 
      AudioControl Interface Descriptor:
        bLength                10
        bDescriptorType        36
        bDescriptorSubtype      6 (FEATURE_UNIT)
        bUnitID                 9
        bSourceID               1
        bControlSize            1
        bmaControls( 0)      0x01
          Mute Control
        bmaControls( 1)      0x02
          Volume Control
        bmaControls( 2)      0x02
          Volume Control
        iFeature                0 
      AudioControl Interface Descriptor:
        bLength                 9
        bDescriptorType        36
        bDescriptorSubtype      6 (FEATURE_UNIT)
        bUnitID                10
        bSourceID               2
        bControlSize            1
        bmaControls( 0)      0x43
          Mute Control
          Volume Control
          Automatic Gain Control
        bmaControls( 1)      0x00
        iFeature                0 
    Interface Descriptor:
      bLength                 9
      bDescriptorType         4
      bInterfaceNumber        1
      bAlternateSetting       0
      bNumEndpoints           0
      bInterfaceClass         1 
      bInterfaceSubClass      2 
      bInterfaceProtocol      0 
      iInterface              0 
    Interface Descriptor:
      bLength                 9
      bDescriptorType         4
      bInterfaceNumber        1
      bAlternateSetting       1
      bNumEndpoints           1
      bInterfaceClass         1 
      bInterfaceSubClass      2 
      bInterfaceProtocol      0 
      iInterface              0 
      AudioStreaming Interface Descriptor:
        bLength                 7
        bDescriptorType        36
        bDescriptorSubtype      1 (AS_GENERAL)
        bTerminalLink           1
        bDelay                  1 frames
        wFormatTag              1 PCM
      AudioStreaming Interface Descriptor:
        bLength                14
        bDescriptorType        36
        bDescriptorSubtype      2 (FORMAT_TYPE)
        bFormatType             1 (FORMAT_TYPE_I)
        bNrChannels             2
        bSubframeSize           2
        bBitResolution         16
        bSamFreqType            2 Discrete
        tSamFreq[ 0]        48000
        tSamFreq[ 1]        44100
      Endpoint Descriptor:
        bLength                 9
        bDescriptorType         5
        bEndpointAddress     0x01  EP 1 OUT
        bmAttributes            9
          Transfer Type            Isochronous
          Synch Type               Adaptive
          Usage Type               Data
        wMaxPacketSize     0x00c8  1x 200 bytes
        bInterval               1
        bRefresh                0
        bSynchAddress           0
        AudioControl Endpoint Descriptor:
          bLength                 7
          bDescriptorType        37
          bDescriptorSubtype      1 (EP_GENERAL)
          bmAttributes         0x01
            Sampling Frequency
          bLockDelayUnits         1 Milliseconds
          wLockDelay              1 Milliseconds
    Interface Descriptor:
      bLength                 9
      bDescriptorType         4
      bInterfaceNumber        2
      bAlternateSetting       0
      bNumEndpoints           0
      bInterfaceClass         1 
      bInterfaceSubClass      2 
      bInterfaceProtocol      0 
      iInterface              0 
    Interface Descriptor:
      bLength                 9
      bDescriptorType         4
      bInterfaceNumber        2
      bAlternateSetting       1
      bNumEndpoints           1
      bInterfaceClass         1 
      bInterfaceSubClass      2 
      bInterfaceProtocol      0 
      iInterface              0 
      AudioStreaming Interface Descriptor:
        bLength                 7
        bDescriptorType        36
        bDescriptorSubtype      1 (AS_GENERAL)
        bTerminalLink           7
        bDelay                  1 frames
        wFormatTag              1 PCM
      AudioStreaming Interface Descriptor:
        bLength                14
        bDescriptorType        36
        bDescriptorSubtype      2 (FORMAT_TYPE)
        bFormatType             1 (FORMAT_TYPE_I)
        bNrChannels             1
        bSubframeSize           2
        bBitResolution         16
        bSamFreqType            2 Discrete
        tSamFreq[ 0]        48000
        tSamFreq[ 1]        44100
      Endpoint Descriptor:
        bLength                 9
        bDescriptorType         5
        bEndpointAddress     0x82  EP 2 IN
        bmAttributes            9
          Transfer Type            Isochronous
          Synch Type               Adaptive
          Usage Type               Data
        wMaxPacketSize     0x0064  1x 100 bytes
        bInterval               1
        bRefresh                0
        bSynchAddress           0
        AudioControl Endpoint Descriptor:
          bLength                 7
          bDescriptorType        37
          bDescriptorSubtype      1 (EP_GENERAL)
          bmAttributes         0x01
            Sampling Frequency
          bLockDelayUnits         0 Undefined
          wLockDelay              0 Undefined
    Interface Descriptor:
      bLength                 9
      bDescriptorType         4
      bInterfaceNumber        3
      bAlternateSetting       0
      bNumEndpoints           1
      bInterfaceClass         3 
      bInterfaceSubClass      0 
      bInterfaceProtocol      0 
      iInterface              0 
        HID Device Descriptor:
          bLength                 9
          bDescriptorType        33
          bcdHID               1.00
          bCountryCode            0 Unknown
          bNumDescriptors         1
          bDescriptorType        34 (null)
          wDescriptorLength      60
         Report Descriptors: 
           ** UNAVAILABLE **
      Endpoint Descriptor:
        bLength                 7
        bDescriptorType         5
        bEndpointAddress     0x87  EP 7 IN
        bmAttributes            3
          Transfer Type            Interrupt
          Synch Type               None
          Usage Type               Data
        wMaxPacketSize     0x0004  1x 4 bytes
        bInterval               2

Bus 001 Device 004: ID 0424:2512 Microchip Technology, Inc. (formerly SMSC) USB 2.0 Hub
Device Descriptor:
  bLength                18
  bDescriptorType         1
  bcdUSB               2.00
  bDeviceClass            9 
  bDeviceSubClass         0 
  bDeviceProtocol         2 
  bMaxPacketSize0        64
  idVendor           0x0424 Microchip Technology, Inc. (formerly SMSC)
  idProduct          0x2512 USB 2.0 Hub
  bcdDevice            b.b3
  iManufacturer           0 
  iProduct                0 
  iSerial                 0 
  --
  Configuration Descriptor:
    bLength                 9
    bDescriptorType         2
    wTotalLength           41
    bNumInterfaces          1
    bConfigurationValue     1
    iConfiguration          0 
    bmAttributes         0xe0
      Self Powered
      Remote Wakeup
    MaxPower                2mA
    Interface Descriptor:
      bLength                 9
      bDescriptorType         4
      bInterfaceNumber        0
      bAlternateSetting       0
      bNumEndpoints           1
      bInterfaceClass         9 
      bInterfaceSubClass      0 
      bInterfaceProtocol      1 
      iInterface              0 
      Endpoint Descriptor:
        bLength                 7
        bDescriptorType         5
        bEndpointAddress     0x81  EP 1 IN
        bmAttributes            3
          Transfer Type            Interrupt
          Synch Type               None
          Usage Type               Data
        wMaxPacketSize     0x0001  1x 1 bytes
        bInterval              12
    Interface Descriptor:
      bLength                 9
      bDescriptorType         4
      bInterfaceNumber        0
      bAlternateSetting       1
      bNumEndpoints           1
      bInterfaceClass         9 
      bInterfaceSubClass      0 
      bInterfaceProtocol      2 
      iInterface              0 
      Endpoint Descriptor:
        bLength                 7
        bDescriptorType         5
        bEndpointAddress     0x81  EP 1 IN
        bmAttributes            3
          Transfer Type            Interrupt
          Synch Type               None
          Usage Type               Data
        wMaxPacketSize     0x0001  1x 1 bytes
        bInterval              12

Bus 001 Device 007: ID 8087:07dc  
Device Descriptor:
  bLength                18
  bDescriptorType         1
  bcdUSB               2.00
  bDeviceClass          224 
  bDeviceSubClass         1 
  bDeviceProtocol         1 
  bMaxPacketSize0        64
  idVendor           0x8087 
  idProduct          0x07dc 
  bcdDevice            0.01
  iManufacturer           0 
  iProduct                0 
  iSerial                 0 
  --
  Configuration Descriptor:
    bLength                 9
    bDescriptorType         2
    wTotalLength          177
    bNumInterfaces          2
    bConfigurationValue     1
    iConfiguration          0 
    bmAttributes         0xe0
      Self Powered
      Remote Wakeup
    MaxPower              100mA
    Interface Descriptor:
      bLength                 9
      bDescriptorType         4
      bInterfaceNumber        0
      bAlternateSetting       0
      bNumEndpoints           3
      bInterfaceClass       224 
      bInterfaceSubClass      1 
      bInterfaceProtocol      1 
      iInterface              0 
      Endpoint Descriptor:
        bLength                 7
        bDescriptorType         5
        bEndpointAddress     0x81  EP 1 IN
        bmAttributes            3
          Transfer Type            Interrupt
          Synch Type               None
          Usage Type               Data
        wMaxPacketSize     0x0040  1x 64 bytes
        bInterval               1
      Endpoint Descriptor:
        bLength                 7
        bDescriptorType         5
        bEndpointAddress     0x02  EP 2 OUT
        bmAttributes            2
          Transfer Type            Bulk
          Synch Type               None
          Usage Type               Data
        wMaxPacketSize     0x0040  1x 64 bytes
        bInterval               1
      Endpoint Descriptor:
        bLength                 7
        bDescriptorType         5
        bEndpointAddress     0x82  EP 2 IN
        bmAttributes            2
          Transfer Type            Bulk
          Synch Type               None
          Usage Type               Data
        wMaxPacketSize     0x0040  1x 64 bytes
        bInterval               1
    Interface Descriptor:
      bLength                 9
      bDescriptorType         4
      bInterfaceNumber        1
      bAlternateSetting       0
      bNumEndpoints           2
      bInterfaceClass       224 
      bInterfaceSubClass      1 
      bInterfaceProtocol      1 
      iInterface              0 
      Endpoint Descriptor:
        bLength                 7
        bDescriptorType         5
        bEndpointAddress     0x03  EP 3 OUT
        bmAttributes            1
          Transfer Type            Isochronous
          Synch Type               None
          Usage Type               Data
        wMaxPacketSize     0x0000  1x 0 bytes
        bInterval               1
      Endpoint Descriptor:
        bLength                 7
        bDescriptorType         5
        bEndpointAddress     0x83  EP 3 IN
        bmAttributes            1
          Transfer Type            Isochronous
          Synch Type               None
          Usage Type               Data
        wMaxPacketSize     0x0000  1x 0 bytes
        bInterval               1
    Interface Descriptor:
      bLength                 9
      bDescriptorType         4
      bInterfaceNumber        1
      bAlternateSetting       1
      bNumEndpoints           2
      bInterfaceClass       224 
      bInterfaceSubClass      1 
      bInterfaceProtocol      1 
      iInterface              0 
      Endpoint Descriptor:
        bLength                 7
        bDescriptorType         5
        bEndpointAddress     0x03  EP 3 OUT
        bmAttributes            1
          Transfer Type            Isochronous
          Synch Type               None
          Usage Type               Data
        wMaxPacketSize     0x0009  1x 9 bytes
        bInterval               1
      Endpoint Descriptor:
        bLength                 7
        bDescriptorType         5
        bEndpointAddress     0x83  EP 3 IN
        bmAttributes            1
          Transfer Type            Isochronous
          Synch Type               None
          Usage Type               Data
        wMaxPacketSize     0x0009  1x 9 bytes
        bInterval               1
    Interface Descriptor:
      bLength                 9
      bDescriptorType         4
      bInterfaceNumber        1
      bAlternateSetting       2
      bNumEndpoints           2
      bInterfaceClass       224 
      bInterfaceSubClass      1 
      bInterfaceProtocol      1 
      iInterface              0 
      Endpoint Descriptor:
        bLength                 7
        bDescriptorType         5
        bEndpointAddress     0x03  EP 3 OUT
        bmAttributes            1
          Transfer Type            Isochronous
          Synch Type               None
          Usage Type               Data
        wMaxPacketSize     0x0011  1x 17 bytes
        bInterval               1
      Endpoint Descriptor:
        bLength                 7
        bDescriptorType         5
        bEndpointAddress     0x83  EP 3 IN
        bmAttributes            1
          Transfer Type            Isochronous
          Synch Type               None
          Usage Type               Data
        wMaxPacketSize     0x0011  1x 17 bytes
        bInterval               1
    Interface Descriptor:
      bLength                 9
      bDescriptorType         4
      bInterfaceNumber        1
      bAlternateSetting       3
      bNumEndpoints           2
      bInterfaceClass       224 
      bInterfaceSubClass      1 
      bInterfaceProtocol      1 
      iInterface              0 
      Endpoint Descriptor:
        bLength                 7
        bDescriptorType         5
        bEndpointAddress     0x03  EP 3 OUT
        bmAttributes            1
          Transfer Type            Isochronous
          Synch Type               None
          Usage Type               Data
        wMaxPacketSize     0x0019  1x 25 bytes
        bInterval               1
      Endpoint Descriptor:
        bLength                 7
        bDescriptorType         5
        bEndpointAddress     0x83  EP 3 IN
        bmAttributes            1
          Transfer Type            Isochronous
          Synch Type               None
          Usage Type               Data
        wMaxPacketSize     0x0019  1x 25 bytes
        bInterval               1
    Interface Descriptor:
      bLength                 9
      bDescriptorType         4
      bInterfaceNumber        1
      bAlternateSetting       4
      bNumEndpoints           2
      bInterfaceClass       224 
      bInterfaceSubClass      1 
      bInterfaceProtocol      1 
      iInterface              0 
      Endpoint Descriptor:
        bLength                 7
        bDescriptorType         5
        bEndpointAddress     0x03  EP 3 OUT
        bmAttributes            1
          Transfer Type            Isochronous
          Synch Type               None
          Usage Type               Data
        wMaxPacketSize     0x0021  1x 33 bytes
        bInterval               1
      Endpoint Descriptor:
        bLength                 7
        bDescriptorType         5
        bEndpointAddress     0x83  EP 3 IN
        bmAttributes            1
          Transfer Type            Isochronous
          Synch Type               None
          Usage Type               Data
        wMaxPacketSize     0x0021  1x 33 bytes
        bInterval               1
    Interface Descriptor:
      bLength                 9
      bDescriptorType         4
      bInterfaceNumber        1
      bAlternateSetting       5
      bNumEndpoints           2
      bInterfaceClass       224 
      bInterfaceSubClass      1 
      bInterfaceProtocol      1 
      iInterface              0 
      Endpoint Descriptor:
        bLength                 7
        bDescriptorType         5
        bEndpointAddress     0x03  EP 3 OUT
        bmAttributes            1
          Transfer Type            Isochronous
          Synch Type               None
          Usage Type               Data
        wMaxPacketSize     0x0031  1x 49 bytes
        bInterval               1
      Endpoint Descriptor:
        bLength                 7
        bDescriptorType         5
        bEndpointAddress     0x83  EP 3 IN
        bmAttributes            1
          Transfer Type            Isochronous
          Synch Type               None
          Usage Type               Data
        wMaxPacketSize     0x0031  1x 49 bytes
        bInterval               1

Bus 001 Device 005: ID 0bda:5780  
Device Descriptor:
  bLength                18
  bDescriptorType         1
  bcdUSB               2.00
  bDeviceClass          239 
  bDeviceSubClass         2 
  bDeviceProtocol         1 
  bMaxPacketSize0        64
  idVendor           0x0bda 
  idProduct          0x5780 
  bcdDevice            0.10
  iManufacturer           3 
  iProduct                1 
  iSerial                 2 
  --
  Configuration Descriptor:
    bLength                 9
    bDescriptorType         2
    wTotalLength         1435
    bNumInterfaces          2
    bConfigurationValue     1
    iConfiguration          4 
    bmAttributes         0x80
      (Bus Powered)
    MaxPower              500mA
    Interface Association:
      bLength                 8
      bDescriptorType        11
      bFirstInterface         0
      bInterfaceCount         2
      bFunctionClass         14 
      bFunctionSubClass       3 
      bFunctionProtocol       0 
      iFunction               5 
    Interface Descriptor:
      bLength                 9
      bDescriptorType         4
      bInterfaceNumber        0
      bAlternateSetting       0
      bNumEndpoints           1
      bInterfaceClass        14 
      bInterfaceSubClass      1 
      bInterfaceProtocol      0 
      iInterface              5 
      VideoControl Interface Descriptor:
        bLength                13
        bDescriptorType        36
        bDescriptorSubtype      1 (HEADER)
        bcdUVC               1.00
        wTotalLength           78
        dwClockFrequency       15.000000MHz
        bInCollection           1
        baInterfaceNr( 0)       1
      VideoControl Interface Descriptor:
        bLength                18
        bDescriptorType        36
        bDescriptorSubtype      2 (INPUT_TERMINAL)
        bTerminalID             1
        wTerminalType      0x0201 
        bAssocTerminal          0
        iTerminal               0 
        wObjectiveFocalLengthMin      0
        wObjectiveFocalLengthMax      0
        wOcularFocalLength            0
        bControlSize                  3
        bmControls           0x00000004
          Auto-Exposure Priority
      VideoControl Interface Descriptor:
        bLength                11
        bDescriptorType        36
        bDescriptorSubtype      5 (PROCESSING_UNIT)
      Warning: Descriptor too short
        bUnitID                 2
        bSourceID               1
        wMaxMultiplier          0
        bControlSize            2
        bmControls     0x0000157f
          Brightness
          Contrast
          Hue
          Saturation
          Sharpness
          Gamma
          White Balance Temperature
          Backlight Compensation
          Power Line Frequency
          White Balance Temperature, Auto
        iProcessing             0 
        bmVideoStandards     0x 9
          None
          SECAM - 625/50
      VideoControl Interface Descriptor:
        bLength                 9
        bDescriptorType        36
        bDescriptorSubtype      3 (OUTPUT_TERMINAL)
        bTerminalID             3
        wTerminalType      0x0101 
        bAssocTerminal          0
        bSourceID               4
        iTerminal               0 
      VideoControl Interface Descriptor:
        bLength                27
        bDescriptorType        36
        bDescriptorSubtype      6 (EXTENSION_UNIT)
        bUnitID                 4
        guidExtensionCode         {8ca72912-b447-9440-b0ce-db07386fb938}
        bNumControl             2
        bNrPins                 1
        baSourceID( 0)          2
        bControlSize            2
        bmControls( 0)       0x00
        bmControls( 1)       0x06
        iExtension              0 
      Endpoint Descriptor:
        bLength                 7
        bDescriptorType         5
        bEndpointAddress     0x83  EP 3 IN
        bmAttributes            3
          Transfer Type            Interrupt
          Synch Type               None
          Usage Type               Data
        wMaxPacketSize     0x0010  1x 16 bytes
        bInterval               6
    Interface Descriptor:
      bLength                 9
      bDescriptorType         4
      bInterfaceNumber        1
      bAlternateSetting       0
      bNumEndpoints           0
      bInterfaceClass        14 
      bInterfaceSubClass      2 
      bInterfaceProtocol      0 
      iInterface              0 
      VideoStreaming Interface Descriptor:
        bLength                            16
        bDescriptorType                    36
        bDescriptorSubtype                  1 (INPUT_HEADER)
        bNumFormats                         3
        wTotalLength                     1198
        bEndPointAddress                  129
        bmInfo                              0
        bTerminalLink                       3
        bStillCaptureMethod                 2
        bTriggerSupport                     1
        bTriggerUsage                       0
        bControlSize                        1
        bmaControls( 0)                    27
        bmaControls( 1)                    27
        bmaControls( 2)                    27
      VideoStreaming Interface Descriptor:
        bLength                            27
        bDescriptorType                    36
        bDescriptorSubtype                  4 (FORMAT_UNCOMPRESSED)
        bFormatIndex                        1
        bNumFrameDescriptors               10
        guidFormat                            {59555932-0000-1000-8000-00aa00389b71}
        bBitsPerPixel                      16
        bDefaultFrameIndex                  1
        bAspectRatioX                       0
        bAspectRatioY                       0
        bmInterlaceFlags                 0x00
          Interlaced stream or variable: No
          Fields per frame: 2 fields
          Field 1 first: No
          Field pattern: Field 1 only
          bCopyProtect                      0
      VideoStreaming Interface Descriptor:
        bLength                            34
        bDescriptorType                    36
        bDescriptorSubtype                  5 (FRAME_UNCOMPRESSED)
        bFrameIndex                         1
        bmCapabilities                   0x00
          Still image unsupported
        wWidth                            640
        wHeight                           480
        dwMinBitRate                 73728000
        dwMaxBitRate                147456000
        dwMaxVideoFrameBufferSize      614400
        dwDefaultFrameInterval         333333
        bFrameIntervalType                  2
        dwFrameInterval( 0)            333333
        dwFrameInterval( 1)            666666
      VideoStreaming Interface Descriptor:
        bLength                            34
        bDescriptorType                    36
        bDescriptorSubtype                  5 (FRAME_UNCOMPRESSED)
        bFrameIndex                         2
        bmCapabilities                   0x00
          Still image unsupported
        wWidth                            160
        wHeight                           120
        dwMinBitRate                  4608000
        dwMaxBitRate                  9216000
        dwMaxVideoFrameBufferSize       38400
        dwDefaultFrameInterval         333333
        bFrameIntervalType                  2
        dwFrameInterval( 0)            333333
        dwFrameInterval( 1)            666666
      VideoStreaming Interface Descriptor:
        bLength                            34
        bDescriptorType                    36
        bDescriptorSubtype                  5 (FRAME_UNCOMPRESSED)
        bFrameIndex                         3
        bmCapabilities                   0x00
          Still image unsupported
        wWidth                            320
        wHeight                           180
        dwMinBitRate                 13824000
        dwMaxBitRate                 27648000
        dwMaxVideoFrameBufferSize      115200
        dwDefaultFrameInterval         333333
        bFrameIntervalType                  2
        dwFrameInterval( 0)            333333
        dwFrameInterval( 1)            666666
      VideoStreaming Interface Descriptor:
        bLength                            34
        bDescriptorType                    36
        bDescriptorSubtype                  5 (FRAME_UNCOMPRESSED)
        bFrameIndex                         4
        bmCapabilities                   0x00
          Still image unsupported
        wWidth                            320
        wHeight                           240
        dwMinBitRate                 18432000
        dwMaxBitRate                 36864000
        dwMaxVideoFrameBufferSize      153600
        dwDefaultFrameInterval         333333
        bFrameIntervalType                  2
        dwFrameInterval( 0)            333333
        dwFrameInterval( 1)            666666
      VideoStreaming Interface Descriptor:
        bLength                            34
        bDescriptorType                    36
        bDescriptorSubtype                  5 (FRAME_UNCOMPRESSED)
        bFrameIndex                         5
        bmCapabilities                   0x00
          Still image unsupported
        wWidth                            352
        wHeight                           288
        dwMinBitRate                 24330240
        dwMaxBitRate                 48660480
        dwMaxVideoFrameBufferSize      202752
        dwDefaultFrameInterval         333333
        bFrameIntervalType                  2
        dwFrameInterval( 0)            333333
        dwFrameInterval( 1)            666666
      VideoStreaming Interface Descriptor:
        bLength                            34
        bDescriptorType                    36
        bDescriptorSubtype                  5 (FRAME_UNCOMPRESSED)
        bFrameIndex                         6
        bmCapabilities                   0x00
          Still image unsupported
        wWidth                            424
        wHeight                           240
        dwMinBitRate                 24422400
        dwMaxBitRate                 48844800
        dwMaxVideoFrameBufferSize      203520
        dwDefaultFrameInterval         333333
        bFrameIntervalType                  2
        dwFrameInterval( 0)            333333
        dwFrameInterval( 1)            666666
      VideoStreaming Interface Descriptor:
        bLength                            34
        bDescriptorType                    36
        bDescriptorSubtype                  5 (FRAME_UNCOMPRESSED)
        bFrameIndex                         7
        bmCapabilities                   0x00
          Still image unsupported
        wWidth                            640
        wHeight                           360
        dwMinBitRate                 55296000
        dwMaxBitRate                110592000
        dwMaxVideoFrameBufferSize      460800
        dwDefaultFrameInterval         333333
        bFrameIntervalType                  2
        dwFrameInterval( 0)            333333
        dwFrameInterval( 1)            666666
      VideoStreaming Interface Descriptor:
        bLength                            38
        bDescriptorType                    36
        bDescriptorSubtype                  5 (FRAME_UNCOMPRESSED)
        bFrameIndex                         8
        bmCapabilities                   0x00
          Still image unsupported
        wWidth                            848
        wHeight                           480
        dwMinBitRate                 65126400
        dwMaxBitRate                130252800
        dwMaxVideoFrameBufferSize      814080
        dwDefaultFrameInterval         500000
        bFrameIntervalType                  3
        dwFrameInterval( 0)            500000
        dwFrameInterval( 1)            666666
        dwFrameInterval( 2)           1000000
      VideoStreaming Interface Descriptor:
        bLength                            38
        bDescriptorType                    36
        bDescriptorSubtype                  5 (FRAME_UNCOMPRESSED)
        bFrameIndex                         9
        bmCapabilities                   0x00
          Still image unsupported
        wWidth                            960
        wHeight                           540
        dwMinBitRate                 82944000
        dwMaxBitRate                165888000
        dwMaxVideoFrameBufferSize     1036800
        dwDefaultFrameInterval         500000
        bFrameIntervalType                  3
        dwFrameInterval( 0)            500000
        dwFrameInterval( 1)            666666
        dwFrameInterval( 2)           1000000
      VideoStreaming Interface Descriptor:
        bLength                            30
        bDescriptorType                    36
        bDescriptorSubtype                  5 (FRAME_UNCOMPRESSED)
        bFrameIndex                        10
        bmCapabilities                   0x00
          Still image unsupported
        wWidth                           1280
        wHeight                           720
        dwMinBitRate                147456000
        dwMaxBitRate                147456000
        dwMaxVideoFrameBufferSize     1843200
        dwDefaultFrameInterval        1000000
        bFrameIntervalType                  1
        dwFrameInterval( 0)           1000000
      VideoStreaming Interface Descriptor:
        bLength                            10
        bDescriptorType                    36
        bDescriptorSubtype                  3 (STILL_IMAGE_FRAME)
        bEndpointAddress                    0
        bNumImageSizePatterns               1
        wWidth( 0)                        640
        wHeight( 0)                       480
        bNumCompressionPatterns             1
      VideoStreaming Interface Descriptor:
        bLength                             6
        bDescriptorType                    36
        bDescriptorSubtype                 13 (COLORFORMAT)
        bColorPrimaries                     1 (BT.709,sRGB)
        bTransferCharacteristics            1 (BT.709)
        bMatrixCoefficients                 4 (SMPTE 170M (BT.601))
      VideoStreaming Interface Descriptor:
        bLength                            11
        bDescriptorType                    36
        bDescriptorSubtype                  6 (FORMAT_MJPEG)
        bFormatIndex                        2
        bNumFrameDescriptors               10
        bFlags                              1
          Fixed-size samples: Yes
        bDefaultFrameIndex                  1
        bAspectRatioX                       0
        bAspectRatioY                       0
        bmInterlaceFlags                 0x00
          Interlaced stream or variable: No
          Fields per frame: 1 fields
          Field 1 first: No
          Field pattern: Field 1 only
          bCopyProtect                      0
      VideoStreaming Interface Descriptor:
        bLength                            34
        bDescriptorType                    36
        bDescriptorSubtype                  7 (FRAME_MJPEG)
        bFrameIndex                         1
        bmCapabilities                   0x00
          Still image unsupported
        wWidth                            640
        wHeight                           480
        dwMinBitRate                 73728000
        dwMaxBitRate                147456000
        dwMaxVideoFrameBufferSize      614400
        dwDefaultFrameInterval         333333
        bFrameIntervalType                  2
        dwFrameInterval( 0)            333333
        dwFrameInterval( 1)            666666
      VideoStreaming Interface Descriptor:
        bLength                            34
        bDescriptorType                    36
        bDescriptorSubtype                  7 (FRAME_MJPEG)
        bFrameIndex                         2
        bmCapabilities                   0x00
          Still image unsupported
        wWidth                            160
        wHeight                           120
        dwMinBitRate                  4608000
        dwMaxBitRate                  9216000
        dwMaxVideoFrameBufferSize       38400
        dwDefaultFrameInterval         333333
        bFrameIntervalType                  2
        dwFrameInterval( 0)            333333
        dwFrameInterval( 1)            666666
      VideoStreaming Interface Descriptor:
        bLength                            34
        bDescriptorType                    36
        bDescriptorSubtype                  7 (FRAME_MJPEG)
        bFrameIndex                         3
        bmCapabilities                   0x00
          Still image unsupported
        wWidth                            320
        wHeight                           180
        dwMinBitRate                 13824000
        dwMaxBitRate                 27648000
        dwMaxVideoFrameBufferSize      115200
        dwDefaultFrameInterval         333333
        bFrameIntervalType                  2
        dwFrameInterval( 0)            333333
        dwFrameInterval( 1)            666666
      VideoStreaming Interface Descriptor:
        bLength                            34
        bDescriptorType                    36
        bDescriptorSubtype                  7 (FRAME_MJPEG)
        bFrameIndex                         4
        bmCapabilities                   0x00
          Still image unsupported
        wWidth                            320
        wHeight                           240
        dwMinBitRate                 18432000
        dwMaxBitRate                 36864000
        dwMaxVideoFrameBufferSize      153600
        dwDefaultFrameInterval         333333
        bFrameIntervalType                  2
        dwFrameInterval( 0)            333333
        dwFrameInterval( 1)            666666
      VideoStreaming Interface Descriptor:
        bLength                            34
        bDescriptorType                    36
        bDescriptorSubtype                  7 (FRAME_MJPEG)
        bFrameIndex                         5
        bmCapabilities                   0x00
          Still image unsupported
        wWidth                            352
        wHeight                           288
        dwMinBitRate                 24330240
        dwMaxBitRate                 48660480
        dwMaxVideoFrameBufferSize      202752
        dwDefaultFrameInterval         333333
        bFrameIntervalType                  2
        dwFrameInterval( 0)            333333
        dwFrameInterval( 1)            666666
      VideoStreaming Interface Descriptor:
        bLength                            34
        bDescriptorType                    36
        bDescriptorSubtype                  7 (FRAME_MJPEG)
        bFrameIndex                         6
        bmCapabilities                   0x00
          Still image unsupported
        wWidth                            424
        wHeight                           240
        dwMinBitRate                 24422400
        dwMaxBitRate                 48844800
        dwMaxVideoFrameBufferSize      203520
        dwDefaultFrameInterval         333333
        bFrameIntervalType                  2
        dwFrameInterval( 0)            333333
        dwFrameInterval( 1)            666666
      VideoStreaming Interface Descriptor:
        bLength                            34
        bDescriptorType                    36
        bDescriptorSubtype                  7 (FRAME_MJPEG)
        bFrameIndex                         7
        bmCapabilities                   0x00
          Still image unsupported
        wWidth                            640
        wHeight                           360
        dwMinBitRate                 55296000
        dwMaxBitRate                110592000
        dwMaxVideoFrameBufferSize      460800
        dwDefaultFrameInterval         333333
        bFrameIntervalType                  2
        dwFrameInterval( 0)            333333
        dwFrameInterval( 1)            666666
      VideoStreaming Interface Descriptor:
        bLength                            34
        bDescriptorType                    36
        bDescriptorSubtype                  7 (FRAME_MJPEG)
        bFrameIndex                         8
        bmCapabilities                   0x00
          Still image unsupported
        wWidth                            848
        wHeight                           480
        dwMinBitRate                 97689600
        dwMaxBitRate                195379200
        dwMaxVideoFrameBufferSize      814080
        dwDefaultFrameInterval         333333
        bFrameIntervalType                  2
        dwFrameInterval( 0)            333333
        dwFrameInterval( 1)            666666
      VideoStreaming Interface Descriptor:
        bLength                            34
        bDescriptorType                    36
        bDescriptorSubtype                  7 (FRAME_MJPEG)
        bFrameIndex                         9
        bmCapabilities                   0x00
          Still image unsupported
        wWidth                            960
        wHeight                           540
        dwMinBitRate                124416000
        dwMaxBitRate                248832000
        dwMaxVideoFrameBufferSize     1036800
        dwDefaultFrameInterval         333333
        bFrameIntervalType                  2
        dwFrameInterval( 0)            333333
        dwFrameInterval( 1)            666666
      VideoStreaming Interface Descriptor:
        bLength                            34
        bDescriptorType                    36
        bDescriptorSubtype                  7 (FRAME_MJPEG)
        bFrameIndex                        10
        bmCapabilities                   0x00
          Still image unsupported
        wWidth                           1280
        wHeight                           720
        dwMinBitRate                221184000
        dwMaxBitRate                442368000
        dwMaxVideoFrameBufferSize     1843200
        dwDefaultFrameInterval         333333
        bFrameIntervalType                  2
        dwFrameInterval( 0)            333333
        dwFrameInterval( 1)            666666
      VideoStreaming Interface Descriptor:
        bLength                            10
        bDescriptorType                    36
        bDescriptorSubtype                  3 (STILL_IMAGE_FRAME)
        bEndpointAddress                    0
        bNumImageSizePatterns               1
        wWidth( 0)                        640
        wHeight( 0)                       480
        bNumCompressionPatterns             1
      VideoStreaming Interface Descriptor:
        bLength                             6
        bDescriptorType                    36
        bDescriptorSubtype                 13 (COLORFORMAT)
        bColorPrimaries                     1 (BT.709,sRGB)
        bTransferCharacteristics            1 (BT.709)
        bMatrixCoefficients                 4 (SMPTE 170M (BT.601))
      VideoStreaming Interface Descriptor:
        bLength                            56
        bDescriptorType                    36
        bDescriptorSubtype                 14         Invalid desc subtype: 03 0a 4d 34 32 30 00 00 10 00 80 00 00 aa 00 38 9b 71 32 56 55 59 00 00 10 00 80 00 00 aa 00 38 9b 71 33 56 55 59 00 00 10 00 80 00 00 aa 00 38 9b 71 00 01 00
      VideoStreaming Interface Descriptor:
        bLength                            34
        bDescriptorType                    36
        bDescriptorSubtype                 15         Invalid desc subtype: 01 00 80 02 e0 01 00 00 65 04 00 00 ca 08 00 60 09 00 15 16 05 00 02 15 16 05 00 2a 2c 0a 00
      VideoStreaming Interface Descriptor:
        bLength                            34
        bDescriptorType                    36
        bDescriptorSubtype                 15         Invalid desc subtype: 02 00 a0 00 78 00 00 50 46 00 00 a0 8c 00 00 96 00 00 15 16 05 00 02 15 16 05 00 2a 2c 0a 00
      VideoStreaming Interface Descriptor:
        bLength                            34
        bDescriptorType                    36
        bDescriptorSubtype                 15         Invalid desc subtype: 03 00 40 01 b4 00 00 f0 d2 00 00 e0 a5 01 00 c2 01 00 15 16 05 00 02 15 16 05 00 2a 2c 0a 00
      VideoStreaming Interface Descriptor:
        bLength                            34
        bDescriptorType                    36
        bDescriptorSubtype                 15         Invalid desc subtype: 04 00 40 01 f0 00 00 40 19 01 00 80 32 02 00 58 02 00 15 16 05 00 02 15 16 05 00 2a 2c 0a 00
      VideoStreaming Interface Descriptor:
        bLength                            34
        bDescriptorType                    36
        bDescriptorSubtype                 15         Invalid desc subtype: 05 00 60 01 20 01 00 40 73 01 00 80 e6 02 00 18 03 00 15 16 05 00 02 15 16 05 00 2a 2c 0a 00
      VideoStreaming Interface Descriptor:
        bLength                            34
        bDescriptorType                    36
        bDescriptorSubtype                 15         Invalid desc subtype: 06 00 a8 01 f0 00 00 a8 74 01 00 50 e9 02 00 1b 03 00 15 16 05 00 02 15 16 05 00 2a 2c 0a 00
      VideoStreaming Interface Descriptor:
        bLength                            34
        bDescriptorType                    36
        bDescriptorSubtype                 15         Invalid desc subtype: 07 00 80 02 68 01 00 c0 4b 03 00 80 97 06 00 08 07 00 15 16 05 00 02 15 16 05 00 2a 2c 0a 00
      VideoStreaming Interface Descriptor:
        bLength                            38
        bDescriptorType                    36
        bDescriptorSubtype                 15         Invalid desc subtype: 08 00 50 03 e0 01 00 c0 e1 03 00 80 c3 07 00 6c 0c 00 20 a1 07 00 03 20 a1 07 00 2a 2c 0a 00 40 42 0f 00
      VideoStreaming Interface Descriptor:
        bLength                            46
        bDescriptorType                    36
        bDescriptorSubtype                 15         Invalid desc subtype: 09 00 c0 03 1c 02 00 d0 78 02 00 10 5c 0c 00 d2 0f 00 80 1a 06 00 05 80 1a 06 00 20 a1 07 00 2a 2c 0a 00 40 42 0f 00 80 84 1e 00
      VideoStreaming Interface Descriptor:
        bLength                            34
        bDescriptorType                    36
        bDescriptorSubtype                 15         Invalid desc subtype: 0a 00 00 05 d0 02 00 00 65 04 00 00 ca 08 00 20 1c 00 40 42 0f 00 02 40 42 0f 00 80 84 1e 00
      VideoStreaming Interface Descriptor:
        bLength                            10
        bDescriptorType                    36
        bDescriptorSubtype                  3 (STILL_IMAGE_FRAME)
        bEndpointAddress                    0
        bNumImageSizePatterns               1
        wWidth( 0)                        640
        wHeight( 0)                       480
        bNumCompressionPatterns             1
      VideoStreaming Interface Descriptor:
        bLength                             6
        bDescriptorType                    36
        bDescriptorSubtype                 13 (COLORFORMAT)
        bColorPrimaries                     1 (BT.709,sRGB)
        bTransferCharacteristics            1 (BT.709)
        bMatrixCoefficients                 4 (SMPTE 170M (BT.601))
    Interface Descriptor:
      bLength                 9
      bDescriptorType         4
      bInterfaceNumber        1
      bAlternateSetting       1
      bNumEndpoints           1
      bInterfaceClass        14 
      bInterfaceSubClass      2 
      bInterfaceProtocol      0 
      iInterface              0 
      Endpoint Descriptor:
        bLength                 7
        bDescriptorType         5
        bEndpointAddress     0x81  EP 1 IN
        bmAttributes            5
          Transfer Type            Isochronous
          Synch Type               Asynchronous
          Usage Type               Data
        wMaxPacketSize     0x0080  1x 128 bytes
        bInterval               1
    Interface Descriptor:
      bLength                 9
      bDescriptorType         4
      bInterfaceNumber        1
      bAlternateSetting       2
      bNumEndpoints           1
      bInterfaceClass        14 
      bInterfaceSubClass      2 
      bInterfaceProtocol      0 
      iInterface              0 
      Endpoint Descriptor:
        bLength                 7
        bDescriptorType         5
        bEndpointAddress     0x81  EP 1 IN
        bmAttributes            5
          Transfer Type            Isochronous
          Synch Type               Asynchronous
          Usage Type               Data
        wMaxPacketSize     0x0200  1x 512 bytes
        bInterval               1
    Interface Descriptor:
      bLength                 9
      bDescriptorType         4
      bInterfaceNumber        1
      bAlternateSetting       3
      bNumEndpoints           1
      bInterfaceClass        14 
      bInterfaceSubClass      2 
      bInterfaceProtocol      0 
      iInterface              0 
      Endpoint Descriptor:
        bLength                 7
        bDescriptorType         5
        bEndpointAddress     0x81  EP 1 IN
        bmAttributes            5
          Transfer Type            Isochronous
          Synch Type               Asynchronous
          Usage Type               Data
        wMaxPacketSize     0x0400  1x 1024 bytes
        bInterval               1
    Interface Descriptor:
      bLength                 9
      bDescriptorType         4
      bInterfaceNumber        1
      bAlternateSetting       4
      bNumEndpoints           1
      bInterfaceClass        14 
      bInterfaceSubClass      2 
      bInterfaceProtocol      0 
      iInterface              0 
      Endpoint Descriptor:
        bLength                 7
        bDescriptorType         5
        bEndpointAddress     0x81  EP 1 IN
        bmAttributes            5
          Transfer Type            Isochronous
          Synch Type               Asynchronous
          Usage Type               Data
        wMaxPacketSize     0x0b00  2x 768 bytes
        bInterval               1
    Interface Descriptor:
      bLength                 9
      bDescriptorType         4
      bInterfaceNumber        1
      bAlternateSetting       5
      bNumEndpoints           1
      bInterfaceClass        14 
      bInterfaceSubClass      2 
      bInterfaceProtocol      0 
      iInterface              0 
      Endpoint Descriptor:
        bLength                 7
        bDescriptorType         5
        bEndpointAddress     0x81  EP 1 IN
        bmAttributes            5
          Transfer Type            Isochronous
          Synch Type               Asynchronous
          Usage Type               Data
        wMaxPacketSize     0x0c00  2x 1024 bytes
        bInterval               1
    Interface Descriptor:
      bLength                 9
      bDescriptorType         4
      bInterfaceNumber        1
      bAlternateSetting       6
      bNumEndpoints           1
      bInterfaceClass        14 
      bInterfaceSubClass      2 
      bInterfaceProtocol      0 
      iInterface              0 
      Endpoint Descriptor:
        bLength                 7
        bDescriptorType         5
        bEndpointAddress     0x81  EP 1 IN
        bmAttributes            5
          Transfer Type            Isochronous
          Synch Type               Asynchronous
          Usage Type               Data
        wMaxPacketSize     0x1380  3x 896 bytes
        bInterval               1
    Interface Descriptor:
      bLength                 9
      bDescriptorType         4
      bInterfaceNumber        1
      bAlternateSetting       7
      bNumEndpoints           1
      bInterfaceClass        14 
      bInterfaceSubClass      2 
      bInterfaceProtocol      0 
      iInterface              0 
      Endpoint Descriptor:
        bLength                 7
        bDescriptorType         5
        bEndpointAddress     0x81  EP 1 IN
        bmAttributes            5
          Transfer Type            Isochronous
          Synch Type               Asynchronous
          Usage Type               Data
        wMaxPacketSize     0x1400  3x 1024 bytes
        bInterval               1

Bus 001 Device 003: ID 0424:2512 Microchip Technology, Inc. (formerly SMSC) USB 2.0 Hub
Device Descriptor:
  bLength                18
  bDescriptorType         1
  bcdUSB               2.00
  bDeviceClass            9 
  bDeviceSubClass         0 
  bDeviceProtocol         2 
  bMaxPacketSize0        64
  idVendor           0x0424 Microchip Technology, Inc. (formerly SMSC)
  idProduct          0x2512 USB 2.0 Hub
  bcdDevice            b.b3
  iManufacturer           0 
  iProduct                0 
  iSerial                 0 
  --
  Configuration Descriptor:
    bLength                 9
    bDescriptorType         2
    wTotalLength           41
    bNumInterfaces          1
    bConfigurationValue     1
    iConfiguration          0 
    bmAttributes         0xe0
      Self Powered
      Remote Wakeup
    MaxPower                2mA
    Interface Descriptor:
      bLength                 9
      bDescriptorType         4
      bInterfaceNumber        0
      bAlternateSetting       0
      bNumEndpoints           1
      bInterfaceClass         9 
      bInterfaceSubClass      0 
      bInterfaceProtocol      1 
      iInterface              0 
      Endpoint Descriptor:
        bLength                 7
        bDescriptorType         5
        bEndpointAddress     0x81  EP 1 IN
        bmAttributes            3
          Transfer Type            Interrupt
          Synch Type               None
          Usage Type               Data
        wMaxPacketSize     0x0001  1x 1 bytes
        bInterval              12
    Interface Descriptor:
      bLength                 9
      bDescriptorType         4
      bInterfaceNumber        0
      bAlternateSetting       1
      bNumEndpoints           1
      bInterfaceClass         9 
      bInterfaceSubClass      0 
      bInterfaceProtocol      2 
      iInterface              0 
      Endpoint Descriptor:
        bLength                 7
        bDescriptorType         5
        bEndpointAddress     0x81  EP 1 IN
        bmAttributes            3
          Transfer Type            Interrupt
          Synch Type               None
          Usage Type               Data
        wMaxPacketSize     0x0001  1x 1 bytes
        bInterval              12

Bus 001 Device 002: ID 093a:2510 Pixart Imaging, Inc. Optical Mouse
Device Descriptor:
  bLength                18
  bDescriptorType         1
  bcdUSB               2.00
  bDeviceClass            0 
  bDeviceSubClass         0 
  bDeviceProtocol         0 
  bMaxPacketSize0         8
  idVendor           0x093a Pixart Imaging, Inc.
  idProduct          0x2510 Optical Mouse
  bcdDevice            1.00
  iManufacturer           1 
  iProduct                2 
  iSerial                 0 
  --
  Configuration Descriptor:
    bLength                 9
    bDescriptorType         2
    wTotalLength           34
    bNumInterfaces          1
    bConfigurationValue     1
    iConfiguration          0 
    bmAttributes         0xa0
      (Bus Powered)
      Remote Wakeup
    MaxPower              100mA
    Interface Descriptor:
      bLength                 9
      bDescriptorType         4
      bInterfaceNumber        0
      bAlternateSetting       0
      bNumEndpoints           1
      bInterfaceClass         3 
      bInterfaceSubClass      1 
      bInterfaceProtocol      2 
      iInterface              0 
        HID Device Descriptor:
          bLength                 9
          bDescriptorType        33
          bcdHID               1.11
          bCountryCode            0 Unknown
          bNumDescriptors         1
          bDescriptorType        34 (null)
          wDescriptorLength      46
         Report Descriptors: 
           ** UNAVAILABLE **
      Endpoint Descriptor:
        bLength                 7
        bDescriptorType         5
        bEndpointAddress     0x81  EP 1 IN
        bmAttributes            3
          Transfer Type            Interrupt
          Synch Type               None
          Usage Type               Data
        wMaxPacketSize     0x0004  1x 4 bytes
        bInterval              10

Bus 001 Device 001: ID 1d6b:0002 Linux Foundation 2.0 root hub
Device Descriptor:
  bLength                18
  bDescriptorType         1
  bcdUSB               2.00
  bDeviceClass            9 
  bDeviceSubClass         0 
  bDeviceProtocol         1 
  bMaxPacketSize0        64
  idVendor           0x1d6b Linux Foundation
  idProduct          0x0002 2.0 root hub
  bcdDevice            5.00
  iManufacturer           3 
  iProduct                2 
  iSerial                 1 
  --
  Configuration Descriptor:
    bLength                 9
    bDescriptorType         2
    wTotalLength           25
    bNumInterfaces          1
    bConfigurationValue     1
    iConfiguration          0 
    bmAttributes         0xe0
      Self Powered
      Remote Wakeup
    MaxPower                0mA
    Interface Descriptor:
      bLength                 9
      bDescriptorType         4
      bInterfaceNumber        0
      bAlternateSetting       0
      bNumEndpoints           1
      bInterfaceClass         9 
      bInterfaceSubClass      0 
      bInterfaceProtocol      0 
      iInterface              0 
      Endpoint Descriptor:
        bLength                 7
        bDescriptorType         5
        bEndpointAddress     0x81  EP 1 IN
        bmAttributes            3
          Transfer Type            Interrupt
          Synch Type               None
          Usage Type               Data
        wMaxPacketSize     0x0004  1x 4 bytes
        bInterval              12
