
Bus 002 Device 005: ID 0bda:0411 Realtek Semiconductor Corp. Hub
Device Descriptor:
  bLength                18
  bDescriptorType         1
  bcdUSB               3.00
  bDeviceClass            9 Hub
  bDeviceSubClass         0 
  bDeviceProtocol         3 
  bMaxPacketSize0         9
  idVendor           0x0bda Realtek Semiconductor Corp.
  idProduct          0x0411 Hub
  bcdDevice            1.04
  iManufacturer           1 Generic
  iProduct                2 4-Port USB 3.0 Hub
  iSerial                 0 
  --
  Configuration Descriptor:
    bLength                 9
    bDescriptorType         2
    wTotalLength       0x001f
    bNumInterfaces          1
    bConfigurationValue     1
    iConfiguration          4 USB3.0 Hub
    bmAttributes         0xe0
      Self Powered
      Remote Wakeup
    MaxPower                0mA
    Interface Descriptor:
      bLength                 9
      bDescriptorType         4
      bInterfaceNumber        0
      bAlternateSetting       0
      bNumEndpoints           1
      bInterfaceClass         9 Hub
      bInterfaceSubClass      0 
      bInterfaceProtocol      0 Full speed (or root) hub
      iInterface              5 Interrupt In Interface
      Endpoint Descriptor:
        bLength                 7
        bDescriptorType         5
        bEndpointAddress     0x81  EP 1 IN
        bmAttributes           19
          Transfer Type            Interrupt
          Synch Type               None
          Usage Type               Feedback
        wMaxPacketSize     0x0002  1x 2 bytes
        bInterval               8
        bMaxBurst               0
Hub Descriptor:
  bLength              12
  bDescriptorType      42
  nNbrPorts             4
  wHubCharacteristic 0x0009
    Per-port power switching
    Per-port overcurrent protection
  bPwrOn2PwrGood       50 * 2 milli seconds
  bHubContrCurrent      8 milli Ampere
  bHubDecLat          0.2 micro seconds
  wHubDelay          3202 nano seconds
  DeviceRemovable    0x00
 Hub Port Status:
   Port 1: 0000.02a0 5Gbps power Rx.Detect
   Port 2: 0000.02a0 5Gbps power Rx.Detect
   Port 3: 0000.02a0 5Gbps power Rx.Detect
   Port 4: 0000.02a0 5Gbps power Rx.Detect
Binary Object Store Descriptor:
  bLength                 5
  bDescriptorType        15
  wTotalLength       0x002a
  bNumDeviceCaps          3
  USB 2.0 Extension Device Capability:
    bLength                 7
    bDescriptorType        16
    bDevCapabilityType      2
    bmAttributes   0x0000f41e
      BESL Link Power Management (LPM) Supported
    BESL value     1024 us 
    Deep BESL value    61440 us 
  SuperSpeed USB Device Capability:
    bLength                10
    bDescriptorType        16
    bDevCapabilityType      3
    bmAttributes         0x00
    wSpeedsSupported   0x000e
      Device can operate at Full Speed (12Mbps)
      Device can operate at High Speed (480Mbps)
      Device can operate at SuperSpeed (5Gbps)
    bFunctionalitySupport   1
      Lowest fully-functional device speed is Full Speed (12Mbps)
    bU1DevExitLat          10 micro seconds
    bU2DevExitLat        1023 micro seconds
  Container ID Device Capability:
    bLength                20
    bDescriptorType        16
    bDevCapabilityType      4
    bReserved               0
    ContainerID             {FE85D647-F322-A61D-C14F-583B9AA2234E}
Device Status:     0x0005
  Self Powered
  U1 Enabled

Bus 002 Device 004: ID 05e3:0749 Genesys Logic, Inc. SD Card Reader and Writer
Device Descriptor:
  bLength                18
  bDescriptorType         1
  bcdUSB               3.10
  bDeviceClass            0 
  bDeviceSubClass         0 
  bDeviceProtocol         0 
  bMaxPacketSize0         9
  idVendor           0x05e3 Genesys Logic, Inc.
  idProduct          0x0749 SD Card Reader and Writer
  bcdDevice           15.35
  iManufacturer           3 Generic
  iProduct                4 USB3.0 Card Reader
  iSerial                 5 --
  bNumConfigurations      1
  Configuration Descriptor:
    bLength                 9
    bDescriptorType         2
    wTotalLength       0x002c
    bNumInterfaces          1
    bConfigurationValue     1
    iConfiguration          0 
    bmAttributes         0x80
      (Bus Powered)
    MaxPower              896mA
    Interface Descriptor:
      bLength                 9
      bDescriptorType         4
      bInterfaceNumber        0
      bAlternateSetting       0
      bNumEndpoints           2
      bInterfaceClass         8 Mass Storage
      bInterfaceSubClass      6 SCSI
      bInterfaceProtocol     80 Bulk-Only
      iInterface              0 
      Endpoint Descriptor:
        bLength                 7
        bDescriptorType         5
        bEndpointAddress     0x81  EP 1 IN
        bmAttributes            2
          Transfer Type            Bulk
          Synch Type               None
          Usage Type               Data
        wMaxPacketSize     0x0400  1x 1024 bytes
        bInterval               0
        bMaxBurst               4
      Endpoint Descriptor:
        bLength                 7
        bDescriptorType         5
        bEndpointAddress     0x02  EP 2 OUT
        bmAttributes            2
          Transfer Type            Bulk
          Synch Type               None
          Usage Type               Data
        wMaxPacketSize     0x0400  1x 1024 bytes
        bInterval               0
        bMaxBurst               4
Binary Object Store Descriptor:
  bLength                 5
  bDescriptorType        15
  wTotalLength       0x0016
  bNumDeviceCaps          2
  USB 2.0 Extension Device Capability:
    bLength                 7
    bDescriptorType        16
    bDevCapabilityType      2
    bmAttributes   0x00000f0e
      BESL Link Power Management (LPM) Supported
    BESL value     3840 us 
  SuperSpeed USB Device Capability:
    bLength                10
    bDescriptorType        16
    bDevCapabilityType      3
    bmAttributes         0x00
    wSpeedsSupported   0x000e
      Device can operate at Full Speed (12Mbps)
      Device can operate at High Speed (480Mbps)
      Device can operate at SuperSpeed (5Gbps)
    bFunctionalitySupport   1
      Lowest fully-functional device speed is Full Speed (12Mbps)
    bU1DevExitLat          10 micro seconds
    bU2DevExitLat        2047 micro seconds
Device Status:     0x000c
  (Bus Powered)
  U1 Enabled
  U2 Enabled

Bus 002 Device 003: ID 0bda:8153 Realtek Semiconductor Corp. RTL8153 Gigabit Ethernet Adapter
Device Descriptor:
  bLength                18
  bDescriptorType         1
  bcdUSB               3.00
  bDeviceClass            0 
  bDeviceSubClass         0 
  bDeviceProtocol         0 
  bMaxPacketSize0         9
  idVendor           0x0bda Realtek Semiconductor Corp.
  idProduct          0x8153 RTL8153 Gigabit Ethernet Adapter
  bcdDevice           31.00
  iManufacturer           1 Realtek
  iProduct                2 USB 10/100/1000 LAN
  iSerial                 6 --
  bNumConfigurations      2
  Configuration Descriptor:
    bLength                 9
    bDescriptorType         2
    wTotalLength       0x0039
    bNumInterfaces          1
    bConfigurationValue     1
    iConfiguration          0 
    bmAttributes         0xa0
      (Bus Powered)
      Remote Wakeup
    MaxPower              288mA
    Interface Descriptor:
      bLength                 9
      bDescriptorType         4
      bInterfaceNumber        0
      bAlternateSetting       0
      bNumEndpoints           3
      bInterfaceClass       255 Vendor Specific Class
      bInterfaceSubClass    255 Vendor Specific Subclass
      bInterfaceProtocol      0 
      iInterface              0 
      Endpoint Descriptor:
        bLength                 7
        bDescriptorType         5
        bEndpointAddress     0x81  EP 1 IN
        bmAttributes            2
          Transfer Type            Bulk
          Synch Type               None
          Usage Type               Data
        wMaxPacketSize     0x0400  1x 1024 bytes
        bInterval               0
        bMaxBurst               3
      Endpoint Descriptor:
        bLength                 7
        bDescriptorType         5
        bEndpointAddress     0x02  EP 2 OUT
        bmAttributes            2
          Transfer Type            Bulk
          Synch Type               None
          Usage Type               Data
        wMaxPacketSize     0x0400  1x 1024 bytes
        bInterval               0
        bMaxBurst               3
      Endpoint Descriptor:
        bLength                 7
        bDescriptorType         5
        bEndpointAddress     0x83  EP 3 IN
        bmAttributes            3
          Transfer Type            Interrupt
          Synch Type               None
          Usage Type               Data
        wMaxPacketSize     0x0002  1x 2 bytes
        bInterval               8
        bMaxBurst               0
  Configuration Descriptor:
    bLength                 9
    bDescriptorType         2
    wTotalLength       0x0062
    bNumInterfaces          2
    bConfigurationValue     2
    iConfiguration          0 
    bmAttributes         0xa0
      (Bus Powered)
      Remote Wakeup
    MaxPower              288mA
    Interface Descriptor:
      bLength                 9
      bDescriptorType         4
      bInterfaceNumber        0
      bAlternateSetting       0
      bNumEndpoints           1
      bInterfaceClass         2 Communications
      bInterfaceSubClass      6 Ethernet Networking
      bInterfaceProtocol      0 
      iInterface              5 CDC Communications Control
      CDC Header:
        bcdCDC               1.10
      CDC Union:
        bMasterInterface        0
        bSlaveInterface         1 
      CDC Ethernet:
        iMacAddress                      3 00E04C6BEDEA
        bmEthernetStatistics    0x00000000
        wMaxSegmentSize               1514
        wNumberMCFilters            0x0000
        bNumberPowerFilters              0
      Endpoint Descriptor:
        bLength                 7
        bDescriptorType         5
        bEndpointAddress     0x83  EP 3 IN
        bmAttributes            3
          Transfer Type            Interrupt
          Synch Type               None
          Usage Type               Data
        wMaxPacketSize     0x0010  1x 16 bytes
        bInterval               8
        bMaxBurst               0
    Interface Descriptor:
      bLength                 9
      bDescriptorType         4
      bInterfaceNumber        1
      bAlternateSetting       0
      bNumEndpoints           0
      bInterfaceClass        10 CDC Data
      bInterfaceSubClass      0 
      bInterfaceProtocol      0 
      iInterface              0 
    Interface Descriptor:
      bLength                 9
      bDescriptorType         4
      bInterfaceNumber        1
      bAlternateSetting       1
      bNumEndpoints           2
      bInterfaceClass        10 CDC Data
      bInterfaceSubClass      0 
      bInterfaceProtocol      0 
      iInterface              4 Ethernet Data
      Endpoint Descriptor:
        bLength                 7
        bDescriptorType         5
        bEndpointAddress     0x81  EP 1 IN
        bmAttributes            2
          Transfer Type            Bulk
          Synch Type               None
          Usage Type               Data
        wMaxPacketSize     0x0400  1x 1024 bytes
        bInterval               0
        bMaxBurst               3
      Endpoint Descriptor:
        bLength                 7
        bDescriptorType         5
        bEndpointAddress     0x02  EP 2 OUT
        bmAttributes            2
          Transfer Type            Bulk
          Synch Type               None
          Usage Type               Data
        wMaxPacketSize     0x0400  1x 1024 bytes
        bInterval               0
        bMaxBurst               3
Binary Object Store Descriptor:
  bLength                 5
  bDescriptorType        15
  wTotalLength       0x0016
  bNumDeviceCaps          2
  USB 2.0 Extension Device Capability:
    bLength                 7
    bDescriptorType        16
    bDevCapabilityType      2
    bmAttributes   0x00000002
      HIRD Link Power Management (LPM) Supported
  SuperSpeed USB Device Capability:
    bLength                10
    bDescriptorType        16
    bDevCapabilityType      3
    bmAttributes         0x02
      Latency Tolerance Messages (LTM) Supported
    wSpeedsSupported   0x000e
      Device can operate at Full Speed (12Mbps)
      Device can operate at High Speed (480Mbps)
      Device can operate at SuperSpeed (5Gbps)
    bFunctionalitySupport   2
      Lowest fully-functional device speed is High Speed (480Mbps)
    bU1DevExitLat          10 micro seconds
    bU2DevExitLat        2047 micro seconds
Device Status:     0x0010
  (Bus Powered)
  Latency Tolerance Messaging (LTM) Enabled

Bus 002 Device 002: ID 2109:0817 VIA Labs, Inc. USB3.0 Hub             
Device Descriptor:
  bLength                18
  bDescriptorType         1
  bcdUSB               3.10
  bDeviceClass            9 Hub
  bDeviceSubClass         0 
  bDeviceProtocol         3 
  bMaxPacketSize0         9
  idVendor           0x2109 VIA Labs, Inc.
  idProduct          0x0817 
  bcdDevice            0.50
  iManufacturer           1 VIA Labs, Inc.         
  iProduct                2 USB3.0 Hub             
  iSerial                 0 
  --
  Configuration Descriptor:
    bLength                 9
    bDescriptorType         2
    wTotalLength       0x001f
    bNumInterfaces          1
    bConfigurationValue     1
    iConfiguration          0 
    bmAttributes         0xe0
      Self Powered
      Remote Wakeup
    MaxPower                0mA
    Interface Descriptor:
      bLength                 9
      bDescriptorType         4
      bInterfaceNumber        0
      bAlternateSetting       0
      bNumEndpoints           1
      bInterfaceClass         9 Hub
      bInterfaceSubClass      0 
      bInterfaceProtocol      0 Full speed (or root) hub
      iInterface              0 
      Endpoint Descriptor:
        bLength                 7
        bDescriptorType         5
        bEndpointAddress     0x81  EP 1 IN
        bmAttributes           19
          Transfer Type            Interrupt
          Synch Type               None
          Usage Type               Feedback
        wMaxPacketSize     0x0002  1x 2 bytes
        bInterval               8
        bMaxBurst               0
Hub Descriptor:
  bLength              12
  bDescriptorType      42
  nNbrPorts             4
  wHubCharacteristic 0x0009
    Per-port power switching
    Per-port overcurrent protection
  bPwrOn2PwrGood      175 * 2 milli seconds
  bHubContrCurrent      0 milli Ampere
  bHubDecLat          0.4 micro seconds
  wHubDelay          2292 nano seconds
  DeviceRemovable    0x00
 Hub Port Status:
   Port 1: 0000.0203 lowspeed enable connect
   Port 2: 0000.0203 lowspeed enable connect
   Port 3: 0000.02a0 lowspeed L1
   Port 4: 0000.0263 lowspeed L1 enable connect
Binary Object Store Descriptor:
  bLength                 5
  bDescriptorType        15
  wTotalLength       0x002a
  bNumDeviceCaps          3
  USB 2.0 Extension Device Capability:
    bLength                 7
    bDescriptorType        16
    bDevCapabilityType      2
    bmAttributes   0x00000002
      HIRD Link Power Management (LPM) Supported
  SuperSpeed USB Device Capability:
    bLength                10
    bDescriptorType        16
    bDevCapabilityType      3
    bmAttributes         0x00
    wSpeedsSupported   0x000e
      Device can operate at Full Speed (12Mbps)
      Device can operate at High Speed (480Mbps)
      Device can operate at SuperSpeed (5Gbps)
    bFunctionalitySupport   1
      Lowest fully-functional device speed is Full Speed (12Mbps)
    bU1DevExitLat           4 micro seconds
    bU2DevExitLat         231 micro seconds
  Container ID Device Capability:
    bLength                20
    bDescriptorType        16
    bDevCapabilityType      4
    bReserved               0
    ContainerID             {587CC497-A6C3-AC7F-C94B-62860B2679CD}
Device Status:     0x0005
  Self Powered
  U1 Enabled

Bus 002 Device 001: ID 1d6b:0003 Linux Foundation 3.0 root hub
Device Descriptor:
  bLength                18
  bDescriptorType         1
  bcdUSB               3.00
  bDeviceClass            9 Hub
  bDeviceSubClass         0 
  bDeviceProtocol         3 
  bMaxPacketSize0         9
  idVendor           0x1d6b Linux Foundation
  idProduct          0x0003 3.0 root hub
  bcdDevice            5.13
  iManufacturer           3 Linux 5.13.9-arch1-1 xhci-hcd
  iProduct                2 xHCI Host Controller
  iSerial                 1 --
  bNumConfigurations      1
  Configuration Descriptor:
    bLength                 9
    bDescriptorType         2
    wTotalLength       0x001f
    bNumInterfaces          1
    bConfigurationValue     1
    iConfiguration          0 
    bmAttributes         0xe0
      Self Powered
      Remote Wakeup
    MaxPower                0mA
    Interface Descriptor:
      bLength                 9
      bDescriptorType         4
      bInterfaceNumber        0
      bAlternateSetting       0
      bNumEndpoints           1
      bInterfaceClass         9 Hub
      bInterfaceSubClass      0 
      bInterfaceProtocol      0 Full speed (or root) hub
      iInterface              0 
      Endpoint Descriptor:
        bLength                 7
        bDescriptorType         5
        bEndpointAddress     0x81  EP 1 IN
        bmAttributes            3
          Transfer Type            Interrupt
          Synch Type               None
          Usage Type               Data
        wMaxPacketSize     0x0004  1x 4 bytes
        bInterval              12
        bMaxBurst               0
Hub Descriptor:
  bLength              12
  bDescriptorType      42
  nNbrPorts             8
  wHubCharacteristic 0x000a
    No power switching (usb 1.0)
    Per-port overcurrent protection
  bPwrOn2PwrGood       10 * 2 milli seconds
  bHubContrCurrent      0 milli Ampere
  bHubDecLat          0.0 micro seconds
  wHubDelay             0 nano seconds
  DeviceRemovable    0x00 0x00
 Hub Port Status:
   Port 1: 0000.02a0 5Gbps power Rx.Detect
   Port 2: 0000.02a0 5Gbps power Rx.Detect
   Port 3: 0000.02a0 5Gbps power Rx.Detect
   Port 4: 0000.0203 5Gbps power U0 enable connect
   Port 5: 0000.02a0 5Gbps power Rx.Detect
   Port 6: 0000.02a0 5Gbps power Rx.Detect
   Port 7: 0000.02a0 5Gbps power Rx.Detect
   Port 8: 0000.02a0 5Gbps power Rx.Detect
Binary Object Store Descriptor:
  bLength                 5
  bDescriptorType        15
  wTotalLength       0x000f
  bNumDeviceCaps          1
  SuperSpeed USB Device Capability:
    bLength                10
    bDescriptorType        16
    bDevCapabilityType      3
    bmAttributes         0x02
      Latency Tolerance Messages (LTM) Supported
    wSpeedsSupported   0x0008
      Device can operate at SuperSpeed (5Gbps)
    bFunctionalitySupport   1
      Lowest fully-functional device speed is Full Speed (12Mbps)
    bU1DevExitLat          10 micro seconds
    bU2DevExitLat         512 micro seconds
Device Status:     0x0001
  Self Powered

Bus 001 Device 009: ID 8087:0a2b Intel Corp. Bluetooth wireless interface
Device Descriptor:
  bLength                18
  bDescriptorType         1
  bcdUSB               2.00
  bDeviceClass          224 Wireless
  bDeviceSubClass         1 Radio Frequency
  bDeviceProtocol         1 Bluetooth
  bMaxPacketSize0        64
  idVendor           0x8087 Intel Corp.
  idProduct          0x0a2b Bluetooth wireless interface
  bcdDevice            0.10
  iManufacturer           0 
  iProduct                0 
  iSerial                 0 
  --
  Configuration Descriptor:
    bLength                 9
    bDescriptorType         2
    wTotalLength       0x00b1
    bNumInterfaces          2
    bConfigurationValue     1
    iConfiguration          0 
    bmAttributes         0xe0
      Self Powered
      Remote Wakeup
    MaxPower              100mA
    Interface Descriptor:
      bLength                 9
      bDescriptorType         4
      bInterfaceNumber        0
      bAlternateSetting       0
      bNumEndpoints           3
      bInterfaceClass       224 Wireless
      bInterfaceSubClass      1 Radio Frequency
      bInterfaceProtocol      1 Bluetooth
      iInterface              0 
      Endpoint Descriptor:
        bLength                 7
        bDescriptorType         5
        bEndpointAddress     0x81  EP 1 IN
        bmAttributes            3
          Transfer Type            Interrupt
          Synch Type               None
          Usage Type               Data
        wMaxPacketSize     0x0040  1x 64 bytes
        bInterval               1
      Endpoint Descriptor:
        bLength                 7
        bDescriptorType         5
        bEndpointAddress     0x02  EP 2 OUT
        bmAttributes            2
          Transfer Type            Bulk
          Synch Type               None
          Usage Type               Data
        wMaxPacketSize     0x0040  1x 64 bytes
        bInterval               1
      Endpoint Descriptor:
        bLength                 7
        bDescriptorType         5
        bEndpointAddress     0x82  EP 2 IN
        bmAttributes            2
          Transfer Type            Bulk
          Synch Type               None
          Usage Type               Data
        wMaxPacketSize     0x0040  1x 64 bytes
        bInterval               1
    Interface Descriptor:
      bLength                 9
      bDescriptorType         4
      bInterfaceNumber        1
      bAlternateSetting       0
      bNumEndpoints           2
      bInterfaceClass       224 Wireless
      bInterfaceSubClass      1 Radio Frequency
      bInterfaceProtocol      1 Bluetooth
      iInterface              0 
      Endpoint Descriptor:
        bLength                 7
        bDescriptorType         5
        bEndpointAddress     0x03  EP 3 OUT
        bmAttributes            1
          Transfer Type            Isochronous
          Synch Type               None
          Usage Type               Data
        wMaxPacketSize     0x0000  1x 0 bytes
        bInterval               1
      Endpoint Descriptor:
        bLength                 7
        bDescriptorType         5
        bEndpointAddress     0x83  EP 3 IN
        bmAttributes            1
          Transfer Type            Isochronous
          Synch Type               None
          Usage Type               Data
        wMaxPacketSize     0x0000  1x 0 bytes
        bInterval               1
    Interface Descriptor:
      bLength                 9
      bDescriptorType         4
      bInterfaceNumber        1
      bAlternateSetting       1
      bNumEndpoints           2
      bInterfaceClass       224 Wireless
      bInterfaceSubClass      1 Radio Frequency
      bInterfaceProtocol      1 Bluetooth
      iInterface              0 
      Endpoint Descriptor:
        bLength                 7
        bDescriptorType         5
        bEndpointAddress     0x03  EP 3 OUT
        bmAttributes            1
          Transfer Type            Isochronous
          Synch Type               None
          Usage Type               Data
        wMaxPacketSize     0x0009  1x 9 bytes
        bInterval               1
      Endpoint Descriptor:
        bLength                 7
        bDescriptorType         5
        bEndpointAddress     0x83  EP 3 IN
        bmAttributes            1
          Transfer Type            Isochronous
          Synch Type               None
          Usage Type               Data
        wMaxPacketSize     0x0009  1x 9 bytes
        bInterval               1
    Interface Descriptor:
      bLength                 9
      bDescriptorType         4
      bInterfaceNumber        1
      bAlternateSetting       2
      bNumEndpoints           2
      bInterfaceClass       224 Wireless
      bInterfaceSubClass      1 Radio Frequency
      bInterfaceProtocol      1 Bluetooth
      iInterface              0 
      Endpoint Descriptor:
        bLength                 7
        bDescriptorType         5
        bEndpointAddress     0x03  EP 3 OUT
        bmAttributes            1
          Transfer Type            Isochronous
          Synch Type               None
          Usage Type               Data
        wMaxPacketSize     0x0011  1x 17 bytes
        bInterval               1
      Endpoint Descriptor:
        bLength                 7
        bDescriptorType         5
        bEndpointAddress     0x83  EP 3 IN
        bmAttributes            1
          Transfer Type            Isochronous
          Synch Type               None
          Usage Type               Data
        wMaxPacketSize     0x0011  1x 17 bytes
        bInterval               1
    Interface Descriptor:
      bLength                 9
      bDescriptorType         4
      bInterfaceNumber        1
      bAlternateSetting       3
      bNumEndpoints           2
      bInterfaceClass       224 Wireless
      bInterfaceSubClass      1 Radio Frequency
      bInterfaceProtocol      1 Bluetooth
      iInterface              0 
      Endpoint Descriptor:
        bLength                 7
        bDescriptorType         5
        bEndpointAddress     0x03  EP 3 OUT
        bmAttributes            1
          Transfer Type            Isochronous
          Synch Type               None
          Usage Type               Data
        wMaxPacketSize     0x0019  1x 25 bytes
        bInterval               1
      Endpoint Descriptor:
        bLength                 7
        bDescriptorType         5
        bEndpointAddress     0x83  EP 3 IN
        bmAttributes            1
          Transfer Type            Isochronous
          Synch Type               None
          Usage Type               Data
        wMaxPacketSize     0x0019  1x 25 bytes
        bInterval               1
    Interface Descriptor:
      bLength                 9
      bDescriptorType         4
      bInterfaceNumber        1
      bAlternateSetting       4
      bNumEndpoints           2
      bInterfaceClass       224 Wireless
      bInterfaceSubClass      1 Radio Frequency
      bInterfaceProtocol      1 Bluetooth
      iInterface              0 
      Endpoint Descriptor:
        bLength                 7
        bDescriptorType         5
        bEndpointAddress     0x03  EP 3 OUT
        bmAttributes            1
          Transfer Type            Isochronous
          Synch Type               None
          Usage Type               Data
        wMaxPacketSize     0x0021  1x 33 bytes
        bInterval               1
      Endpoint Descriptor:
        bLength                 7
        bDescriptorType         5
        bEndpointAddress     0x83  EP 3 IN
        bmAttributes            1
          Transfer Type            Isochronous
          Synch Type               None
          Usage Type               Data
        wMaxPacketSize     0x0021  1x 33 bytes
        bInterval               1
    Interface Descriptor:
      bLength                 9
      bDescriptorType         4
      bInterfaceNumber        1
      bAlternateSetting       5
      bNumEndpoints           2
      bInterfaceClass       224 Wireless
      bInterfaceSubClass      1 Radio Frequency
      bInterfaceProtocol      1 Bluetooth
      iInterface              0 
      Endpoint Descriptor:
        bLength                 7
        bDescriptorType         5
        bEndpointAddress     0x03  EP 3 OUT
        bmAttributes            1
          Transfer Type            Isochronous
          Synch Type               None
          Usage Type               Data
        wMaxPacketSize     0x0031  1x 49 bytes
        bInterval               1
      Endpoint Descriptor:
        bLength                 7
        bDescriptorType         5
        bEndpointAddress     0x83  EP 3 IN
        bmAttributes            1
          Transfer Type            Isochronous
          Synch Type               None
          Usage Type               Data
        wMaxPacketSize     0x0031  1x 49 bytes
        bInterval               1
Device Status:     0x0001
  Self Powered

Bus 001 Device 005: ID 0bda:0129 Realtek Semiconductor Corp. RTS5129 Card Reader Controller
Device Descriptor:
  bLength                18
  bDescriptorType         1
  bcdUSB               2.00
  bDeviceClass          255 Vendor Specific Class
  bDeviceSubClass       255 Vendor Specific Subclass
  bDeviceProtocol       255 Vendor Specific Protocol
  bMaxPacketSize0        64
  idVendor           0x0bda Realtek Semiconductor Corp.
  idProduct          0x0129 RTS5129 Card Reader Controller
  bcdDevice           39.60
  iManufacturer           1 Generic
  iProduct                2 USB2.0-CRW
  iSerial                 3 --
  bNumConfigurations      1
  Configuration Descriptor:
    bLength                 9
    bDescriptorType         2
    wTotalLength       0x0027
    bNumInterfaces          1
    bConfigurationValue     1
    iConfiguration          4 CARD READER
    bmAttributes         0xa0
      (Bus Powered)
      Remote Wakeup
    MaxPower              500mA
    Interface Descriptor:
      bLength                 9
      bDescriptorType         4
      bInterfaceNumber        0
      bAlternateSetting       0
      bNumEndpoints           3
      bInterfaceClass       255 Vendor Specific Class
      bInterfaceSubClass      6 
      bInterfaceProtocol     80 
      iInterface              5 Bulk-In, Bulk-Out, Interface
      Endpoint Descriptor:
        bLength                 7
        bDescriptorType         5
        bEndpointAddress     0x01  EP 1 OUT
        bmAttributes            2
          Transfer Type            Bulk
          Synch Type               None
          Usage Type               Data
        wMaxPacketSize     0x0200  1x 512 bytes
        bInterval               0
      Endpoint Descriptor:
        bLength                 7
        bDescriptorType         5
        bEndpointAddress     0x82  EP 2 IN
        bmAttributes            2
          Transfer Type            Bulk
          Synch Type               None
          Usage Type               Data
        wMaxPacketSize     0x0200  1x 512 bytes
        bInterval               0
      Endpoint Descriptor:
        bLength                 7
        bDescriptorType         5
        bEndpointAddress     0x83  EP 3 IN
        bmAttributes            3
          Transfer Type            Interrupt
          Synch Type               None
          Usage Type               Data
        wMaxPacketSize     0x0003  1x 3 bytes
        bInterval              10
Device Qualifier (for other device speed):
  bLength                10
  bDescriptorType         6
  bcdUSB               2.00
  bDeviceClass            0 
  bDeviceSubClass         0 
  bDeviceProtocol         0 
  bMaxPacketSize0        64
  bNumConfigurations      1
Device Status:     0x0000
  (Bus Powered)

Bus 001 Device 004: ID 04f2:b57a Chicony Electronics Co., Ltd USB2.0 HD UVC WebCam
Device Descriptor:
  bLength                18
  bDescriptorType         1
  bcdUSB               2.00
  bDeviceClass          239 Miscellaneous Device
  bDeviceSubClass         2 
  bDeviceProtocol         1 Interface Association
  bMaxPacketSize0        64
  idVendor           0x04f2 Chicony Electronics Co., Ltd
  idProduct          0xb57a 
  bcdDevice            0.02
  iManufacturer           3 Chicony Electronics Co.,Ltd.
  iProduct                1 USB2.0 HD UVC WebCam
  iSerial                 2 --
  bNumConfigurations      1
  Configuration Descriptor:
    bLength                 9
    bDescriptorType         2
    wTotalLength       0x02df
    bNumInterfaces          2
    bConfigurationValue     1
    iConfiguration          4 USB Camera
    bmAttributes         0x80
      (Bus Powered)
    MaxPower              500mA
    Interface Association:
      bLength                 8
      bDescriptorType        11
      bFirstInterface         0
      bInterfaceCount         2
      bFunctionClass         14 Video
      bFunctionSubClass       3 Video Interface Collection
      bFunctionProtocol       0 
      iFunction               5 USB2.0 HD UVC WebCam
    Interface Descriptor:
      bLength                 9
      bDescriptorType         4
      bInterfaceNumber        0
      bAlternateSetting       0
      bNumEndpoints           1
      bInterfaceClass        14 Video
      bInterfaceSubClass      1 Video Control
      bInterfaceProtocol      0 
      iInterface              5 USB2.0 HD UVC WebCam
      VideoControl Interface Descriptor:
        bLength                13
        bDescriptorType        36
        bDescriptorSubtype      1 (HEADER)
        bcdUVC               1.00
        wTotalLength       0x006b
        dwClockFrequency       15.000000MHz
        bInCollection           1
        baInterfaceNr( 0)       1
      VideoControl Interface Descriptor:
        bLength                18
        bDescriptorType        36
        bDescriptorSubtype      2 (INPUT_TERMINAL)
        bTerminalID             1
        wTerminalType      0x0201 Camera Sensor
        bAssocTerminal          0
        iTerminal               0 
        wObjectiveFocalLengthMin      0
        wObjectiveFocalLengthMax      0
        wOcularFocalLength            0
        bControlSize                  3
        bmControls           0x0000000e
          Auto-Exposure Mode
          Auto-Exposure Priority
          Exposure Time (Absolute)
      VideoControl Interface Descriptor:
        bLength                11
        bDescriptorType        36
        bDescriptorSubtype      5 (PROCESSING_UNIT)
      Warning: Descriptor too short
        bUnitID                 2
        bSourceID               1
        wMaxMultiplier          0
        bControlSize            2
        bmControls     0x0000157f
          Brightness
          Contrast
          Hue
          Saturation
          Sharpness
          Gamma
          White Balance Temperature
          Backlight Compensation
          Power Line Frequency
          White Balance Temperature, Auto
        iProcessing             0 
        bmVideoStandards     0x09
          None
          SECAM - 625/50
      VideoControl Interface Descriptor:
        bLength                 9
        bDescriptorType        36
        bDescriptorSubtype      3 (OUTPUT_TERMINAL)
        bTerminalID             3
        wTerminalType      0x0101 USB Streaming
        bAssocTerminal          0
        bSourceID               6
        iTerminal               0 
      VideoControl Interface Descriptor:
        bLength                27
        bDescriptorType        36
        bDescriptorSubtype      6 (EXTENSION_UNIT)
        bUnitID                 4
        guidExtensionCode         {6121E9C1-6FC2-4E40-F356-729932B8C1DF}
        bNumControls            2
        bNrInPins               1
        baSourceID( 0)          2
        bControlSize            2
        bmControls( 0)       0x00
        bmControls( 1)       0x06
        iExtension              0 
      VideoControl Interface Descriptor:
        bLength                29
        bDescriptorType        36
        bDescriptorSubtype      6 (EXTENSION_UNIT)
        bUnitID                 6
        guidExtensionCode         {A87B266B-D051-603A-E16C-14E0251DEDCE}
        bNumControls            1
        bNrInPins               1
        baSourceID( 0)          4
        bControlSize            4
        bmControls( 0)       0x02
        bmControls( 1)       0x00
        bmControls( 2)       0x00
        bmControls( 3)       0x00
        iExtension              7 Realtek Extended Controls Unit
      Endpoint Descriptor:
        bLength                 7
        bDescriptorType         5
        bEndpointAddress     0x83  EP 3 IN
        bmAttributes            3
          Transfer Type            Interrupt
          Synch Type               None
          Usage Type               Data
        wMaxPacketSize     0x0010  1x 16 bytes
        bInterval               6
    Interface Descriptor:
      bLength                 9
      bDescriptorType         4
      bInterfaceNumber        1
      bAlternateSetting       0
      bNumEndpoints           0
      bInterfaceClass        14 Video
      bInterfaceSubClass      2 Video Streaming
      bInterfaceProtocol      0 
      iInterface              0 
      VideoStreaming Interface Descriptor:
        bLength                            15
        bDescriptorType                    36
        bDescriptorSubtype                  1 (INPUT_HEADER)
        bNumFormats                         2
        wTotalLength                   0x01d5
        bEndPointAddress                  129
        bmInfo                              0
        bTerminalLink                       3
        bStillCaptureMethod                 2
        bTriggerSupport                     1
        bTriggerUsage                       0
        bControlSize                        1
        bmaControls( 0)                     0
        bmaControls( 1)                     0
      VideoStreaming Interface Descriptor:
        bLength                            11
        bDescriptorType                    36
        bDescriptorSubtype                  6 (FORMAT_MJPEG)
        bFormatIndex                        1
        bNumFrameDescriptors                6
        bFlags                              1
          Fixed-size samples: Yes
        bDefaultFrameIndex                  1
        bAspectRatioX                       0
        bAspectRatioY                       0
        bmInterlaceFlags                 0x00
          Interlaced stream or variable: No
          Fields per frame: 1 fields
          Field 1 first: No
          Field pattern: Field 1 only
        bCopyProtect                        0
      VideoStreaming Interface Descriptor:
        bLength                            30
        bDescriptorType                    36
        bDescriptorSubtype                  7 (FRAME_MJPEG)
        bFrameIndex                         1
        bmCapabilities                   0x00
          Still image unsupported
        wWidth                           1280
        wHeight                           720
        dwMinBitRate                442368000
        dwMaxBitRate                442368000
        dwMaxVideoFrameBufferSize     1843200
        dwDefaultFrameInterval         333333
        bFrameIntervalType                  1
        dwFrameInterval( 0)            333333
      VideoStreaming Interface Descriptor:
        bLength                            30
        bDescriptorType                    36
        bDescriptorSubtype                  7 (FRAME_MJPEG)
        bFrameIndex                         2
        bmCapabilities                   0x00
          Still image unsupported
        wWidth                            160
        wHeight                           120
        dwMinBitRate                  9216000
        dwMaxBitRate                  9216000
        dwMaxVideoFrameBufferSize       38400
        dwDefaultFrameInterval         333333
        bFrameIntervalType                  1
        dwFrameInterval( 0)            333333
      VideoStreaming Interface Descriptor:
        bLength                            30
        bDescriptorType                    36
        bDescriptorSubtype                  7 (FRAME_MJPEG)
        bFrameIndex                         3
        bmCapabilities                   0x00
          Still image unsupported
        wWidth                            176
        wHeight                           144
        dwMinBitRate                 12165120
        dwMaxBitRate                 12165120
        dwMaxVideoFrameBufferSize       50688
        dwDefaultFrameInterval         333333
        bFrameIntervalType                  1
        dwFrameInterval( 0)            333333
      VideoStreaming Interface Descriptor:
        bLength                            30
        bDescriptorType                    36
        bDescriptorSubtype                  7 (FRAME_MJPEG)
        bFrameIndex                         4
        bmCapabilities                   0x00
          Still image unsupported
        wWidth                            320
        wHeight                           240
        dwMinBitRate                 36864000
        dwMaxBitRate                 36864000
        dwMaxVideoFrameBufferSize      153600
        dwDefaultFrameInterval         333333
        bFrameIntervalType                  1
        dwFrameInterval( 0)            333333
      VideoStreaming Interface Descriptor:
        bLength                            30
        bDescriptorType                    36
        bDescriptorSubtype                  7 (FRAME_MJPEG)
        bFrameIndex                         5
        bmCapabilities                   0x00
          Still image unsupported
        wWidth                            352
        wHeight                           288
        dwMinBitRate                 48660480
        dwMaxBitRate                 48660480
        dwMaxVideoFrameBufferSize      202752
        dwDefaultFrameInterval         333333
        bFrameIntervalType                  1
        dwFrameInterval( 0)            333333
      VideoStreaming Interface Descriptor:
        bLength                            30
        bDescriptorType                    36
        bDescriptorSubtype                  7 (FRAME_MJPEG)
        bFrameIndex                         6
        bmCapabilities                   0x00
          Still image unsupported
        wWidth                            640
        wHeight                           480
        dwMinBitRate                147456000
        dwMaxBitRate                147456000
        dwMaxVideoFrameBufferSize      614400
        dwDefaultFrameInterval         333333
        bFrameIntervalType                  1
        dwFrameInterval( 0)            333333
      VideoStreaming Interface Descriptor:
        bLength                            22
        bDescriptorType                    36
        bDescriptorSubtype                  3 (STILL_IMAGE_FRAME)
        bEndpointAddress                    0
        bNumImageSizePatterns               4
        wWidth( 0)                       1280
        wHeight( 0)                       720
        wWidth( 1)                        160
        wHeight( 1)                       120
        wWidth( 2)                        320
        wHeight( 2)                       240
        wWidth( 3)                        640
        wHeight( 3)                       480
        bNumCompressionPatterns             0
      VideoStreaming Interface Descriptor:
        bLength                             6
        bDescriptorType                    36
        bDescriptorSubtype                 13 (COLORFORMAT)
        bColorPrimaries                     1 (BT.709,sRGB)
        bTransferCharacteristics            1 (BT.709)
        bMatrixCoefficients                 4 (SMPTE 170M (BT.601))
      VideoStreaming Interface Descriptor:
        bLength                            27
        bDescriptorType                    36
        bDescriptorSubtype                  4 (FORMAT_UNCOMPRESSED)
        bFormatIndex                        2
        bNumFrameDescriptors                6
        guidFormat                            {8EF9C08B-31CA-CE52-FAB3-2086E54AD191}
        bBitsPerPixel                      16
        bDefaultFrameIndex                  1
        bAspectRatioX                       0
        bAspectRatioY                       0
        bmInterlaceFlags                 0x00
          Interlaced stream or variable: No
          Fields per frame: 2 fields
          Field 1 first: No
          Field pattern: Field 1 only
        bCopyProtect                        0
      VideoStreaming Interface Descriptor:
        bLength                            30
        bDescriptorType                    36
        bDescriptorSubtype                  5 (FRAME_UNCOMPRESSED)
        bFrameIndex                         1
        bmCapabilities                   0x00
          Still image unsupported
        wWidth                           1280
        wHeight                           720
        dwMinBitRate                147456000
        dwMaxBitRate                147456000
        dwMaxVideoFrameBufferSize     1843200
        dwDefaultFrameInterval        1000000
        bFrameIntervalType                  1
        dwFrameInterval( 0)           1000000
      VideoStreaming Interface Descriptor:
        bLength                            30
        bDescriptorType                    36
        bDescriptorSubtype                  5 (FRAME_UNCOMPRESSED)
        bFrameIndex                         2
        bmCapabilities                   0x00
          Still image unsupported
        wWidth                            160
        wHeight                           120
        dwMinBitRate                  9216000
        dwMaxBitRate                  9216000
        dwMaxVideoFrameBufferSize       38400
        dwDefaultFrameInterval         333333
        bFrameIntervalType                  1
        dwFrameInterval( 0)            333333
      VideoStreaming Interface Descriptor:
        bLength                            30
        bDescriptorType                    36
        bDescriptorSubtype                  5 (FRAME_UNCOMPRESSED)
        bFrameIndex                         3
        bmCapabilities                   0x00
          Still image unsupported
        wWidth                            176
        wHeight                           144
        dwMinBitRate                 12165120
        dwMaxBitRate                 12165120
        dwMaxVideoFrameBufferSize       50688
        dwDefaultFrameInterval         333333
        bFrameIntervalType                  1
        dwFrameInterval( 0)            333333
      VideoStreaming Interface Descriptor:
        bLength                            30
        bDescriptorType                    36
        bDescriptorSubtype                  5 (FRAME_UNCOMPRESSED)
        bFrameIndex                         4
        bmCapabilities                   0x00
          Still image unsupported
        wWidth                            320
        wHeight                           240
        dwMinBitRate                 36864000
        dwMaxBitRate                 36864000
        dwMaxVideoFrameBufferSize      153600
        dwDefaultFrameInterval         333333
        bFrameIntervalType                  1
        dwFrameInterval( 0)            333333
      VideoStreaming Interface Descriptor:
        bLength                            30
        bDescriptorType                    36
        bDescriptorSubtype                  5 (FRAME_UNCOMPRESSED)
        bFrameIndex                         5
        bmCapabilities                   0x00
          Still image unsupported
        wWidth                            352
        wHeight                           288
        dwMinBitRate                 48660480
        dwMaxBitRate                 48660480
        dwMaxVideoFrameBufferSize      202752
        dwDefaultFrameInterval         333333
        bFrameIntervalType                  1
        dwFrameInterval( 0)            333333
      VideoStreaming Interface Descriptor:
        bLength                            30
        bDescriptorType                    36
        bDescriptorSubtype                  5 (FRAME_UNCOMPRESSED)
        bFrameIndex                         6
        bmCapabilities                   0x00
          Still image unsupported
        wWidth                            640
        wHeight                           480
        dwMinBitRate                147456000
        dwMaxBitRate                147456000
        dwMaxVideoFrameBufferSize      614400
        dwDefaultFrameInterval         333333
        bFrameIntervalType                  1
        dwFrameInterval( 0)            333333
      VideoStreaming Interface Descriptor:
        bLength                            22
        bDescriptorType                    36
        bDescriptorSubtype                  3 (STILL_IMAGE_FRAME)
        bEndpointAddress                    0
        bNumImageSizePatterns               4
        wWidth( 0)                       1280
        wHeight( 0)                       720
        wWidth( 1)                        160
        wHeight( 1)                       120
        wWidth( 2)                        320
        wHeight( 2)                       240
        wWidth( 3)                        640
        wHeight( 3)                       480
        bNumCompressionPatterns             0
      VideoStreaming Interface Descriptor:
        bLength                             6
        bDescriptorType                    36
        bDescriptorSubtype                 13 (COLORFORMAT)
        bColorPrimaries                     1 (BT.709,sRGB)
        bTransferCharacteristics            1 (BT.709)
        bMatrixCoefficients                 4 (SMPTE 170M (BT.601))
    Interface Descriptor:
      bLength                 9
      bDescriptorType         4
      bInterfaceNumber        1
      bAlternateSetting       1
      bNumEndpoints           1
      bInterfaceClass        14 Video
      bInterfaceSubClass      2 Video Streaming
      bInterfaceProtocol      0 
      iInterface              0 
      Endpoint Descriptor:
        bLength                 7
        bDescriptorType         5
        bEndpointAddress     0x81  EP 1 IN
        bmAttributes            5
          Transfer Type            Isochronous
          Synch Type               Asynchronous
          Usage Type               Data
        wMaxPacketSize     0x0080  1x 128 bytes
        bInterval               1
    Interface Descriptor:
      bLength                 9
      bDescriptorType         4
      bInterfaceNumber        1
      bAlternateSetting       2
      bNumEndpoints           1
      bInterfaceClass        14 Video
      bInterfaceSubClass      2 Video Streaming
      bInterfaceProtocol      0 
      iInterface              0 
      Endpoint Descriptor:
        bLength                 7
        bDescriptorType         5
        bEndpointAddress     0x81  EP 1 IN
        bmAttributes            5
          Transfer Type            Isochronous
          Synch Type               Asynchronous
          Usage Type               Data
        wMaxPacketSize     0x0200  1x 512 bytes
        bInterval               1
    Interface Descriptor:
      bLength                 9
      bDescriptorType         4
      bInterfaceNumber        1
      bAlternateSetting       3
      bNumEndpoints           1
      bInterfaceClass        14 Video
      bInterfaceSubClass      2 Video Streaming
      bInterfaceProtocol      0 
      iInterface              0 
      Endpoint Descriptor:
        bLength                 7
        bDescriptorType         5
        bEndpointAddress     0x81  EP 1 IN
        bmAttributes            5
          Transfer Type            Isochronous
          Synch Type               Asynchronous
          Usage Type               Data
        wMaxPacketSize     0x0400  1x 1024 bytes
        bInterval               1
    Interface Descriptor:
      bLength                 9
      bDescriptorType         4
      bInterfaceNumber        1
      bAlternateSetting       4
      bNumEndpoints           1
      bInterfaceClass        14 Video
      bInterfaceSubClass      2 Video Streaming
      bInterfaceProtocol      0 
      iInterface              0 
      Endpoint Descriptor:
        bLength                 7
        bDescriptorType         5
        bEndpointAddress     0x81  EP 1 IN
        bmAttributes            5
          Transfer Type            Isochronous
          Synch Type               Asynchronous
          Usage Type               Data
        wMaxPacketSize     0x0b00  2x 768 bytes
        bInterval               1
    Interface Descriptor:
      bLength                 9
      bDescriptorType         4
      bInterfaceNumber        1
      bAlternateSetting       5
      bNumEndpoints           1
      bInterfaceClass        14 Video
      bInterfaceSubClass      2 Video Streaming
      bInterfaceProtocol      0 
      iInterface              0 
      Endpoint Descriptor:
        bLength                 7
        bDescriptorType         5
        bEndpointAddress     0x81  EP 1 IN
        bmAttributes            5
          Transfer Type            Isochronous
          Synch Type               Asynchronous
          Usage Type               Data
        wMaxPacketSize     0x0c00  2x 1024 bytes
        bInterval               1
    Interface Descriptor:
      bLength                 9
      bDescriptorType         4
      bInterfaceNumber        1
      bAlternateSetting       6
      bNumEndpoints           1
      bInterfaceClass        14 Video
      bInterfaceSubClass      2 Video Streaming
      bInterfaceProtocol      0 
      iInterface              0 
      Endpoint Descriptor:
        bLength                 7
        bDescriptorType         5
        bEndpointAddress     0x81  EP 1 IN
        bmAttributes            5
          Transfer Type            Isochronous
          Synch Type               Asynchronous
          Usage Type               Data
        wMaxPacketSize     0x1380  3x 896 bytes
        bInterval               1
    Interface Descriptor:
      bLength                 9
      bDescriptorType         4
      bInterfaceNumber        1
      bAlternateSetting       7
      bNumEndpoints           1
      bInterfaceClass        14 Video
      bInterfaceSubClass      2 Video Streaming
      bInterfaceProtocol      0 
      iInterface              0 
      Endpoint Descriptor:
        bLength                 7
        bDescriptorType         5
        bEndpointAddress     0x81  EP 1 IN
        bmAttributes            5
          Transfer Type            Isochronous
          Synch Type               Asynchronous
          Usage Type               Data
        wMaxPacketSize     0x1400  3x 1024 bytes
        bInterval               1
Device Qualifier (for other device speed):
  bLength                10
  bDescriptorType         6
  bcdUSB               2.00
  bDeviceClass          239 Miscellaneous Device
  bDeviceSubClass         2 
  bDeviceProtocol         1 Interface Association
  bMaxPacketSize0        64
  bNumConfigurations      1
Device Status:     0x0000
  (Bus Powered)

Bus 001 Device 010: ID 046d:c312 Logitech, Inc. DeLuxe 250 Keyboard
Device Descriptor:
  bLength                18
  bDescriptorType         1
  bcdUSB               1.10
  bDeviceClass            0 
  bDeviceSubClass         0 
  bDeviceProtocol         0 
  bMaxPacketSize0         8
  idVendor           0x046d Logitech, Inc.
  idProduct          0xc312 DeLuxe 250 Keyboard
  bcdDevice            1.01
  iManufacturer           1 LITEON Technology
  iProduct                2 USB Multimedia Keyboard
  iSerial                 0 
  --
  Configuration Descriptor:
    bLength                 9
    bDescriptorType         2
    wTotalLength       0x0022
    bNumInterfaces          1
    bConfigurationValue     1
    iConfiguration          0 
    bmAttributes         0xa0
      (Bus Powered)
      Remote Wakeup
    MaxPower               70mA
    Interface Descriptor:
      bLength                 9
      bDescriptorType         4
      bInterfaceNumber        0
      bAlternateSetting       0
      bNumEndpoints           1
      bInterfaceClass         3 Human Interface Device
      bInterfaceSubClass      1 Boot Interface Subclass
      bInterfaceProtocol      1 Keyboard
      iInterface              0 
        HID Device Descriptor:
          bLength                 9
          bDescriptorType        33
          bcdHID               1.10
          bCountryCode            0 Not supported
          bNumDescriptors         1
          bDescriptorType        34 Report
          wDescriptorLength      65
         Report Descriptors: 
           ** UNAVAILABLE **
      Endpoint Descriptor:
        bLength                 7
        bDescriptorType         5
        bEndpointAddress     0x81  EP 1 IN
        bmAttributes            3
          Transfer Type            Interrupt
          Synch Type               None
          Usage Type               Data
        wMaxPacketSize     0x0008  1x 8 bytes
        bInterval              24
Device Status:     0x0000
  (Bus Powered)

Bus 001 Device 008: ID 0bda:5411 Realtek Semiconductor Corp. RTS5411 Hub
Device Descriptor:
  bLength                18
  bDescriptorType         1
  bcdUSB               2.10
  bDeviceClass            9 Hub
  bDeviceSubClass         0 
  bDeviceProtocol         2 TT per port
  bMaxPacketSize0        64
  idVendor           0x0bda Realtek Semiconductor Corp.
  idProduct          0x5411 RTS5411 Hub
  bcdDevice            1.04
  iManufacturer           1 Generic
  iProduct                2 4-Port USB 2.0 Hub
  iSerial                 0 
  --
  Configuration Descriptor:
    bLength                 9
    bDescriptorType         2
    wTotalLength       0x0029
    bNumInterfaces          1
    bConfigurationValue     1
    iConfiguration          0 
    bmAttributes         0xe0
      Self Powered
      Remote Wakeup
    MaxPower                0mA
    Interface Descriptor:
      bLength                 9
      bDescriptorType         4
      bInterfaceNumber        0
      bAlternateSetting       0
      bNumEndpoints           1
      bInterfaceClass         9 Hub
      bInterfaceSubClass      0 
      bInterfaceProtocol      1 Single TT
      iInterface              0 
      Endpoint Descriptor:
        bLength                 7
        bDescriptorType         5
        bEndpointAddress     0x81  EP 1 IN
        bmAttributes            3
          Transfer Type            Interrupt
          Synch Type               None
          Usage Type               Data
        wMaxPacketSize     0x0001  1x 1 bytes
        bInterval              12
    Interface Descriptor:
      bLength                 9
      bDescriptorType         4
      bInterfaceNumber        0
      bAlternateSetting       1
      bNumEndpoints           1
      bInterfaceClass         9 Hub
      bInterfaceSubClass      0 
      bInterfaceProtocol      2 TT per port
      iInterface              0 
      Endpoint Descriptor:
        bLength                 7
        bDescriptorType         5
        bEndpointAddress     0x81  EP 1 IN
        bmAttributes            3
          Transfer Type            Interrupt
          Synch Type               None
          Usage Type               Data
        wMaxPacketSize     0x0001  1x 1 bytes
        bInterval              12
Hub Descriptor:
  bLength               9
  bDescriptorType      41
  nNbrPorts             4
  wHubCharacteristic 0x00a9
    Per-port power switching
    Per-port overcurrent protection
    TT think time 16 FS bits
    Port indicators
  bPwrOn2PwrGood       50 * 2 milli seconds
  bHubContrCurrent    100 milli Ampere
  DeviceRemovable    0x00
  PortPwrCtrlMask    0xff
 Hub Port Status:
   Port 1: 0000.0100 power
   Port 2: 0000.0100 power
   Port 3: 0000.0303 lowspeed power enable connect
   Port 4: 0000.0100 power
Binary Object Store Descriptor:
  bLength                 5
  bDescriptorType        15
  wTotalLength       0x002a
  bNumDeviceCaps          3
  USB 2.0 Extension Device Capability:
    bLength                 7
    bDescriptorType        16
    bDevCapabilityType      2
    bmAttributes   0x0000f41e
      BESL Link Power Management (LPM) Supported
    BESL value     1024 us 
    Deep BESL value    61440 us 
  SuperSpeed USB Device Capability:
    bLength                10
    bDescriptorType        16
    bDevCapabilityType      3
    bmAttributes         0x00
    wSpeedsSupported   0x000e
      Device can operate at Full Speed (12Mbps)
      Device can operate at High Speed (480Mbps)
      Device can operate at SuperSpeed (5Gbps)
    bFunctionalitySupport   1
      Lowest fully-functional device speed is Full Speed (12Mbps)
    bU1DevExitLat          10 micro seconds
    bU2DevExitLat        1023 micro seconds
  Container ID Device Capability:
    bLength                20
    bDescriptorType        16
    bDevCapabilityType      4
    bReserved               0
    ContainerID             {FE85D647-F322-A61D-C14F-583B9AA2234E}
Device Status:     0x0001
  Self Powered

Bus 001 Device 006: ID 2109:0102 VIA Labs, Inc. USB 2.0 BILLBOARD             
Device Descriptor:
  bLength                18
  bDescriptorType         1
  bcdUSB               2.01
  bDeviceClass           17 
  bDeviceSubClass         0 
  bDeviceProtocol         0 
  bMaxPacketSize0        64
  idVendor           0x2109 VIA Labs, Inc.
  idProduct          0x0102 
  bcdDevice            1.35
  iManufacturer           1 VIA Technologies Inc.         
  iProduct                2 USB 2.0 BILLBOARD             
  iSerial                 3 --
  bNumConfigurations      1
  Configuration Descriptor:
    bLength                 9
    bDescriptorType         2
    wTotalLength       0x0012
    bNumInterfaces          1
    bConfigurationValue     1
    iConfiguration          4 http://help.vesa.org/dp-usb-type-c/
    bmAttributes         0x80
      (Bus Powered)
    MaxPower              500mA
    Interface Descriptor:
      bLength                 9
      bDescriptorType         4
      bInterfaceNumber        0
      bAlternateSetting       0
      bNumEndpoints           0
      bInterfaceClass        17 
      bInterfaceSubClass      0 
      bInterfaceProtocol      0 
      iInterface              4 http://help.vesa.org/dp-usb-type-c/
Binary Object Store Descriptor:
  bLength                 5
  bDescriptorType        15
  wTotalLength       0x0051
  bNumDeviceCaps          3
  Container ID Device Capability:
    bLength                20
    bDescriptorType        16
    bDevCapabilityType      4
    bReserved               0
    ContainerID             {93D44994-D953-3066-3FF5-8B8284D31CBB}
  Billboard Capability:
    bLength                    48
    bDescriptorType            16
    bDevCapabilityType         13
    iAddtionalInfoURL           4 http://help.vesa.org/dp-usb-type-c/
    bNumberOfAlternateModes     1
    bPreferredAlternateMode     0
    VCONN Power                 1 1.5W
    bmConfigured                03 00 00 00 00 00 00 00 00 00 00 00 00 00 00 00 00 00 00 00 00 00 00 00 00 00 00 00 00 00 00 00
    bcdVersion               1.21
    bAdditionalFailureInfo      0
    bReserved                   0
    Alternate Modes supported by Device Container:
    Alternate Mode 0 : Alternate Mode configuration successful
      wSVID[0]                    0xFF01
      bAlternateMode[0]           0
      iAlternateModeString[0]     4 http://help.vesa.org/dp-usb-type-c/
  Billboard Alternate Mode Capability:
    bLength                     8
    bDescriptorType            16
    bDevCapabilityType         15
    bIndex                      0
    dwAlternateModeVdo          0x00000000
Device Status:     0x0000
  (Bus Powered)

Bus 001 Device 003: ID 2109:2817 VIA Labs, Inc. USB2.0 Hub             
Device Descriptor:
  bLength                18
  bDescriptorType         1
  bcdUSB               2.10
  bDeviceClass            9 Hub
  bDeviceSubClass         0 
  bDeviceProtocol         2 TT per port
  bMaxPacketSize0        64
  idVendor           0x2109 VIA Labs, Inc.
  idProduct          0x2817 
  bcdDevice            0.50
  iManufacturer           1 VIA Labs, Inc.         
  iProduct                2 USB2.0 Hub             
  iSerial                 0 
  --
  Configuration Descriptor:
    bLength                 9
    bDescriptorType         2
    wTotalLength       0x0029
    bNumInterfaces          1
    bConfigurationValue     1
    iConfiguration          0 
    bmAttributes         0xe0
      Self Powered
      Remote Wakeup
    MaxPower                0mA
    Interface Descriptor:
      bLength                 9
      bDescriptorType         4
      bInterfaceNumber        0
      bAlternateSetting       0
      bNumEndpoints           1
      bInterfaceClass         9 Hub
      bInterfaceSubClass      0 
      bInterfaceProtocol      1 Single TT
      iInterface              0 
      Endpoint Descriptor:
        bLength                 7
        bDescriptorType         5
        bEndpointAddress     0x81  EP 1 IN
        bmAttributes            3
          Transfer Type            Interrupt
          Synch Type               None
          Usage Type               Data
        wMaxPacketSize     0x0001  1x 1 bytes
        bInterval              12
    Interface Descriptor:
      bLength                 9
      bDescriptorType         4
      bInterfaceNumber        0
      bAlternateSetting       1
      bNumEndpoints           1
      bInterfaceClass         9 Hub
      bInterfaceSubClass      0 
      bInterfaceProtocol      2 TT per port
      iInterface              0 
      Endpoint Descriptor:
        bLength                 7
        bDescriptorType         5
        bEndpointAddress     0x81  EP 1 IN
        bmAttributes            3
          Transfer Type            Interrupt
          Synch Type               None
          Usage Type               Data
        wMaxPacketSize     0x0001  1x 1 bytes
        bInterval              12
Hub Descriptor:
  bLength               9
  bDescriptorType      41
  nNbrPorts             4
  wHubCharacteristic 0x00e9
    Per-port power switching
    Per-port overcurrent protection
    TT think time 32 FS bits
    Port indicators
  bPwrOn2PwrGood      175 * 2 milli seconds
  bHubContrCurrent    100 milli Ampere
  DeviceRemovable    0x00
  PortPwrCtrlMask    0xff
 Hub Port Status:
   Port 1: 0000.0100 power
   Port 2: 0000.0100 power
   Port 3: 0000.0503 highspeed power enable connect
   Port 4: 0000.0503 highspeed power enable connect
Binary Object Store Descriptor:
  bLength                 5
  bDescriptorType        15
  wTotalLength       0x002a
  bNumDeviceCaps          3
  USB 2.0 Extension Device Capability:
    bLength                 7
    bDescriptorType        16
    bDevCapabilityType      2
    bmAttributes   0x00000006
      BESL Link Power Management (LPM) Supported
  SuperSpeed USB Device Capability:
    bLength                10
    bDescriptorType        16
    bDevCapabilityType      3
    bmAttributes         0x00
    wSpeedsSupported   0x000e
      Device can operate at Full Speed (12Mbps)
      Device can operate at High Speed (480Mbps)
      Device can operate at SuperSpeed (5Gbps)
    bFunctionalitySupport   1
      Lowest fully-functional device speed is Full Speed (12Mbps)
    bU1DevExitLat           4 micro seconds
    bU2DevExitLat         231 micro seconds
  Container ID Device Capability:
    bLength                20
    bDescriptorType        16
    bDevCapabilityType      4
    bReserved               0
    ContainerID             {587CC497-A6C3-AC7F-C94B-62860B2679CD}
Device Status:     0x0001
  Self Powered

Bus 001 Device 002: ID 046d:c083 Logitech, Inc. G403 Prodigy Gaming Mouse
Device Descriptor:
  bLength                18
  bDescriptorType         1
  bcdUSB               2.00
  bDeviceClass            0 
  bDeviceSubClass         0 
  bDeviceProtocol         0 
  bMaxPacketSize0        64
  idVendor           0x046d Logitech, Inc.
  idProduct          0xc083 G403 Prodigy Gaming Mouse
  bcdDevice            8.03
  iManufacturer           1 Logitech
  iProduct                2 G403 Prodigy Gaming Mouse
  iSerial                 3 --
  bNumConfigurations      1
  Configuration Descriptor:
    bLength                 9
    bDescriptorType         2
    wTotalLength       0x003b
    bNumInterfaces          2
    bConfigurationValue     1
    iConfiguration          4 U108.03_B0014           
    bmAttributes         0xa0
      (Bus Powered)
      Remote Wakeup
    MaxPower              300mA
    Interface Descriptor:
      bLength                 9
      bDescriptorType         4
      bInterfaceNumber        0
      bAlternateSetting       0
      bNumEndpoints           1
      bInterfaceClass         3 Human Interface Device
      bInterfaceSubClass      1 Boot Interface Subclass
      bInterfaceProtocol      2 Mouse
      iInterface              0 
        HID Device Descriptor:
          bLength                 9
          bDescriptorType        33
          bcdHID               1.11
          bCountryCode            0 Not supported
          bNumDescriptors         1
          bDescriptorType        34 Report
          wDescriptorLength      67
         Report Descriptors: 
           ** UNAVAILABLE **
      Endpoint Descriptor:
        bLength                 7
        bDescriptorType         5
        bEndpointAddress     0x81  EP 1 IN
        bmAttributes            3
          Transfer Type            Interrupt
          Synch Type               None
          Usage Type               Data
        wMaxPacketSize     0x0008  1x 8 bytes
        bInterval               1
    Interface Descriptor:
      bLength                 9
      bDescriptorType         4
      bInterfaceNumber        1
      bAlternateSetting       0
      bNumEndpoints           1
      bInterfaceClass         3 Human Interface Device
      bInterfaceSubClass      0 
      bInterfaceProtocol      0 
      iInterface              0 
        HID Device Descriptor:
          bLength                 9
          bDescriptorType        33
          bcdHID               1.11
          bCountryCode            0 Not supported
          bNumDescriptors         1
          bDescriptorType        34 Report
          wDescriptorLength     151
         Report Descriptors: 
           ** UNAVAILABLE **
      Endpoint Descriptor:
        bLength                 7
        bDescriptorType         5
        bEndpointAddress     0x82  EP 2 IN
        bmAttributes            3
          Transfer Type            Interrupt
          Synch Type               None
          Usage Type               Data
        wMaxPacketSize     0x0014  1x 20 bytes
        bInterval               1
Device Status:     0x0000
  (Bus Powered)

Bus 001 Device 001: ID 1d6b:0002 Linux Foundation 2.0 root hub
Device Descriptor:
  bLength                18
  bDescriptorType         1
  bcdUSB               2.00
  bDeviceClass            9 Hub
  bDeviceSubClass         0 
  bDeviceProtocol         1 Single TT
  bMaxPacketSize0        64
  idVendor           0x1d6b Linux Foundation
  idProduct          0x0002 2.0 root hub
  bcdDevice            5.13
  iManufacturer           3 Linux 5.13.9-arch1-1 xhci-hcd
  iProduct                2 xHCI Host Controller
  iSerial                 1 --
  bNumConfigurations      1
  Configuration Descriptor:
    bLength                 9
    bDescriptorType         2
    wTotalLength       0x0019
    bNumInterfaces          1
    bConfigurationValue     1
    iConfiguration          0 
    bmAttributes         0xe0
      Self Powered
      Remote Wakeup
    MaxPower                0mA
    Interface Descriptor:
      bLength                 9
      bDescriptorType         4
      bInterfaceNumber        0
      bAlternateSetting       0
      bNumEndpoints           1
      bInterfaceClass         9 Hub
      bInterfaceSubClass      0 
      bInterfaceProtocol      0 Full speed (or root) hub
      iInterface              0 
      Endpoint Descriptor:
        bLength                 7
        bDescriptorType         5
        bEndpointAddress     0x81  EP 1 IN
        bmAttributes            3
          Transfer Type            Interrupt
          Synch Type               None
          Usage Type               Data
        wMaxPacketSize     0x0004  1x 4 bytes
        bInterval              12
Hub Descriptor:
  bLength              13
  bDescriptorType      41
  nNbrPorts            16
  wHubCharacteristic 0x000a
    No power switching (usb 1.0)
    Per-port overcurrent protection
    TT think time 8 FS bits
  bPwrOn2PwrGood       10 * 2 milli seconds
  bHubContrCurrent      0 milli Ampere
  DeviceRemovable    0xc0 0x06 0x00
  PortPwrCtrlMask    0xff 0xff 0xff
 Hub Port Status:
   Port 1: 0000.0103 power enable connect
   Port 2: 0000.0100 power
   Port 3: 0000.0503 highspeed power enable connect
   Port 4: 0000.0100 power
   Port 5: 0000.0100 power
   Port 6: 0000.0503 highspeed power enable connect
   Port 7: 0000.0503 highspeed power enable connect
   Port 8: 0000.0100 power
   Port 9: 0000.0103 power enable connect
   Port 10: 0000.0100 power
   Port 11: 0000.0100 power
   Port 12: 0000.0100 power
   Port 13: 0000.0100 power
   Port 14: 0000.0100 power
   Port 15: 0000.0100 power
   Port 16: 0000.0100 power
Device Status:     0x0001
  Self Powered
